id,trending_date,Label,channel_title,category_id,publish_time,tags,views,likes,dislikes,comment_count,thumbnail_link,comments_disabled,ratings_disabled,video_error_or_removed,description,popular_tag
h0xHxZpNAHw,2018-04-07 00:00:00,Sam Smith - Pray (Audio) ft. Logic,SamSmithWorldVEVO,10,2018-03-29 14:00:04,"Sam|""Smith""|""Pray""|""Capitol""|""Pop""",1709430,80528,1115,3843,https://i.ytimg.com/vi/h0xHxZpNAHw/default.jpg,False,False,False,"Listen to Sam Smith's brand new single 'Pray feat. Logic' now: http://samsmith.world/LogicPrayID\n\nSam Smith’s new album, “The Thrill of It All” out now. Listen to the album now: http://samsmith.world/TTOIAPR\n\nFollow Sam Smith: \nhttp://samsmithworld.com \nhttp://facebook.com/samsmithworld \nhttp://instagram.com/samsmithworld \nhttp://twitter.com/samsmithworld \n\nThey never knew my struggle\nRose above the rubble\nRather live inside their bubble \nThan go through the trouble\nOf having their double double vision corrected\nThey just neglect it and\n\nI’ve been thinking lately\nWill the Devil take me?\nOr will God protect me?\nI know I ain’t perfect\nBut you should respect me\nThey don’t want me happy\nThey don’t wanna let me live\n\nI’m young and I’m foolish\nI make bad decisions\nI block out the news\nTurn my back on religion\nDon’t have no degree\nI’m somewhat naïve\nI have made it this far on my own\n\nBut lately that shit ain’t been getting me higher\nI lift up my head and the world is on fire\nThere’s dread in my heart\nAnd fear in my bones\nI just don’t know what to say\n\nMaybe I’ll pray\nPray\nMaybe I’ll pray\nI have never believed in you, no\nBut I’m gonna pray\n\nI am me\nI’m a man\nI’m a sinner\nBut understand\nAren’t we all?\nSo when it comes to passing judgements\nI don’t think that you’re the one to make the call\nHeaven want to cast me out for being me \nI know theres others like me there to break the fall \nI know you hater Motherfuckers just can’t relate at\n\n\nIf I’m the first one to the line that’s fine\nI’ll take it all\nBut Logic he gon’ let ‘em know\nI ain’t perfect\nBut I’m worth it\nI’m alive\nI deserve it\nI’ve been praying \nI ain’t playing\nI don’t think you hear the words that I’m saying\n\nI don’t think you know the weight on my shoulders\nThat gets heavier as I get older\nCalling anybody\nCalling anybody\nCan you hear me?\nI pray that you hear me\nI pray that you hear me\n\nMaybe I’ll pray\nPray\nMaybe I’ll pray\nI’ve never believed in you, no\nBut I’m gonna\n\nWon’t you call me?\nCan we have a one on one please?\nLet’s talk about freedom\nEveryone prays in the end\nEveryone prays in the end\nOh, won’t you call me?\nCan we have a one on one please?\nLet’s talk about freedom\nEveryone prays in the end\nEveryone prays in the end\n\nOh, I’m gonna\nPray\nI’m gonna\nPray\nI’m gonna\nPray\nPray for a glimmer of hope\nMaybe I’ll pray\nPray\nMaybe I’ll pray\nI’ve never believed in you, no\nBut I’m gonna pray\n\nMusic video by Sam Smith performing Pray. © 2018 Universal Music Operations Limited\n\nhttp://vevo.ly/eiIrQH",False
YHdOh90kGHQ,2018-04-07 00:00:00,Kittens,The Slow Mo Guys,24,2018-03-29 16:00:02,"Super Slow Show|""Slow Motion""|""4K""|""Explosion""|""Slo Mo Guys""|""Tony Hawk""|""Kevin Durant""|""Gav & Dan""",965328,59749,914,4277,https://i.ytimg.com/vi/YHdOh90kGHQ/default.jpg,False,False,False,"Cuteness alert! Gav films a group of kittens frolicking in 4K, in the most adorable slow-mo footage ever captured. Check out The Super Slow Show, only on YouTube.",False
UYDAgS2Mr6M,2018-04-07 00:00:00,Mathew Knowles,Wendy Williams,24,2018-03-29 21:00:03,"mathew knowles|""beyonce""|""solange knowles""|""jay-z""|""wendy williams""|""the wendy williams show""|""#youtubeblack""",403559,5577,303,2521,https://i.ytimg.com/vi/UYDAgS2Mr6M/default.jpg,False,False,False,"Mathew Knowles dishes about Beyoncé and Solange, Destiny's Child and his new book.",False
I2sRc3j7IU0,2018-04-07 00:00:00,Crossing A Line (Official Video) - Mike Shinoda,Mike Shinoda,10,2018-03-29 14:00:29,"Mike Shinoda|""Crossing a Line""|""Other""|""Post Traumatic""|""Fort Minor""|""Linkin Park""|""New Song""|""New Album""|""Official Video""|""Music Video""",1669982,91289,1287,5347,https://i.ytimg.com/vi/I2sRc3j7IU0/default.jpg,False,False,False,Crossing A Line (Official Video) - Mike Shinoda\n\nPre-Order Post Traumatic: http://mshnd.co/PT\n\nConcept by Mike Shinoda\nShot & Edited by Aaron Farley\n\n--\n\nCrossing A Line | Lyrics\n\nThey’ll tell you I don’t care anymore\nAnd I hope you’ll know that’s a lie\nCause I’ve found what I have been waiting for\nBut to get there means crossing a line\n\nI don’t know how to warn you / for what I’m gonna say\nCause you’re holding so tight to / what I’m taking away\nI got demons inside me / so I’m faced with a choice\nEither try to ignore them / or I give them a voice\n\nAnd it’s keeping me up at night\nWorried it’s not alright\nHolding back things you don’t know\nAnd it’s keeping me up at night\nWorried it’s not alright\nYou’re not gonna like where this goes\n\nAnd they’ll\nTell you I don’t care anymore\nAnd I hope you’ll know that’s a lie\nCause I’ve found what I have been waiting for\nBut to get there means crossing a line\nSo I’m crossing a line\n\nIt’s not about status / we know it never was\nCause what good is the kingdom / when you’re missing the love\nThis is not a goodbye now / I’m not going away\nNo I don’t have the answers / but I do have the faith\n\nAnd it’s keeping me up at night\nWorried it’s not alright\nHolding back things you don’t know\nAnd it’s keeping me up at night\nWorried it’s not alright\nYou’re not gonna like where this goes\nNO,False
2nUW3nIOOOg,2018-04-07 00:00:00,"2 Chainz - PROUD ft. YG, Offset",2ChainzVEVO,10,2018-03-28 03:30:02,"Chainz|""PROUD""|""2Chainz""|""PS/Def""|""Jam""|""Hip""|""Hop""",9078823,219192,5482,10831,https://i.ytimg.com/vi/2nUW3nIOOOg/default.jpg,False,False,False,"Download and Stream PROUD featuring YG & Offset: https://2Chainz.lnk.to/ThePlayDontCareWhoMakesIt\n\nFollow 2 Chainz:\nhttp://www.2chainz.com/\nhttps://www.facebook.com/2Chainz\nhttps://www.instagram.com/hairweavekiller/\nhttps://twitter.com/2chainz\n\nMusic video by 2 Chainz performing PROUD. © 2018 Def Jam Recordings, a division of UMG Recordings, Inc.\n\nhttp://vevo.ly/vH06nc",False
6_DgXvcfhYg,2018-04-07 00:00:00,Kylie Minogue - Stop Me from Falling (Official Video),KylieMinogueOnVEVO,10,2018-03-30 04:29:14,"Kylie Minogue|""Kylie""|""New Music""|""Pop""|""Girls Aloud""|""Spice Girls""|""Katy Perry""|""Sugababes""|""All Saints""|""Bananrama""|""RuPaul""|""Madonna""|""Diva""|""Taylor Swift""|""Country""|""Dua Lipa""|""Ariana Grande""|""Camila Cabello""|""Beyonce""|""Rita Ora""|""Pink""|""golden""|""dancing""|""album""|""official""|""can't get you out of my head""|""on a night like this""|""spinning around""|""fever""|""i should be so lucky""|""in your eyes""|""all the lovers""|""into the blue""|""loco-motion""|""locomotion""",458939,13518,603,1068,https://i.ytimg.com/vi/6_DgXvcfhYg/default.jpg,False,False,False,"Official video for 'Stop Me From Falling', taken from Kylie's new album 'Golden'.\nOut Now: https://kylie.lnk.to/goldenID\nVisit the Official Store for deluxe and limited edition formats: https://kylie.lnk.to/goldenID/kylieminogue\n\nColin Solal Cardo - Director\nSiobhán Daly - Producer\n\nFollow Kylie:\nhttp://www.kylie.com\nhttps://www.facebook.com/kylieminogue\nhttps://www.instagram.com/kylieminogue\nhttps://twitter.com/kylieminogue\n\nhttp://vevo.ly/6CGSN9",False
2WHcBwq2wHc,2018-04-07 00:00:00,Mo Salah bursts through wall to surprise kids | KOP KIDS PRANK,Liverpool FC,17,2018-03-28 10:57:56,"Liverpool FC|""LFC""|""Liverpool""|""Anfield""|""Melwood""|""Liverpool Football Club""|""Mo Salah""|""Mohamed Salah""|""Salah prank""|""prank""|""surprise""|""kop kids""|""subtitles""|""arabic subtitles""|""liverpool youtube""|""thailand liverpool""|""thai subtitles""|""liverpool indonesia""|""premier league""|""pl""|""epl""|""mohamed sala""|""mo sala""|""moh salah""|""أهداف محمد صلاح""",3919971,94894,1707,0,https://i.ytimg.com/vi/2WHcBwq2wHc/default.jpg,True,False,False,"20 schoolchildren, Premier League star Mohamed Salah, one giant prank and the Liverpool FC video you simply cannot afford to miss.\n\nThis video is available with Arabic, Thai and Indonesian subtitles.\n\nSubscribe to LFC now to get notified about new uploads https://www.youtube.com/subscription_center?add_user=LiverpoolFC",False
70pJZ9w3oGk,2018-04-07 00:00:00,Kylie Minogue - Raining Glitter (Official Audio),Kylie Minogue,10,2018-03-31 05:00:02,"kylie|""kylie minogue""|""golden""|""dancing""|""pop music""|""pop""|""country""|""madonna""|""raining glitter""|""official""|""album""|""video""",131416,5716,91,661,https://i.ytimg.com/vi/70pJZ9w3oGk/default.jpg,False,False,False,"Official audio for 'Raining Glitter'', taken from Kylie's new album 'Golden'. Out now: https://kylie.lnk.to/goldenID\n\nVisit the Official Store for deluxe and limited edition formats: https://kylie.lnk.to/goldenyv/kylieminogue\n\nFollow Kylie:\nhttp://www.kylie.com\nhttps://www.facebook.com/kylieminogue\nhttps://www.instagram.com/kylieminogue\nhttps://twitter.com/kylieminogue",False
JE03bUlN0rM,2018-04-07 00:00:00,The Truth (About FEMA) Is Out There | The Great American* Puerto Rico Part 5,Full Frontal with Samantha Bee,22,2018-03-29 03:10:43,"Full Frontal with Samantha Bee|""Full Frontal""|""Samantha Bee""|""Sam Bee""|""TBS""",272086,1886,99,117,https://i.ytimg.com/vi/JE03bUlN0rM/default.jpg,False,False,False,"FEMA abandoned Puerto Rico. Is it a conspiracy, or is it just FEMA doin' FEMA? David Duchovny wants to believe. Produced by Mike Rubens with Lauren Walker.\n\nWatch Full Frontal with Samantha Bee all new Wednesdays at 10:30/ 9:30c on TBS!",False
PxJrWCSJfBk,2018-04-07 00:00:00,Diplo - Suicidal (feat. Desiigner) (Official Music Video),Diplo,10,2018-03-29 14:17:03,"Suicidal|""Diplo""|""Desiigner""|""Diplo Suicidal feat Desiigner""|""Suicidal Desiigner""|""Desiigner Suicidal""|""Diplo Suicidal""|""Suicidal Diplo""|""Diplo Desiigner""|""Desiigner Diplo""|""Mad Decent""|""Suicidal video""|""Suicidal Official Video""|""california ep""|""diplo california ep""|""desiigner california ep""|""suicidal official video""|""desiigner video""|""diplo video""|""diplo california hip hop ep""|""desiigner music video""|""Diplo - Suicidal (feat. Desiigner) (Official Music Video)""|""diplo muisc""|""desiigner music""",1326598,40536,1269,1041,https://i.ytimg.com/vi/PxJrWCSJfBk/default.jpg,False,False,False,"Official Music Video | Diplo - Suicidal (feat. Desiigner)\n\nSubscribe to Diplo YouTube Channel - http://diplo.fm/YouTube\n\nStream Diplo's California EP - http://diplo.fm/CaliforniaEPStream\nSpotify: http://diplo.fm/CaliforniaEPSP\nDownload: http://diplo.fm/CaliforniaEPDL\nApple Music: http://diplo.fm/CaliforniaEPAP\nAmazon: http://diplo.fm/CaliforniaEPAM\nGoogle Play: http://diplo.fm/CaliforniaEPGO\nSoundcloud: http://diplo.fm/CaliforniaEPSC\n\nLyrics:\nFalling off\nFalling off\nFalling off\nFalling off\n\nI’m falling in buildings \nI’m falling in billions\nI’m falling in trillions \n\nFall off \nFall off\n\nI’m falling in buildings \nI’m falling in billions\nI’m falling in millions \nI’m falling in trillions \n\nSee They Suicidal \nThinking all the killing \nThinking why they hating \nThinking all the drilling \n\nI'm falling in buildings \nI’m falling in millions\nI’m falling in trillions\nI’m falling in billions\n\nSee They Suicidal \nThinking all the killing \nThinking why they hating \nThinking all the drilling \nIm falling off \n\n(VERSE 1)\n\nTrying to hold on the ledge \nAnd I’m falling off \nLife of Desiigner zombie walking \nAnd I’m walking off \n\nYoung nigga behind the mic\nAnd I’m talking off \nGot my walking on\nI’m falling in buildings\n\nTrying hold the ledge and I’m falling off \nLife of Desiigner zombie walking off\nAnd I’m walking off\n\nYoung nigga behind the mic \nand I’m talking off \nYea I'm walking off\nWalking on \n\n(HOOK)\n\nI’m falling in buildings \nI’m falling in billions\nI’m falling in millions \nI’m falling in trillions \n\nSee They Suicidal \nThinking all the killing \nThinking why they hating \nThinking all the drilling \n\n\nI'm falling in buildings \nI’m falling in millions\nI’m falling in trillions\nI’m falling in billions\n\nSee They Suicidal \nThinking all the killing \nThinking why they hating \nThinking all the drilling \n\nIm falling off \n\n(VERSE 2)\n\nForreal\nAll this real\nAll this real we got it\nAll of us in the building\n\nWe fucking up shit in building \nWe in the building\nPut ya hands to the ceiling \nKeep ya hands in the ceiling \n\nTell people who the real me\nShow people who the real is\nShow people what the deal is \nAll that’s forreal\nLong life that’s ill\n\nI get the money I’m going crazy \nLong night hard night shit made me\nDucking slugs, police shit raise me\nStay strong, head focus rich baby\n\nYeah I know I’m the realest \nStay focused in the building \nSee the Sun from a mile away \nWe could run hard I could feel it \n\nRun hard I could hear it\nRun hard I could steer it \nSee my soul floating up \nCan’t feel nothing, just feel the spirit \n\nGo hard or go home baby \nGet rich and get home crazy \nLive fast and live long\nmade me \nLive fast and live long, raised me\n\n(HOOK)\n\nI’m falling in buildings \nI’m falling in billions\nI’m falling in millions \nI’m falling in trillions \n\nSee They Suicidal \nThinking all the killing \nThinking why they hating \nThinking all the drilling \n\nI'm falling in buildings \nI’m falling in millions\nI’m falling in trillions\nI’m falling in billions\n\nSee They Suicidal \nThinking all this killing \nThinking why they hating\nThinking all them drilling \nIm falling off \n \nCredits\nDirector: Shomi Patwary\nExec Producer: Punom Patwary\nLine Producer: Bobby Wiggins\nDirector of Photography / Steadicam: Jon Carr\nCreative Producer, Casting Director: Charlotte Sclapari\nEditor: Omar Jones\nPost VFX / Color: Omar Jones, Airship NYC\n1st AD: Ford Guarino\nProduction Coordinator 1: Charley Feher\nProduction Coordinator 2: James Jimenez\n1st AC: Curran Banach\n2nd Camera: Omar Jones\nGaffer: Anthony Asaro\nKey Grip: Spencer Thrift\nBB Electric: Maxime Pay\nBB: Joe Dibbie\nMUA: Sage White\nHair: Isata Allen\nPA 1: David Adan\nPA 2: Aquil Small\nPA 3: Steve Caraballo\nPA 4: Ryland Kenyon\nDesigner’s Stylist: Marcus Paul\nModel’s Stylist: Yseult Polfliet\nWardrobe Assistant: Kenny McCraney\nDriver: Kelvin Jaquez\nLocation: Arzu Askin",False
paxgKBUK4wQ,2018-04-07 00:00:00,Honest Trailers - Star Wars: The Last Jedi,Screen Junkies,1,2018-03-27 17:00:05,"screen junkies news|""screenjunkies""|""screenjunkies news""|""screen junkies""|""star wars""|""last jedi""|""the last jedi""|""honest trailers""|""honest trailer""|""honest commentaries""|""honest trailers star wars""|""last jedi review""|""star wars review""|""star wars: the last jedi""|""star wars last jedi""|""last jedi trailer""",3207833,80409,6065,18769,https://i.ytimg.com/vi/paxgKBUK4wQ/default.jpg,False,False,False,"In a polarized world, the next installment in a franchise all about balance and non-attachment will be worshipped, hated, and obsessed about until it's not even fun to talk about anymore  - It's Star Wars: The Last Jedi\n\nWatch the Honest Trailer Commentaries to hear the writers thoughts on the movies along with deleted jokes from the trailer and a hint at next week's movie!\nhttps://www.youtube.com/watch?v=hnNt69PxQ8U\n\nVoiceover Narration by Jon Bailey\nOriginal Honest Trailer Voice by Gannon Nickell\nTitle design by Robert Holtby\n\nProducers - Dan Murrell, Spencer Gilbert, Joe Starr, and Max Dionne\nWritten by Spencer Gilbert, Joe Starr, Dan Murrell\nEdited by Kevin Williamsen and TJ Nordaker\n\nGot a tip? Email us ► feedback@screenjunkies.com\nFollow us on Twitter ► http://twitter.com/screenjunkies\nLike us on Facebook ► http://www.fb.com/screenjunkies",False
O02MnrL_wrc,2018-04-07 00:00:00,Louisa - YES (Official Video) ft. 2 Chainz,LouisaJohnsonVEVO,10,2018-03-27 13:00:04,"Louisa feat. 2 Chainz|""Pop""|""Syco Music""|""YES""",684454,23274,606,1167,https://i.ytimg.com/vi/O02MnrL_wrc/default.jpg,False,False,False,"Louisa's official music video for ‘Yes’.\n\nGet your copy on iTunes: http://smarturl.it/YESiTunes \nStream on Spotify: http://smarturl.it/SptfyYES \nGoogle Play: http://smarturl.it/YESGglePlay\nApple Music: http://smarturl.it/YESAppleMusic\n\nStream more music from Louisa here: http://smarturl.it/LouisaSpotify \n\nMore from Louisa\nBest Behaviour: https://youtu.be/1sA7Ojgzzus\nSo Good: https://youtu.be/svhGUlB9V5U\n\nFollow Louisa\nOn Twitter: https://twitter.com/louisa\nOn Instagram: https://www.instagram.com/louisa/\nOn Facebook: https://www.facebook.com/louisaofficial/ \n\nVerse 1\nYo Whatever it is you been thinkin bout me \nI aint playin round no more\nAnd I Guess u found out that I ain’t that innocent\nI been what you’re waiting for \nOoh\n\nHey girls, Wassup\nShe bad, Hands up\nYo boys, uh uh \nEase back, show love\n\nPre\nFeeling so hot, wear a little less\nGot a little something imma get off my chest\nBlame it on my body, got you obsessed\nDo it all night, better gimme respect\n\nWe twenty deep up on this floor\nWe getting wild yeah we getting raw\nYo I can’t breathe still want some more \nIf you’re a freak like me one time lemme hear you say \n\nChorus\nYes\nCome on put your hands up\nHere with all my friends, yup\nWe about to get this started\nYes\nIf u know you can’t stop\nAnd u know you won’t stop\nTake it to the After Party \nYes\nNow we getting all wet\nLove it when I feel sweat\nDripping all over my body\nUh uh uh uh uh uh uh uh uh\nYes\n\nVerse 2\nI don’t care what it is you been thinking about me \nImma get it on this floor more\nGirls if you’re tired of being so damn innocent \nTell me what you waiting for \nOoh\n\nHey girls, Wassup\nShe bad, Hands up\nYo boys, uh uh \nEase back, show love\n\nPre\nFeeling so hot, wear a little less\nGot a little something imma get off my chest\nBlame it on my body, got you obsessed\nI can do it all night, better gimme respect\n\nWe twenty deep up on this floor\nWe getting wild yeah we getting raw\nYo I can’t breathe still want some more \nIf you’re a freak like me one time lemme hear you say \n\nChorus \nYes\nCome on put your hands up\nHere with all my friends, yup\nWe about to get this started\nYes\nIf u know you can’t stop\nAnd u know you won’t stop\nTake it to the After Party \nYes\nNow we getting all wet\nLove it when I feel sweat \nDripping all over my body\nUh uh uh uh uh uh uh uh uh\nYes",False
f55HngFE9YM,2018-04-07 00:00:00,Royce da 5'9 - Boblo Boat ft. J. Cole,RoyceDa59VEVO,10,2018-03-23 21:14:06,"Royce|""da""|""5'9""|""Boblo""|""Boat""|""eOne""|""Music""|""Rap/Hip-Hop""|""J. Cole""|""Eminiem""|""Detroit""|""Eminem""|""rap""|""hip-hop""|""slaughterhouse""|""Joe burden""|""Joel Ortiz""|""bad vs evil""|""Detroit vs everybody""|""layers""|""dreamville""|""real rap""|""token""|""cam'ron""|""hip hopheads""|""worldstar""|""streets""|""the roots""|""2 chains""|""prhyme""|""pryhme""|""dj premiere""|""premo""",4848505,114698,2409,6843,https://i.ytimg.com/vi/f55HngFE9YM/default.jpg,False,False,False,"Music video by Royce 5'9 and J. Cole performing Boblo Boat.\nPreorder the new Royce 5'9 album 'Book of Ryan' - http://smarturl.it/BookofRyan\nGet Boblo Boat - http://smarturl.it/bobloboat\n\nFollow Royce 5'9\nhttps://www.instagram.com/royceda59/\nhttps://twitter.com/Royceda59\nhttps://www.facebook.com/royceda59official\nhttp://www.royce59.com\n\nDirector: J.Cole\nDP: Eric Talesnick\nEditor: Roberta Spitz\nProducer:  Scott Lazer & Kristian Andresen\nExecutive Producer: Akino Childrey\nProduction Company: Dreamville\n\n2018 Heaven Studios, Inc. & Entertainment One U.S., LP\nhttp://vevo.ly/LkYjUZ",False
oQGA42-U0Ro,2018-04-07 00:00:00,The House with a Clock in Its Walls - Official Trailer 1,Universal Pictures,24,2018-03-27 14:59:58,"the house with a clock in its walls|""house with a clock in its walls""|""house with a clock in its wall""|""house with a clock""|""house with a clock movie""|""the house with a clock movie""|""clock movie""|""clocks movie""|""jack black""|""jack black movie""|""new jack black movie""|""cate blanchett""|""cate blanchett movie""|""jack black clock movie""|""eli roth""|""eli roth movie""|""amblin movie""|""universal pictures movie""|""kyle maclachlan""|""owen vaccaro""|""john bellairs""",980256,14055,488,882,https://i.ytimg.com/vi/oQGA42-U0Ro/default.jpg,False,False,False,"The House with a Clock in Its Walls - In theaters September 21\nOfficial site - housewithaclock.com\n\nIn the tradition of Amblin classics where fantastical events occur in the most unexpected places, Jack Black and two-time Academy Award® winner Cate Blanchett star in The House with a Clock in Its Walls, from Amblin Entertainment.  The magical adventure tells the spine-tingling tale of 10-year-old Lewis (Owen Vaccaro) who goes to live with his uncle in a creaky old house with a mysterious tick-tocking heart.  But his new town’s sleepy façade jolts to life with a secret world of warlocks and witches when Lewis accidentally awakens the dead.\n\nBased on the beloved children’s classic written by John Bellairs and illustrated by Edward Gorey, The House with a Clock in Its Walls is directed by master frightener Eli Roth and written by Eric Kripke (creator of TV’s Supernatural).  Co-starring Kyle MacLachlan, Colleen Camp, Renée Elise Goldsberry, Vanessa Anne Williams and Sunny Suljic, it is produced by Mythology Entertainment’s Brad Fischer (Shutter Island) and James Vanderbilt (Zodiac), as well as Kripke.\n\nExecutive produced by William Sherak, Tracey Nyberg and Laeta Kalogridis, The House with a Clock in Its Walls will be released by Universal Pictures.\n\n#HouseWithAClock",False
EhSXsTSNDyo,2018-04-07 00:00:00,5 Seconds Of Summer - Want You Back (Official Video),5SOSVEVO,10,2018-03-27 13:00:01,"5SOS|""5 Seconds of Summer""|""Want You Back""|""Official Video""|""Official""|""Video""|""Want""|""You""|""Back""|""Luke Hemmings""|""Ashton Irwin""|""Michael Clifford""|""Calum Hood""|""Ash""|""Luke""|""Calum""|""Mikey""",4611406,346614,3165,26154,https://i.ytimg.com/vi/EhSXsTSNDyo/default.jpg,False,False,False,"Listen, stream and download the brand new single from 5SOS here: https://5sosuk.lnk.to/WYBID\n\nLyrics:\n\nCan’t help but wondering \nif this is the last time that I’ll see your face\nIs it tears or just the fucking rain (‘POURING’ CLEAN)\nWish I could say something\nSomething that doesn’t sound insane\nBut lately I don’t trust my brain\nYou told me I won’t ever change\nSo I just say nothing\nNo matter where I go, I’m always gonna want you back\nNo matter how long you’re gone, I’m always gonna want you back\nI know that you know, I will never get over you\nNo matter where I go, I’m always gonna want you back\nWant you back\nI remember the freckles on your back\nAnd the way that I used to make you laugh\nCos you know every morning I wake up\nYeah I still reach for you\nI remember the roses on your shirt\nWhen you told me this would never work\nYou know, even when I say I’ve moved on \nYeah I still dream for you\nNo matter where I go, I’m always gonna want you back\nNo matter how long you’re gone, I’m always gonna want you back\nI know that you know, I will never get over you\nNo matter where I go, I’m always gonna want you back, want you back\nYou know even when I say I’ve moved on\nYou know even though I know that you’re gone\nAll I think about is where I went wrong\nYou know even when I say I’ve moved on\nYou know even though I know that you’re gone\nAll I think about is where I went wrong\nYeah I still dream for you\nNo matter where I go, I’m always gonna want you back\nNo matter where I go, I’m always gonna want you back\nNo matter how long you’re gone, I’m always gonna want you back\nI know that you know, I will never get over you\nNo matter where I go, I’m always gonna want you back\nWant you back\nI’m always gonna want you back\nWant you back\n\nFollow us on the Official 5SoS social channels:\nYT VEVO: http://5sosf.am/YTVevo\nYT Official: http://5sosf.am/OffYT\nVEVO Channel: http://5sosf.am/OffVEVO\nWebsite: http://5sosf.am/Home\nSnapchat: weare5sos\nIG: http://5sosf.am/IG\nTW: http://5sosf.am/TW\nFB: http://5sosf.am/FB\n\nMusic video by 5 Seconds Of Summer performing Want You Back. © 2018 One Mode Productions Limited, under exclusive licence to Universal Music Operations Limited\n\nhttp://vevo.ly/LKjr8V",False
