id,trending_date,Label,channel_title,category_id,publish_time,tags,views,likes,dislikes,comment_count,thumbnail_link,comments_disabled,ratings_disabled,video_error_or_removed,description,popular_tag
NBkC83-vh9A,2017-12-25 00:00:00,SICARIO 2: SOLDADO Trailer (2018),FilmSelect Trailer,24,2017-12-19 14:16:34,"trailer|""2018""|""movie""|""filmselect""|""SICARIO 2""|""Soldado""|""benicio del toro""|""sicario 2 trailer""|""thriller""|""action""|""josh brolin""",346516,3750,128,650,https://i.ytimg.com/vi/NBkC83-vh9A/default.jpg,False,False,False,SICARIO 2: Soldado Trailer (2018),False
CYebJBcLZHA,2017-12-25 00:00:00,In Disaster There is Opportunity - Finding a Path Through Paralysis | Martyn Ashton | TEDxBristol,TEDx Talks,29,2017-12-19 15:56:46,"TEDxTalks|""English""|""Life""|""Achievement""|""Adventure""|""Disability""|""Goal-setting""|""Humor""|""Mobility""|""Motivation""|""Sports""",48984,3212,17,179,https://i.ytimg.com/vi/CYebJBcLZHA/default.jpg,False,False,False,"Martyn explains the unbelievable challenge presented by a career ending injury, and how he used a unique approach to tackle it. “If I’m going to be paralysed, then I may as well be good at it!”\n\nTaking us through the antics of a man searching for a way to face the test of a lifetime, using the instinct of a competitor, plus the enjoyment and passion of a sportsman to not only discover new things but to ultimately find his way back to the sport he loves most, riding bikes.\n\nMartyn has been a professional Mountain Biker since 1992 and in that time has won a World Championship and numerous British Titles. However he’s probably best known for his live stunt shows and his highly successful YouTube video series ‘Road Bike Party’ films in which he takes highly expensive (and fragile) carbon road bikes on an exhilarating journey of stunts, obstacles and vertigo inducing skill that the viewer could never expect.\n\nHowever, in 2013 Martyn suffered a spinal cord injury whilst performing in a live stunt show. The accident seemingly ended his riding career, leaving him paralysed from the waist down and confined to a wheelchair for the rest of his life… but in his own words\n\n“Who would have thought that my greatest days of riding were ahead of me?” \n\nThis talk is from TEDxBristol 2017: Dare To Disrupt. In a world of constant change and uncertainty, these are the ‘positive disruptors’ ripping up the rule book to challenge received wisdom, demand better, and transform seemingly insurmountable problems into break-through possibilities and new beginnings.\n\nFrom making a big splash on single-use plastics, to a global campaign to end unwanted hair-touching, or a revolutionary approach to combining robotics with human creativity, we hope you’ll enjoy and feel inspired by these talks. \n\nWatch all our talks here https://tedxbristol.com/talks\n\nOur talks were produced, filmed and edited by a brilliant team of talented volunteers and pro-bono partners:\n\nProduced by: \n\nMel Rodrigues, Curator TEDxBristol\nDaniel Edmund, Assistant Curator, TEDxBristol\nSamuel Williams, Hodos Consultancy\nBarney Grenfell, Hodos Consultancy\n\nFilmed and edited by  Floating Harbour Films:\n\nRichard da Costa\nBen Scrase\nTom Young\nDan O’Connell\nGareth Croft\n\nWith camerawork and production support from: \nSteve Webb\nGiles Edwards\nBath Spa University\n\nThis talk was given at a TEDx event using the TED conference format but independently organized by a local community. Learn more at http://ted.com/tedx\n\n Martyn has been a professional Mountain Biker since 1992 and in that time has won a World Championship and numerous British Titles. However he’s probably best known for his live stunt shows and his highly successful YouTube video series ‘Road Bike Party’ films in which he takes highly expensive (and fragile) carbon road bikes on an exhilarating journey of stunts, obstacles and vertigo inducing skill that the viewer could never expect. This talk was given at a TEDx event using the TED conference format but independently organized by a local community. Learn more at https://www.ted.com/tedx",False
C4ZN-2MrgBA,2017-12-25 00:00:00,Please DO try this at home! ** World Record**,Nile Wilson,17,2017-12-19 16:00:03,"nile wilson|""nile wilson gymnastics""|""nile wilson olympics""|""olympic gymnast""|""amazing gymnastics""|""gymnastics""|""strength training""|""strength""|""hard work""|""vlogging""|""vlog""|""success""|""fitness""|""gymnastics challenge""|""ultimate gymnastics challenge""|""home conditioning""|""get fit at home""|""ultimate home conditioning""|""keep fit over christmas""|""partner training""",268928,10421,251,415,https://i.ytimg.com/vi/C4ZN-2MrgBA/default.jpg,False,False,False,"➢ NEIL & NILE- https://www.youtube.com/channel/UCRSSEcNnFKURWw1NZ7DpRCg\n➢ Join my FREE 7 Steps to Success - http://www.bodybible.life/\n➢ Merch- http://www.nwclothing.co.uk/\n➢ Enquiries - luke@activatemanagement.co.uk\n➢R&B- https://open.spotify.com/user/1177145901/playlist/0DqvE5p0HqNfDbE3sS8rKZ\n➢House - https://open.spotify.com/user/1177145901/playlist/2Vw8Wv059AoDWKJRaBTfzE\n➢ Handstand Programme 🤸🏼‍♂️https://bodybible.life/individual-programmes-2/\n➢ Depop -https://www.depop.com/joannaj\n➢ Gymnastics Gear ~ https://www.turn-gymnastics.com/\n➢ Intro Song ~ Tom Zanetti, Darlin'\n➢ Soundcloud ~ https://soundcloud.com/nile-wilson-2/sets/wobblers\n➢Instagram https://instagram.com/nilemw/\n➢ Body Bible instagram https://www.instagram.com/nw_bodybible/\n➢Twitter https://twitter.com/NileMW\n➢Facebook https://www.facebook.com/NileWilsonGy…\n➢SnapChat - nilewilson\n➢Songs ~ https://www.youtube.com/user/officialdjwelshy",False
cntsqw7XOF0,2017-12-25 00:00:00,Dashboard Confessional: We Fight [OFFICIAL VIDEO],Fueled By Ramen,10,2017-12-20 15:00:35,"Dashboard Confessional|""Dashboard""|""Chris Carrabba""|""Chris Caraba""|""Chris Carraba""|""Dashboard Music""|""Dashbaord Band""|""New Dashboard Confessional Song""|""New Song""|""new single""|""We Fight""|""Crooked Shadows""|""We Fight Song""|""official video""|""We fight our way in""|""we fight our way out""|""Fueled By Ramen""|""FBR""|""DC""|""New FBR signing""|""fueled by""|""dashboard signs with FBR""|""New Dashboard Record""|""New Dashboard Confessional""|""New Dashboard Album""|""New Dashboard Confessional Album""|""New dashboard track""|""emo""",116900,6258,258,441,https://i.ytimg.com/vi/cntsqw7XOF0/default.jpg,False,False,False,"Dashboard Confessional's official music video for their single 'We Fight' from their upcoming album Crooked Shadows - available February 9, 2018 via Fueled By Ramen. http://smarturl.it/WeFight\n\nStream/Download 'We Fight' now on:\n\nSpotify: http://smarturl.it/WeFight_sp\nApple Music: http://smarturl.it/WeFight_am\nAmazon: http://smarturl.it/WeFight_az\niTunes: http://smarturl.it/WeFight_it\nGoogle Play: http://smarturl.it/WeFight_gp\n\nConnect with Dashboard Confessional on:\nFacebook: http://www.facebook.com/dashboardconfessional\nTwitter: https://twitter.com/dashboardmusic\nInstagram: https://www.instagram.com/dashboardconfessional\nYouTube: https://www.youtube.com/dashboardconfessional \n\nDirected By: David Mack\nArt & Animation Editor, Animator: Zu Orzu\nInvisible Friend Production House\n\nLYRICS\n\nWe were the kids\nThat left home\nProlly too young\n \nBut we took our share\nAnd maybe then some\n \nTired of beatings\nAnd battles\nAnd being sewn up\n \nBut that made us grow up\nAnd that made em scared\n \nCause\nWe never learned to keep our voices down\nNo\nWe only learned to shout\nSo\nWe fight our way in\nAnd\nWe fight our way out\n \nAnd\nWe earned what we could\nFrom the ground up\nAnd tried to lift the whole damn crowd\nUp\nSo we fight our way in\nAnd\nWe fight our way out\n \nAnd there's still a kid\nSomewhere\nThat needs to hear this\n \nThat somebody cares\nThat somebody knows\n \nWho's\ntired of bleeding\nAnd battered\nAnd being torn up\n \nJust pick yourself up\nIt's time to go\n \nCause\nWe never learned to keep our voices down\nNo\nWe only learned to shout\nSo\nWe fight our way in\nAnd\nWe fight our way out\n \nAnd\nWe earned what we could\nFrom the ground up\nAnd tried to lift the whole damn crowd\nUp\nWe fight our way in\nAnd\nWe fight our way out\n \nMaybe we found a way to make some tracks.\nWe didn't snicker and turn our backs.\nWe just keep digging in and giving back.\n \nCause\nWe never learned to keep our voices down\nNo\nWe only learned to shout\nSo\nWe fight our way in\nAnd\nWe fight our way out\n \nAnd\nWe earned what we could\nFrom the ground up\nAnd tried to lift the whole damn crowd\nUp\nWe fought our way in\nAnd\nWe fight our way out\n \nCause\nWe never learned to keep our voices down\nNo\nWe only learned to shout\nSo\nWe fight our way in\nAnd\nWe fight our way out\n \nWe fight our way in\nWe fight our way in\n \nWe fight our way out\nWe fight our way out",False
Bzu4G8uZs-4,2017-12-25 00:00:00,"Selena Gomez, Marshmello - Wolves",SelenaGomezVEVO,10,2017-12-20 05:00:00,"Selena|""Gomez""|""Marshmello""|""Wolves""|""Interscope""|""Records""|""Pop""",1319240,102960,1170,3587,https://i.ytimg.com/vi/Bzu4G8uZs-4/default.jpg,False,False,False,"Get ‘Wolves,' out now: http://smarturl.it/WolvesSG \nGet exclusive Selena Gomez merch, available at: http://smarturl.it/SelenaStore\nSign-up to be the first to hear news from Selena: http://smarturl.it/SelenaGomez.News\n\nBest of Selena Gomez https://goo.gl/mgJg2s\nSelena Gomez Audio https://goo.gl/dmJYbd\nSubscribe for more https://goo.gl/2bTupr\n\nMusic video by Selena Gomez, Marshmello performing Wolves. (C) 2017 Interscope Records\n\nhttp://vevo.ly/reSFfR",False
INRXOIgmNUU,2017-12-25 00:00:00,A Festive Effortless Chat with TimH - COLLABMAS DAY 10!,Daniel J. Layton,22,2017-12-20 19:49:41,"vlog|""vlogger""|""comedy""|""christmas""|""vlogmas""",23423,2166,9,65,https://i.ytimg.com/vi/INRXOIgmNUU/default.jpg,False,False,False,The ghost of Christmas Past and I talk all things festive.\n\nFOLLOW ME from a safe distance and preferably not in person:\nTWITTER: http://twitter.com/DanielJLayton\nFACEBOOK: http://facebook.com/DJLActor\nTUMBLR: http://danieljlayton.tumblr.com\nINSTAGRAM: http://instagram.com/danieljlayton\n\nMusic by EpidemicSound.,False
GLZZn7lCtcI,2017-12-25 00:00:00,FLOYD MAYWEATHER KILLS UFC TALK; DENIES DANA WHITE CLAIM: I'M NOT DOING IT,FightHype.com,17,2017-12-20 20:43:52,"Floyd Mayweather Jr.|""Dana White""|""Boxing""|""UFC""|""MMA""|""FightHype""",80865,321,50,430,https://i.ytimg.com/vi/GLZZn7lCtcI/default.jpg,False,False,False,"That's not what I said....exactly what I said is this, if I made over a billion dollars before, I could do it again...if I chose to get in the UFC and fight 3 fights or fight 4 fights and then fight Conor McGregor, I could make a billion dollars, which I can...we just don't know what the future holds for Floyd Mayweather...I'm just saying I could; I'm not doing it, but I'm saying what I could do to make a billion dollars quick...I never said I was going to fight in the UFC...would and could do is different things...I'm not going to do it though, stated promoter and future Hall of Famer Floyd Mayweather, who commented on recent reports that he's currently in talks with the UFC. Check it out!",False
jbeEE0RaEeA,2017-12-25 00:00:00,Spoiler Mode - Star Wars Episode VIII The Last Jedi,Easy Allies,20,2017-12-21 08:34:27,"Easy Allies|""Star Wars""|""The Last Jedi""|""Episode VIII""|""spoilers""",19414,865,86,894,https://i.ytimg.com/vi/jbeEE0RaEeA/default.jpg,False,False,False,"After seeing one of the most divisive Star Wars films ever, the allies have lots of opinions. Some of us loved the way it steered the story in a radically new direction, others weren't fans of the humor or sub-plots. Can they find balance?\n\nSupport us through Patreon: https://www.patreon.com/EasyAllies\nSchedule: http://easyallies.com/\nMerchandise: http://shop.spreadshirt.com/easyallies\n\nLive streams - https://www.twitch.tv/easyallies\nStream archives - https://www.youtube.com/easyalliesplays\nhttps://twitter.com/easyallies\nhttps://www.facebook.com/easyallies",False
JRAOdRq-1lw,2017-12-25 00:00:00,HOSTILES ON THE HILL — A Bad Lip Reading of The Empire Strikes Back,Bad Lip Reading,23,2017-12-18 15:44:42,"star wars|""last jedi""|""bad lip reading""|""lip sync""|""lip dub""|""comedy""|""song""|""music""|""luke rap""|""snowspeeder""|""hoth""",1569714,62529,1285,4637,https://i.ytimg.com/vi/JRAOdRq-1lw/default.jpg,False,False,False,"An extended version of Luke's snowspeeder rap, originally seen here: https://youtu.be/UkiI2vM2lfA Brought to you by GEICO\nFollow on Twitter! http://twitter.com/badlipreading\nFollow on Instagram: @badlipreading\nLike on Facebook! http://www.facebook.com/badlipreading",False
aP0izmLk-Q8,2017-12-25 00:00:00,Ellen Is in Justin Bieber’s 'Mistletoe',TheEllenShow,24,2017-12-19 14:00:00,"ellen|""ellen degeneres""|""the ellen show""|""ellen fans""|""ellen tickets""|""ellentube""|""ellen audience""|""justin bieber""|""justin""|""bieber""|""mistletoe""|""beliber""|""funny""|""music video""|""christmas""|""holidays""|""holiday""|""songs""|""song""|""spoof""|""esmms""|""show me more""|""show me more show""|""show""|""me""|""more""",474865,21881,298,710,https://i.ytimg.com/vi/aP0izmLk-Q8/default.jpg,False,False,False,Guess who snuck into Justin Bieber’s music video?,False
jyTqvjvj8sM,2017-12-25 00:00:00,Home For Christma(saurus)!,Carrie Hope Fletcher,24,2017-12-20 00:32:47,"carrie hope fletcher|""christmas""|""the addams family""|""singapore""|""travel""|""london""|""shopping""|""vlog""|""christmasaurus""|""tom fletcher""|""giovanna fletcher""|""matt willis""|""busted""|""mcfly""|""mcbusted""|""songs""|""singing""|""acting""|""theatre""|""hammersmith apollo""|""musical theatre""|""family""|""fletchers""",86378,4323,37,216,https://i.ytimg.com/vi/jyTqvjvj8sM/default.jpg,False,False,False,♥ Concert ♥\nclub11.london/chf2018 \n\n♥ Eugenius ♥\nhttp://www.theotherpalace.co.uk\n\n♥ The Hopeful Shop ♥\nhttp://www.thehopefulshop.com\n\n♥ The Christmasaurus ♥\nhttps://www.eventimapollo.com/events/detail/the-christmasaurus-live-on-stage#b5SQlTifHpqlRdkQ.97\n\nAmazon: http://po.st/ChristmasaurusAmazon\nTesco: http://po.st/ChristmasaurusTesco\nWaterstones: http://po.st/ChristmasaurusWaterstones\nWHSmith: http://po.st/ChristmasaurusWHSmith\n \n\n♥ PO Box ♥ \nCarrie Hope Fletcher C/O Helen Clarkson\nHaymarket House\n28-29 Haymarket\nLondon SW1Y 4SP\n\n♥ MY SOCIAL MEDIA ♥\nTwitter: http://twitter.com/Carriehfletcher\nSnapchat: ItsWayPastMyBed\nTumblr: http://www.carriehopefletcher.com\nFacebook: http://www.facebook.com/itswaypastmyb...\nInstagram: http://instagram.com/carriehopefletcher\nBlog: http://www.AllIKnowNow.com\n\n♥ OTHER CHANNELS ♥\nSecond channel: http://www.youtube.com/twentythirtytwo,False
pNpsjMnO7mU,2017-12-25 00:00:00,Jason Whitlock weighs in on LaVar Ball's idea of starting a basketball league | SPEAK FOR YOURSELF,Speak For Yourself with Cowherd and Whitlock,17,2017-12-20 23:42:53,"fox|""fox sports""|""fs1""|""fox sports 1""|""colin cowherd""|""speak for yourself""|""cowherd""|""jason whitlock""|""whitlock""|""sfy""|""sports""|""news""|""nba""|""high school""|""basketball""|""lavar ball""|""bbb""|""kristine leahy""|""jason mcintyre""|""ball brothers""|""lebron""|""james""|""lebron james""|""lavar""|""ball""|""jason""|""colin""|""lonzo ball""|""league""|""idea""|""starting""|""jason whitlock fs1""|""sfy fs1""",38941,359,767,500,https://i.ytimg.com/vi/pNpsjMnO7mU/default.jpg,False,False,False,"Jason Whitlock joins Colin Cowherd, Kristine Leahy and Jason McIntyre to discuss LaVar Ball's idea of starting a basketball league to compete with the NCAA. Plus, hear their thoughts on LeBron's minutes played this season.\n\nSUBSCRIBE to get the latest Speak for Yourself content: https://www.youtube.com/sfy?sub_confirmation=1\n\n►Watch the latest content from Speak for Yourself: https://www.youtube.com/playlist?list=PLOiPLkfh0IRponLR54NlvjGCt_77i_lfS\n►NBA: https://www.youtube.com/playlist?list=PLOiPLkfh0IRoo-_wImC_ve2A0Xb1lvihW\n►UFC: https://www.youtube.com/playlist?list=PLOiPLkfh0IRpHxsv5ymGAD1tMfzUk7VEI\n \n►UNDISPUTED’s YouTube channel: https://www.youtube.com/undisputedonfs1\n►The Herd with Colin Cowherd’s YouTube channel: https://www.youtube.com/colincowherd\n \nFollow Colin Cowherd on Twitter: @ColinCowherd\nFollow Jason Whitlock on Twitter: @WhitlockJason\nFollow Jason McIntyre on Twitter: @jasonrmcintyre\n \nAbout Speak for Yourself:\nSpeak for Yourself is a one-hour sports debate show starring Colin Cowherd, Jason Whitlock and Jason McIntyre on FS1. Every day, Colin Cowherd and Jason Whitlock will debate the day’s hottest topics in sports and offer their unfiltered takes and some outrageous opinions from Jason McIntyre.",False
d5w7iCkHvaU,2017-12-25 00:00:00,Darya Folsom and caller LAUGH! at diddy move to buy Panthers..( He look like he just smoke a blunt),Peter Parker Tube,22,2017-12-18 20:57:53,"diddy|""panthers""|""steph curry""|""buy panthers""|""nfl""|""new station""|""remarks""|""he looks high""|""2017""|""December 18""|""everyday struggle""|""breakfast club""|""matter""|""bad remarks""",52911,35,80,46,https://i.ytimg.com/vi/d5w7iCkHvaU/default.jpg,False,False,False,"December 18, 2017",False
3mUtNE82ZV4,2017-12-25 00:00:00,Christian Bale: Division Is Not The Way To Go,BUILD Series,24,2017-12-18 22:25:08,"AOL Advertising|""BUILDseriesNYC""|""AOL Inc""|""AOL""|""AOLBUILD""|""#Aolbuild""|""build speaker series""|""build""|""aol build""|""content""|""aolbuildlive""|""BUILDSeriesNYC""|""Rosamund Pike""|""2017""|""entertainment""|""Wes Studi""|""RickyC""|""cheyenne""|""chief""|""war""|""horses""|""western""|""drama""|""Rosalie Quaid""|""costar""|""actor""|""actress""|""acting""|""film""|""movie""|""adventure""|""dramatic""|""Chief Yellow Hawk""|""1892""|""Army captain""|""Le Grisbi Productions""|""Waypoint Entertainment""|""Entertainment Studios Motion Pictures""|""stars""|""role""|""Christian Bale""|""Scott Cooper""|""director""|""star""",5904,51,27,31,https://i.ytimg.com/vi/3mUtNE82ZV4/default.jpg,False,False,False,The actor says our culture will be richer when we can stop saying it's old white dudes who are running things.,False
GRkHQ3RCW34,2017-12-25 00:00:00,Spoony & April Review Star Wars The Last Jedi (12-17-17),Noah Antwiler,1,2017-12-21 03:11:04,"Noah Antwiler|""Spoony""|""Spoony Experiment""|""Star Wars""|""Last Jedi""|""vlog""|""review""|""movie review""",26551,0,0,0,https://i.ytimg.com/vi/GRkHQ3RCW34/default.jpg,True,True,False,Will the new Star Wars movie survive the test of time? Will it even survive 24 hours?,False
B-t4bU3-lHA,2017-12-25 00:00:00,Ben Shapiro​ Reviews Star Wars: The Last Jedi (SPOILERS),The Daily Wire,24,2017-12-18 23:26:30,"ben shapiro|""star wars""|""the last jedi""|""last jedi""|""luke skywalker""|""spoilers""|""spoiler alert""|""spoiler""|""han solo""|""leia""|""princess leia""|""carrie fisher""",451886,13958,2039,6459,https://i.ytimg.com/vi/B-t4bU3-lHA/default.jpg,False,False,False,Ben Shapiro gives his detailed review of the latest Star Wars movie.,False
UTNnhZqTY5c,2017-12-25 00:00:00,Tyron Woodley Is All For Floyd Mayweather in the UFC | The Hollywood Beatdown,TMZSports,17,2017-12-20 20:07:32,"TMZ|""TMZ Sports""|""TMZ Sports Channel""|""TMZ 2017""|""TMZ Sports 2017""|""Celebrity""|""Sports""|""Athletes""|""TMZ News""|""Famous""|""Hall of Fame""|""Sports News""|""TMZ 2016""|""TMZ2016FS11221""|""the hollywood beatdown""|""tyron woodley""|""ufc tyron woodley""|""ufc""|""ufc champion""|""welterweight""|""floyd mayweather""|""floyd mayweather fight""|""floyd mayweather ufc""|""floyd mayweather mma""|""dana white""|""ufc fight""|""tyron woodley fight""|""mma fight""|""ufc 219""",17915,170,27,169,https://i.ytimg.com/vi/UTNnhZqTY5c/default.jpg,False,False,False,"Every Friday on TMZ Sports UFC Welterweight Champion Tyron The Chosen One Woodley dishes on his favorite stories in the world of Hollywood and Sports. Tyron Woodley weighs in on the reports that Floyd Mayweather is nearing a deal with the...UFC?! See who Tyron thinks Floyd should fight if he were to take a UFC deal and more on The Hollywood Beatdown! \n\nSUBSCRIBE -- http://po.st/TMZSportsSubscribe\n\nAbout TMZ Sports:\nSome of the best stories in sports have been off the field and we’re reporting on athletes from NFL, NBA, UFC, WWE, MLB and more!  \n\nSubscribe to TMZ Sports on YouTube for the latest news, exclusive interviews, clips from TMZ Sports on FS1 and videos of your favorite athletes and celebs. \n\nNeed More TMZ?\nTMZ Sports Website: http://po.st/TMZSportsWebsite\nLIKE TMZ Sports on Facebook!http://po.st/TMZSportsLike\nFOLLOW TMZ on Twitter! http://po.st/TMZFollow\nFOLLOW TMZ on Instagram! http://po.st/TMZInsta\nTMZ on TV & TMZ Sports on FS1 Tune In Info: http://po.st/TMZOnAir\nTMZ is on iOS! http://po.st/TMZiOS\nTMZ is on Android! http://po.st/TMZonAndroid\n\nGot a Tip?\nContact TMZ: http://po.st/TMZTip\n\nCheck out TMZ, TMZ Live, and toofab!\nTMZ: http://po.st/TMZWebsite\nSubscribe! TMZ: http://po.st/TMZSubscribe\nTMZ Live: http://po.st/TMZLiveWebsite\nSubscribe! TMZ Live: http://po.st/TMZLiveSubscribe\nToofab: http://po.st/toofabWebsite\nSubscribe! toofab: http://po.st/toofabSubscribe\n\nhttps://www.youtube.com/c/tmzsports",True
nuKhpdLgR2U,2017-12-25 00:00:00,The Diplomats - Once Upon A Time (Official Video),EMPIRE,10,2017-12-19 17:06:03,"Dipset|""The Diplomats""|""Diplomats""|""Rap""|""Hip-Hop""|""New""|""2017""|""New York""|""Jim Jones""|""Cam'ron""|""Official""|""Music Video""|""EMPIRE""|""Kid Art""|""Once Upon A Time""|""Zekey""|""Juelz Santana""",263610,7432,257,1119,https://i.ytimg.com/vi/nuKhpdLgR2U/default.jpg,False,False,False,"Stream the new single, Once Upon A Time. Out Now!\niTunes: https://itunes.apple.com/us/album/once-upon-a-time-single/1313092820?uo=4&at=1001l3Iq&ct=888915490365&app=itunes\nSpotify: https://open.spotify.com/album/57MK5b1TlijJzqBcz0ex6D\nGoogle Play: https://play.google.com/store/music/album?id=Bsjv4uxvvxpy3yidtbrw7aa26jq&tid=song-Tk4mfjdznwh5fsmcfnyagjtzznm&PAffiliateID=1101l3z7&PCamRefID=888915490365\n\nDirected by Kid Art & Jim Jones\n\nOfficial Music Video by The Diplomats - Once Upon A Time. © 2017 Diplomats",False
4pq_VGpPooM,2017-12-25 00:00:00,Suspended: My apology,xQcOW,20,2017-12-19 08:06:02,"overwatch|""overwatchleague""|""competitive""|""reddit""|""rascal""|""bastion""|""throwing""|""jake""|""banned""|""suspension""|""xqc""|""twitch""",255023,13546,1081,2475,https://i.ytimg.com/vi/4pq_VGpPooM/default.jpg,False,False,False,"One take, no script, no editing of any sort. Straight from the heart and not requested by anyone. No monetization on this video, I will do not want to make a profit out of an apology. Sorry to the fans, my teammates Rascal himself and everyone that was upset by the recent events.\n\nhttps://twitter.com/xQc\n\nhttps://www.twitch.tv/xqcow",False
EENwBr3Mp2o,2017-12-25 00:00:00,"Samoa Joe, Sheamus and Cesaro brutalize Dean Ambrose in the trainer's room: Raw, Dec. 18, 2017",WWE,17,2017-12-19 04:09:56,"wwe|""world wrestling entertainment""|""wrestling""|""wrestler""|""wrestle""|""superstars""|""कुश्ती""|""पहलवान""|""डब्लू डब्लू ई""|""मैच""|""सुपरस्टार""|""व्यावसायिक कुश्ती""|""مصارعه""|""Raw""|""Samoa Joe""|""Sheamus""|""Cesaro""|""Dean Ambrose""|""Seth Rollins""|""wwe raw""|""wwe raw highlights""|""monday night raw""|""the shield""",415700,5350,798,659,https://i.ytimg.com/vi/EENwBr3Mp2o/default.jpg,False,False,False,The Samoan Submission Machine and The Bar exacerbate The Lunatic Fringe's arm injury.\nGet your first month of WWE Network for FREE: http://wwenetwork.com\nSubscribe to WWE on YouTube: http://bit.ly/1i64OdT\nVisit WWE.com: http://goo.gl/akf0J4\nMust-See WWE videos on YouTube: https://goo.gl/QmhBof,False
QODABIgXtCM,2017-12-25 00:00:00,My Babies | Name Reveal | MOTHERHOOD,Sprinkleofglitter,26,2017-12-18 12:17:32,"sprinkleofglitter|""sprinkle of glitter""|""sprinkle of chatter""|""baby glitter""|""Louise Pentland""|""inspiring-androids-classy-spirits""|""name reveal""|""baby name reveal""|""baby girl name reveal""|""louise pentland baby""|""louise pentland baby name""",515529,37333,602,3787,https://i.ytimg.com/vi/QODABIgXtCM/default.jpg,False,False,False,"We are so excited to soon be welcoming our little Pearl and I'm so glad to finally share her name with you all- I've been keeping it a secret since July! \n\nIn case you missed the other names in this video we have our cats Rocket, Milky and Orbit, my beautiful 6 year old Daughter Darcy and of course, Pearl. \n\nAnnouncing this pregnancy all those months ago - https://www.youtube.com/watch?v=nXgZIzP1adI\n\nMore Me - \n\nTwitter - https://twitter.com/LouisePentland\nInstagram - https://www.instagram.com/louisepentland/\nFaceBook - https://www.facebook.com/louisepentland/\nSnapchat - LouisePentland\nRobin Wilde - http://louisepentlandnovel.com/\n\n***PO Box*** \n(this is strictly for business/PR. If you are a viewer, please do NOT send gifts because I'd like you to spend your pennies on yourself. Cards and letters are welcome)\nFAO Louise Pentland\nGleam Futures\n6 Floor, 60 Charlotte Street\nLondon\nW1T 2NU\n\nBusiness Contact - Charlotte@GleamFutures.com\n\nAbout Me ::\n\nHi, I'm Louise! I started this channel in 2009 after readers of my blog (also called Sprinkle of Glitter) suggested I give YouTube a try. I was instantly hooked and have found my internet playground on here. I make videos about beauty & fashion, positive living, motherhood, lifestyle and occasionally have special guests (friends, kittens or my sweet Daughter Darcy). Hit the subscribe button to never miss a video again! \n\nI try to upload every Wednesday!\n\nI chat every day on my other social media (linked above) so do come and say hi! \n\nBig hugs,\n\nLouise xxx",False
