id,trending_date,Label,channel_title,category_id,publish_time,tags,views,likes,dislikes,comment_count,thumbnail_link,comments_disabled,ratings_disabled,video_error_or_removed,description,popular_tag
LFhT6H6pRWg,2017-12-25 00:00:00,PSA from Chairman of the FCC Ajit Pai,Daily Caller,22,2017-12-13 22:52:57,"thedc|""dc""|""washington dc""|""washington""|""the district of columbia""|""swamp""|""drain the swamp""|""trump""|""ajit pai""|""FCC""|""federal communications commision""|""net neutrality""|""net""|""neutrality""|""news""|""politics""|""commentary""|""meme""|""viral""|""republican""|""democrat""|""cable companies""|""fiber optic""|""free internet""|""free speech""|""media""|""daily caller""|""The Daily Caller""",1287868,10183,246375,32189,https://i.ytimg.com/vi/LFhT6H6pRWg/default.jpg,False,False,False,"Ajit Pai has been at the heart of the net neutrality debate and he would like to take this time to address all of the internet trolls with a PSA.\n\nSubscribe to our channel! https://goo.gl/UGHkXA\n\nWant to see more? visit: https://goo.gl/3gcbEL\n\nDailyCaller.com is a news website that cuts through the liberal bias of the mainstream media and brings you the unadulterated truth. If you want to hear the scoop that they're afraid to utter on the over censored, corporatized cable news, tune into https://www.dailycaller.com\n\nCheck out our twitter: https://goo.gl/fnYe4v\n\nAnd Facebook: https://goo.gl/W5junb\n\nOr follow Instagram: https://goo.gl/mhVr1Y\n\nAnd don't forget to subscribe here: https://goo.gl/sjqhR7",False
KjHan6D3O3g,2017-12-25 00:00:00,Sam Smith - Have Yourself A Merry Little Christmas in the Live Lounge,BBCRadio1VEVO,10,2017-12-13 18:00:16,"Sam Smith|""Have Yourself A Merry Little Christmas""|""BBC""|""Radio 1""|""Live Lounge""|""The Thrill Of It All""",367278,6060,361,241,https://i.ytimg.com/vi/KjHan6D3O3g/default.jpg,False,False,False,Sam Smith performs Have Yourself A Merry Little Christmas in the BBC Radio 1 Live Lounge\n\nhttp://vevo.ly/a0opFg,False
mrTNzn4-K3o,2017-12-25 00:00:00,SWOONING OVER BULGARI BAGS AND AN ARMANI BEAUTY GIVEAWAY | VLOGMAS 65,Inthefrow,26,2017-12-15 19:00:37,"Inthefrow|""In the frow""|""HUGE BEAUTY GIVEAWAY AND THE MOST BEAUTIFUL BULGARI BAG | VLOGMAS 65""|""HUGE BEAUTY GIVEAWAY""|""BEAUTY GIVEAWAY""|""BEAUTY""|""GIVEAWAY""|""THE MOST BEAUTIFUL BULGARI BAG""|""BEAUTIFUL BULGARI BAG""|""BULGARI BAG""|""BULGARI""|""BAG""|""VLOGMAS""|""VLOG""|""VLOGS""|""VICTORIA""|""CHRISTMAS""|""CHRISTMAS GIVEAWAY""|""SWOONING OVER BULGARI BAGS AND AN ARMANI BEAUTY GIVEAWAY | VLOGMAS 65""",59511,2247,89,264,https://i.ytimg.com/vi/mrTNzn4-K3o/default.jpg,False,False,False,"SWOONING OVER BULGARI BAGS AND AN ARMANI BEAUTY GIVEAWAY | VLOGMAS 65\n\nOkay so I have an exciting one today - a giveaway, finally! I did one two weeks ago actually, but I don't usually do too many of them. After an amazing year, I wanted to finish off 2017 with one last giveaway and a super special one too! I'm giving away a package of my favourite Armani products worth £420! My FAVE Rouge Malachite is in there, the Rouge Malachite candle, Eccentrico Mascara, Luminous Silk Foundation, an Ecstasy Shine Lipstick and a Lip Magnet too. All my faves and just a big THANK YOU from me to you - just head over to my Instagram @inthefrow to enter on the picture of me in the red dress obvs haha! Love you all ❤ - http://www.instagram.com/inthefrow\n\nBy the way this video isnt sponsored - just me wanting to give you a special gift with a little help from my friends at Armani Beauty x\n\n\n*****\nMy new jewellery blog post and 20% discount for Monica Vinader!! https://www.inthefrow.com/2017/12/extra-special-christmas-gifts-ladies-love-sparkle.html\n*****\n\n\n❤ Subscribe: http://inthefrow.co/subtoitf\n❤ Catch my latest blog post: http://www.inthefrow.com\n❤ Instagram: http://www.instagram.com/inthefrow\n❤ Twitter: http://www.twitter.com/inthefrow\n❤ 10 FAQs about me: http://inthefrow.co/2ychtze\n\n\nI receive a small % of commission from anything bought via the product links below. It doesn't cost you any more and is a little thank you to me, I guess, for inspiring a possible purchase :)\n\n\nWhat I'm Wearing ❤\n\nCoat in Selfridges: https://rstyle.me/n/cvtqpvuige\nGold Bulgari Bag (UK): https://rstyle.me/~adAUd \nGold Bulgari Bag (US): https://rstyle.me/n/cvtqnmuige\nOutfit for Bulgari Shoot in Store: https://www.inthefrow.com/looks/view?feature=2631\nOutfit for Bulgari Shoot in Cinema: https://www.inthefrow.com/looks/view?feature=2632\nExclusive Limited Edition Bulgari Bags: https://rstyle.me/n/cvtn49uige\nBlue Maxi Lace Dress: https://rstyle.me/n/cvtn5iuige\n\n\nWhat's In The Giveaway ❤\n\nArmani Beauty Rouge Malachite: https://rstyle.me/n/cvtn54uige\nArmani Beauty Rouge Malachite Candle: https://rstyle.me/n/cvtn6cuige\nArmani Beauty Luminous Silk Foundation: https://rstyle.me/n/cvtn6wuige\nArmani Beauty Eccentrico Mascara: https://rstyle.me/n/cvtwppuige\nArmani Beauty Ecstasy Shine Lipstick: https://rstyle.me/n/cvtwqiuige\nArmani Beauty Lip Magnet: https://rstyle.me/n/cvtwpxuige\n\n\nWhat/Who Else is in The Vlog ❤\n\nAlex: https://www.youtube.com/harrisonyt\nSisley Black Rose Cream: https://rstyle.me/~adAVl\nSketch Restaurant: https://sketch.london/\nDryby Nail Salon: http://www.dryby.co.uk/\n\nFind Me ❤\n\nContact: http://www.gleamfutures.com/client-contact/victoria\n\nMusic by Epidemic Sound (www.epidemicsound.com)\n\nThank you so much for watching and for the support always! Love you guys so much ❤",False
dqkEniTFTH0,2017-12-25 00:00:00,What Ever Happened to Baby Jane? - You're a Liar!,uhhuhhim,1,2008-08-29 23:19:07,"what|""ever""|""happened""|""to""|""baby""|""jane""|""bette""|""davis""|""joan""|""crawford""|""feud""|""robert""|""aldrich""|""1962""|""hudson""|""blanche""",162082,476,20,127,https://i.ytimg.com/vi/dqkEniTFTH0/default.jpg,False,False,False,"After Jane snaps, she brings Blanche her lunch.  Blanche confronts Jane, telling her she's planning to sell the house.  Jane calls Blanche a liar, removes the telephone from her bedroom, and Blanche is frightened by her lunch.",False
2-bTbRjqjoE,2017-12-25 00:00:00,Star Wars: The Last Jedi SPOILER TALK!!!,Tyrone Magnus,24,2017-12-15 06:31:52,"reaction|""tyrone magnus""|""Star Wars: The Last Jedi""",89447,2453,288,1418,https://i.ytimg.com/vi/2-bTbRjqjoE/default.jpg,False,False,False,"Get Your New Magnus of Steel Ball Caps HERE:  http://www.midnight-hype.com/mag-of-steel-baseball-cap/\n\nGet your Tyrone Magnus BIRTHDAY SHOUTOUTS, PERSONALIZED SHOUTOUTS ALL TYPES OF SHOUTOUTS BY CLICKING THE LINK BELOW!!!\nhttps://www.bookcameo.com/v/59dbc108a18b7b003beda6f2\n\nJOIN ME ON MY JOURNEY TO 10 MILLION SUBSCRIBERS!!!\nDONT' FORGET TO LIKE, SUBSCRIBE, COMMENT AND SHARE!!!\n\nWATCH MY NETFLIX & VRV LIVE STREAM REACTIONS ON RIFF.TV:  https://www.riff.tv/tyronemagnus\n\nORDER YOUR GAMEFACE T-SHIRT NOW!!!  http://www.midnight-hype.com/\n\nMY BACKUP CHANNEL: https://www.youtube.com/channel/UCguQbsO3YPWgI_0m3JodqLQ\n\nSUBSCRIBE TO MY GAMING CHANNEL:  https://www.youtube.com/channel/UC5db...\n\nIMDb:  http://www.imdb.me/tyronemagnus\n\nLIKE ME ON FACE BOOK!!! http://www.facebook.com/TyroneMagnus\n\nFOLLOW ME ON TWITTER!!!  https://twitter.com/TheTyroneMagnus\n\nINSTAGRAM:  http://instagram.com/tyronemagnus\n\nFOLLOW ME ON YOUNOW:  https://www.younow.com/TheTyroneMagnus\n\nFOLLOW ME ON SNAPCHAT:  Tmagnusss\n\nGET YOUR MAGNUS MERCHANDISE HERE:  http://493672.spreadshirt.com/\n\nWHERE I GET MY OTHER T-SHIRTS!!!:  \nTeeblox.com Use Promo Code TYRONETBX for 10% OFF!!!\nhttp://www.midnight-hype.com\nwww.CrazyDogTshirts.com\nwww.TheStyleStage.com\nwww.liveinspiredclothing.com\nshop.ekriptik.com\nteenoevil.com\n\nNEED A SECURITY SYSTEM?!!  THEN GET THE ONLY HOME SECURITY COMPANY TYRONE MAGNUS TRUSTS!!!:  https://adtreferral.com/accept/?EID=1...\n\nWant to send me a reaction video or ask a question?!!:  Post it in the comments section or you can click on the About tab on my main channel page and then click Send Message  If that does not work, send a message on my Facebook Fanpage http://www.facebook.com/TyroneMagnus\n\nALSO BE SURE TO CHECK IF I ALREADY DID A REACTION TO THE VIDEO YOU WANT BEFORE YOU REQUEST IT\n\nANY EMAILS SENT TO MY BUSINESS INQUIRY EMAIL THAT IS NOT BUSINESS WILL NOT BE READ AND IMMEDIATELY DELETED!!!\n\nMAILING ADDRESS:\n\nTyrone Magnus, LLC\n41 Riverwalk Blvd \nOFC 2\nBurlington Township, NJ 08016",False
8I_NkJ8VTEI,2017-12-25 00:00:00,Judge Roy Moore Campaign Statement,Roy Moore for Senate,22,2017-12-14 03:04:05,[none],798461,4361,59573,0,https://i.ytimg.com/vi/8I_NkJ8VTEI/default.jpg,True,False,False,"December 13, 2017 | Montgomery, Alabama",False
wVy6mbSbbiA,2017-12-25 00:00:00,Star Wars: The Last Jedi Epic Spoiler Rant!,Jody's Corner,24,2017-12-16 01:07:44,"star wars the last jedi epic spoiler rant|""star wars the last jedi movie review""|""star wars: the last jedi spoiler review""|""star wars the last jedi spoiler discussion""|""star wars the last jedi""|""movie review""|""review""|""rant""|""jodys corner""|""star wars the last jedi rant""|""star wars rant""|""star wars episode 8 movie review""|""star wars episode 8 rant""|""the last ledi rant""|""the last jedi spoiler review""|""the last jedi""|""the last jedi sucked""",34954,2050,101,1142,https://i.ytimg.com/vi/wVy6mbSbbiA/default.jpg,False,False,False,"Kathleen Kennedy NEEDS to go! pass it on...\n\nLink to my Patreon account: patreon.com/jodyscorner\nLink to my 2nd Channel: Sparks TV: https://www.youtube.com/channel/UCFzhKr-Eyzomj9RPaQuOI0A\nJOiN me ON DISCORD: https://discord.gg/JE7YCF\nfollow me on Twitter @jodyscorner1\nAdd me on Facebook: jodys corner\n\nPO box for fan mail etc:\nJody's Corner\n3651 South La Brea Ave #958\nLos Angeles CA, 90016",False
0gLsukihjVg,2017-12-25 00:00:00,It's time for the Jedi to end (I'm sorry),Dash Star,20,2017-12-15 02:31:47,"dash star|""star wars""|""star wars episode 8""",143165,8769,783,3508,https://i.ytimg.com/vi/0gLsukihjVg/default.jpg,False,False,False,»Check out my website Dash's Website - http://dashstarwars.com/\n»Check out these Tee's https://www.teepublic.com/stores/dash-star-wars\n\n¤Become a Part of The Exalted¤\n»Facebook - https://www.facebook.com/DashStarWars\n»Tweet me up! - http://twitter.com/dashstarwars\n\nPLAY GAMES WITH DASH\nJoin my Guild to chat at: http://neongrind.com/swtor\nFind me on SWTOR - DashStar on Harbinger Server Emp\nJedi Academy name Dash Star - Server I frequent  EXO- KR - JAWA -AZ\nBattlefront Origin Tag - DashStarWars\nFind me on Steam - [NEON] Dash\n\n» Star Wars Origins Playlist - http://goo.gl/qQdgv5\n» Star Wars Force Awakens News - http://goo.gl/tgy9rh,False
3_keXD1yV3E,2017-12-25 00:00:00,EVENING SKINCARE ROUTINE WITH ESTÉE! | Vlogmas Day 13,Amelia Liana,26,2017-12-14 17:05:04,"amelialiana|""amelia liana""|""evening skincare routine""|""Estée Lalonde""|""vlogmas""|""vlogmas 2017""|""inthefrow""|""uk vloggers""|""vlogger""|""daily vlogger""|""skincare routine""|""acne""",71891,2110,63,158,https://i.ytimg.com/vi/3_keXD1yV3E/default.jpg,False,False,False,Hanging out with my favourite girls at Sketch & going to the Cotswolds to see Estée & Aslan for some downtime + our evening skincare routine!\n\n↓↓↓ SUBSCRIBE HERE for new videos every Monday & Thursday! http://bit.ly/1pm8SkR\n____________________________________________________________________\n\n\nOUTFIT OF THE DAY:\n\nFaux Fur Coat:\nhttp://bit.ly/2BhkaQH\n\nPink Jumper:\nhttp://bit.ly/2iaH7xn\n\nJeans:\nhttp://bit.ly/2nXgPRh\n\nBox Bag:\nhttp://bit.ly/2yl9pay\n\nVelvet Boots:\nhttp://bit.ly/2noQXxN\n\n\nTRAVEL OUTFIT:\n\nWhite Bobble Sleeve Jumper:\nhttp://bit.ly/2iZHBDy\n\nPink Scarf:\nhttp://bit.ly/2BjjZEE\n\nLeggings (similar):\nhttp://bit.ly/2BZEOBF\n\nBlack Bag:\nhttp://bit.ly/2BgXDU5\n\nPrescription Glasses:\nhttp://bit.ly/2wYZb2Q \n(in black): http://bit.ly/2y0Y4gg\n\n\nBEAUTY PRODUCTS I MENTIONED:\n\nCharlotte Tilbury Lip Cheat in Pillow Talk: http://bit.ly/2ylvS7m\nCharlotte Tilbury English Beauty Lipstick: http://bit.ly/2l3KQ17\nDolce & Gabbana The One: http://bit.ly/2z6U2WU\nClarins Gentle Eye Makeup Remover: http://bit.ly/2kqKzRT\nOrveda Rich Brew Botanical Cream: http://bit.ly/2yrfXof\nMarie Veronique Pre+Probiotic Daily Mist: http://bit.ly/2kqHst9\nOrveda Deep Cleansing Bio-Fermented Rich Balm: http://bit.ly/2ChaymJ\nMV Organics Gentle Cream Cleanser: http://bit.ly/2j1ETgI\nPai Instant Calm Redness Serum: http://bit.ly/2j3aJti\nPai Echium & Argan Gentle Eye Cream: http://bit.ly/2AFXCJS\nAntipodes Avocado Pear Nourishing Night Cream: http://bit.ly/2C5O8UF\nMV Organics Rose Plus Booster: http://bit.ly/2BnH7la\nPai Copaiba Deep Cleanse AHA Mask: http://bit.ly/2CiD0ED\nFresh Sugar Face Polish: http://bit.ly/2C5mE1B\nFresh Rose Face Mask: http://bit.ly/2j0UIEl\nCharlotte Tilbury Dry Sheet Mask: http://bit.ly/2j0UPjf\nGarnier Micellar Cleansing Water: http://bit.ly/2ChLUT5\nNail Polish: OPI Yank My Doodle: http://bit.ly/2gLqFTw\n\n\nJEWELLERY I WEAR:\n\nCoin necklaces: http://bit.ly/2yVaha1 \nStacking Rings: http://bit.ly/2x7GiHx\nEvil Eye Rings: http://bit.ly/2tRiPu0\nTrinity Ring: http://bit.ly/2x7IBuc\nRed String Bracelet: http://bit.ly/2qUqLf8\nBangle: http://bit.ly/2vLLUrE\n____________________________________________________________________\n\n\nPEOPLE IN THE VLOG:\n\nEstée: https://www.youtube.com/user/essiebutton\nAslan: https://www.youtube.com/user/theworktop\nVictoria: https://www.youtube.com/user/inthefrow\nSammi: https://www.youtube.com/user/beautycrush\nCarly: https://www.youtube.com/user/Carlyrowena\nEm: https://www.youtube.com/user/Emshelx\n\n____________________________________________________________________\n\n\nSketch: https://sketch.london/\nLog House Holidays: https://loghouseholidays.co.uk/\n____________________________________________________________________\n\n\nDON’T FORGET TO ENTER MY GIVEAWAY! \n\nHow to enter:\n\nFollow me on Instagram → http://instagram.com/amelialiana \nLike my latest picture \nComment on my latest picture using #AmeliaLianaVlogs\n\nWinner: @mirkins11\n____________________________________________________________________\n\n\nEQUIPMENT:\n\nCanon Vlog Camera: http://bit.ly/2f6R1vq\nCanon Big Camera: http://bit.ly/2xcsoba (with this lens): http://bit.ly/2eII9vj\n____________________________________________________________________\n\n\nWanna see more? Follow me on my social media... \nBlog (for weekly posts) → https://amelialiana.com/\nTwitter (great for youtube polls about videos & more!) → https://twitter.com/amelialiana_ \nINSTAGRAM (featuring lots of Instagram lives!) → http://instagram.com/amelialiana \nSNAPCHAT → amelia.liana \n____________________________________________________________________\n\n\nLATEST VIDEOS:\n\nPamper Evening & Beauty Storage Clearout: https://youtu.be/meVppVeNtVI\nSnow Excitement in London! https://youtu.be/Q0bnKMOTnTU,False
oQxKEtoHygY,2017-12-25 00:00:00,DJ Earworm Mashup - United State of Pop 2017 (How We Do It),Dj Earworm,10,2017-12-13 17:05:43,"DJ Earworm|""Mashup""|""United State of Pop""|""United States of Pop""|""Top 25""|""2017""|""2017 hits""|""top hits 2017""",775963,22634,2440,3029,https://i.ytimg.com/vi/oQxKEtoHygY/default.jpg,False,False,False,"Download mp3 for free here:\nhttps://soundcloud.com/dj_earworm/united-state-of-pop-2017-how-we-do-it-1\n\nTwitter.com/DJEarworm \nFacebook.com/Earworm\nDjearworm.com \n\nA mashup of the 25 biggest U.S. hits during 2017\n\nFeaturing:\n\nBruno Mars - That's What I Like\nCamila Cabello Featuring Young Thug - Havana\nCardi B - Bodak Yellow (Money Moves)\nThe Chainsmokers & Coldplay - Something Just Like This\nCharlie Puth - Attention\nDJ Khaled Featuring Justin Bieber, Quavo, Chance The Rapper & Lil Wayne - I'm The One\nEd Sheeran - Perfect\nEd Sheeran - Shape of You\nFrench Montana Featuring Swae Lee - Unforgettable\nFuture - Mask Off\nImagine Dragons - Believer\nImagine Dragons - Thunder\nJames Arthur - Say You Won't Let Go\nKendrick Lamar - Humble.\nLil Uzi Vert - XO TOUR Llif3\nLogic Featuring Alessia Cara & Khalid - 1-800-273-8255\nLuis Fonsi & Daddy Yankee Featuring Justin Bieber  - Despacito\nMigos Featuring Lil Uzi Vert - Bad And Boujee\nPortugal. The Man - Feel It Still\nPost Malone Featuring 21 Savage - Rockstar\nPost Malone Featuring Quavo - Congratulations\nSam Hunt - Body Like A Back Road\nShawn Mendes - There's Nothing Holdin' Me Back\nTaylor Swift - Look What You Made Me Do\nZedd & Alessia Cara - Stay\n\nThis is how we do it down in Puerto Rico\nThis is how we do it all the time\nDown in Vegas, in Miami,\nDown in Paris, in Manhattan,\nin Havana, down in L.A.\nThis is how we do it in the boondocks,\nIn the Cadillac in the backseat\nOut here underneath the rising sun (hey)\nIn the club, in the street, in the dark, in the dawn,\nIn the future I want something just like this.\n\nOh I oh I oh I oh I\nAlthough my heart is looking at the truth,\nJust picture everybody\nDiscovering something brand new.\nJust picture everybody \nSeeing the beauty through the darkest days.\nI feel it still.\n\nIs it me? Is it you? (na na na)\nI don’t wanna choose.\nI want all of the above. (na na na)\nI don’t wanna choose.\nIs it fake? Is it true? (na na na)\nDon’t get comfortable.\nYou can hate all the hate (na na na)\nIf you wanted too.\nLook:\n\nThis is how we do it down in Puerto Rico\nThis is how we do it all the time\nDown in Vegas, in Miami,\nDown in Paris, in Manhattan,\nin Havana, down in L.A.\nThis is how we do it in the boondocks,\nIn the Cadillac in the backseat\nOut here underneath the rising sun (hey)\nIn the club, in the street, in the dark, in the dawn,\nIn the future I want something just like this.\n\nI don’t really care if you lie (Sit down, Mask off)\nManipulate my decisions,\nLook me in the eye (Sit down, Mask off, Sit Down)\nI don’t really care if you go crazy (Mask off, Sit Down)\nI don’t really care if you\nPush me to the edge (Sit down)\nPush me to the edge (Be Humble)\nPush me to the edge.\nWho can relate? Woo!\n\nI knew from the start\nthe way that things have been\nwill change will change will change will change.\nI said I already told you\nIt can be hard.\nthe way that things have been\nwill change will change will change will change.\nYeah Yeah Yeah.\n\nskrrrrt! Bring me back back back.\nPop it like a pop star, rock like a rock star\nParty in Manhattan,\nin Havana, down in L.A.\nSinging to our favorite song\nIn the Cadillac in the backseat\nOut here underneath the rising sun (hey)\nShining so bright in the dark, in the dawn,\nIn the future I want something just like this.\n\nFeel the thunder\nThis is how we do it all the time\nThunder, feel the thunder\nI want something just like this\nFeel the thunder\nUnderneath the rising sun (hey)\nThunder, feel the thunder\nI want something just like this\n\nIs it me? Is it you? (na na na)\nI don’t wanna choose.\nC’mon, c’mon, take a look in the mirror (na na na)\nDon’t get comfortable.\nSay it’s us, say it’s us (na na na)\nIf you wanted too.\nSay it’s us, say it’s us and I’ll agree, baby.\nOooooo\nSay it’s us\nOooooo\nJust say you won’t let go\n\nPasito a pasito, suave suavecito\nThe face of the future, poquito a poquito\nY es que esa belleza es un rompecabezas\nPero pa' montarlo aquÌ tengo la pieza\nPasito a pasito, suave suavecito\nYou make me a believer, poquito a poquito\nThe only words I wanna hear is “Sube, Sube, Sube!”\n\nNow they only say congratulations\nOh I oh I oh I oh I\nThis is how we do it all the time\nDown in Vegas, in Miami,\nDown in Paris, in Manhattan,\nin Havana, down in L.A.\nThis is how we do it in the boondocks,\nIn the Cadillac in the backseat\nOut here underneath the rising sun (hey)\nIn the club, in the street, in the dark, in the dawn,\nIn the future.\nWhy not right now?",False
YfOHh5mt9SM,2017-12-25 00:00:00,i have a condition that makes me feel like i'm dreaming all the time,doddlevloggle,24,2017-12-14 00:27:19,"condition|""mental""|""health""|""depression""|""derealisation""|""depersonalisation""|""dissociation""|""DP/DR""|""lyme""|""disease""|""dreaming""|""anxiety""|""help""",531587,50273,645,5119,https://i.ytimg.com/vi/YfOHh5mt9SM/default.jpg,False,False,False,"this title is VERY dramatic and i apologise! I wanted to advertise to ppl who wouldn't know about this mental health problem already. u know\nan amazing podcast on this! http://www.bmj.com/content/356/bmj.j745\nmore info: https://www.mind.org.uk/information-support/types-of-mental-health-problems/dissociative-disorders/#.WjHC7lSFjR0\n\nmy book! http://secretsforthemadbook.com\n\nhttp://youtube.com/doddleoddle\nhttp://youtube.com/dodievevo for music\n\nhttp://www.twitter.com/doddleoddle\nsnapchat and instagram username is doddleoddle\n\nmy EPs are called Intertwined and You - on Spotify and iTunes :)\n\nBUSINESS EMAIL: info@dodieclark.com\n\n\nMORE TIPS\nokay spaced out pals. here's the thing. everyone's telling us to just ignore it and that is SO ANNOYING TO HEAR because it's like\nif you had a chronic pain in your arm and people tell you to ignore it it's like i LITERALLY CAN'T because it's SO OBVIOUS.\nbut the way to function with this is to pretend it doesn't bother you - over time your thinking patterns will change and though you will still be spaced out, it won't make you as depressed/anxious because it will just be something you have and that's it.\n\nYes, it sucks to think about that. DON'T GIVE UP HOPE - more research will be done, there are other options you haven't tried yet, you will feel present again one day - but just in case that day doesn't come/it takes a while, you might as well enjoy life as best as you can whilst feeling spaced out!\n\nLast year I could barely talk to people I was that spaced out! I didn't want to leave my flat for fear my existence would be snuffed out it felt so fragile. But now I wake up and although I still am living in this weird dreamlike world, I can function and make an impression on the world, despite barely feeling like I'm in it.\n\nIt will be okay! I Promise! Don't give up hope! Practise loving what you can experience!\n\nxxxx",False
OQ8v_KUS0Qg,2017-12-25 00:00:00,Holly Willoughby drops huge Star Wars: The Last Jedi spoiler,DAILY TVSHOWBIZ HOT NEWS,24,2017-12-13 13:16:57,"showbiz|""showbiz news""|""showbiz hot news""|""Holly Willoughby drops huge Star Wars: The Last Jedi spoiler""|""Holly Willoughby""|""Holly Willoughby drops""|""Holly Willoughby drops huge""|""The Last Jedi spoiler""|""huge Star Wars""|""Actor John Boyega jokingly tells Holly Willoughby off""|""The Last Jedi spoiler live on This Morning""|""Actor John Boyega jokingly""",248892,1356,78,419,https://i.ytimg.com/vi/OQ8v_KUS0Qg/default.jpg,False,False,False,Actor John Boyega jokingly tells Holly Willoughby off as she drops a huge Star Wars: The Last Jedi spoiler live on This Morning.,False
pWqef6cbwzI,2017-12-25 00:00:00,ANGRY GRANDPA TRIBUTE VIDEO,TheAngryGrandpaShow,22,2017-12-12 23:05:56,"angry grandpa|""the angry grandpa""|""theangrygrandpashow""|""kidbehindacamera""|""pickleboy""",3147048,312538,1892,65148,https://i.ytimg.com/vi/pWqef6cbwzI/default.jpg,False,False,False,"My friend Anthony Abbas put together a moving tribute to Angry Grandpa using his song The Most Sensible thing. Goodbye dad, this isn't getting any easier for me.\n\nANTHONY - https://twitter.com/TheAJUniverse\n\nTHE MOST SENSIBLE THING - https://itunes.apple.com/us/album/the-most-sensible-thing-single/1063354275\n\nANGRY GRANDPA'S MERCH - https://shop.bbtv.com/collections/angry-grandpa",False
4cucHc2vef4,2017-12-25 00:00:00,BOOGIE - BROCKHAMPTON,BROCKHAMPTON,10,2017-12-13 01:59:49,"kevin abstract|""brockhampton""|""ashlan grey""|""henock sileshi""|""nick lenzini""|""kevin doan""|""joba""|""merlyn wood""|""dom mclennon""|""ameer vann""|""BOOGIE brockhampton""|""brockhampton saturation""|""saturation""|""saturation brockhampton""|""saturation 2""|""brockhampton saturation 3""|""saturation 3""|""saturation 3 brockhampton""|""saturation ii""|""saturation iii brockhampton""|""brockhampton saturation ii""|""sweet""|""brockhampton junky""|""bh""|""gold brockhampton""",1266888,51765,904,4319,https://i.ytimg.com/vi/4cucHc2vef4/default.jpg,False,False,False,"BROCKHAMPTON TOUR TICKETS ON SALE: http://brckhmptn.com/dates/\n\nDirected by Kevin Abstract\nDP - Ashlan Grey\nEdit & Color - Henock Sileshi\nStylist - Nick Lenzini\nPA- Kevin Doan\n\nSTREAM BOOGIE:\nSpotify: https://open.spotify.com/album/4PQtODnHlq5ETTwv6J3NYq\n\nApple Music: https://itunes.apple.com/us/album/boogie/1323392892?i=1323392899\n\n\nFilmed in Van Nuys, Los Angeles, California, USA\n\nhttp://instagram.com/brckhmptn\nhttp://twitter.com/brckhmptn",False
