id,trending_date,Label,channel_title,category_id,publish_time,tags,views,likes,dislikes,comment_count,thumbnail_link,comments_disabled,ratings_disabled,video_error_or_removed,description,popular_tag
ZzZ-BsiSamk,2018-04-07 00:00:00,Tyron Woodley Says Conor McGregor Is A Disgrace To Mankind | The Hollywood Beatdown,TMZSports,17,2018-04-06 20:27:39,"TMZ|""TMZ Sports""|""TMZ Sports Channel""|""Celebrity""|""Sports""|""Athletes""|""TMZ News""|""Famous""|""Hall of Fame""|""Sports News""|""tyron woodley""|""tyron woodley interview""|""tyron woodley highlights""|""tyron woodley knockout""|""conor mcgregor""|""conor mcgregor bus""|""conor mcgregor attacks bus""|""conor mcgregor highlights""|""conor mcgregor arrest""|""dana white""|""dana white interview""|""nfl""|""nfl highlights""|""colin kaepernick""|""colin kaepernick highlights""|""ronda rousey highlights""|""ronda rousey""|""wwe""|""wwe fight""",146105,907,822,1038,https://i.ytimg.com/vi/ZzZ-BsiSamk/default.jpg,False,False,False,"Every Friday on TMZ Sports UFC Welterweight Champion Tyron The Chosen One Woodley dishes on his favorite stories in the world of Hollywood and Sports. Hear what Tyron is FIRED UP about, who he wants to PUNCH IN THE FACE, and his honest take on a story we like to call On The Real, Though.\n\nSUBSCRIBE -- http://po.st/TMZSportsSubscribe\n\nAbout TMZ Sports:\nSome of the best stories in sports have been off the field and we’re reporting on athletes from NFL, NBA, UFC, WWE, MLB and more!  \n\nSubscribe to TMZ Sports on YouTube for the latest news, exclusive interviews, clips from TMZ Sports on FS1 and videos of your favorite athletes and celebs. \n\nNeed More TMZ?\nTMZ Sports Website: http://po.st/TMZSportsWebsite\nLIKE TMZ Sports on Facebook!http://po.st/TMZSportsLike\nFOLLOW TMZ on Twitter! http://po.st/TMZFollow\nFOLLOW TMZ on Instagram! http://po.st/TMZInsta\nTMZ on TV & TMZ Sports on FS1 Tune In Info: http://po.st/TMZOnAir\nTMZ is on iOS! http://po.st/TMZiOS\nTMZ is on Android! http://po.st/TMZonAndroid\n\nGot a Tip?\nContact TMZ: http://po.st/TMZTip\n\nCheck out TMZ, TMZ Live, and toofab!\nTMZ: http://po.st/TMZWebsite\nSubscribe! TMZ: http://po.st/TMZSubscribe\nTMZ Live: http://po.st/TMZLiveWebsite\nSubscribe! TMZ Live: http://po.st/TMZLiveSubscribe\nToofab: http://po.st/toofabWebsite\nSubscribe! toofab: http://po.st/toofabSubscribe\n\nhttps://www.youtube.com/c/tmzsports",True
bNW6oR670s4,2018-04-07 00:00:00,Tom Holland 'Avengers: Infinity War' reveals terrible awkward dancing moment with Madonna,TORYmax,1,2018-04-07 00:06:28,[none],36625,909,7,30,https://i.ytimg.com/vi/bNW6oR670s4/default.jpg,False,False,False,Tom Holland Avengers 3 failed to impress Madonna It's was the most embarrassing moment of my life,False
ZEkImgh--PE,2018-04-07 00:00:00,"Halsey - Alone ft. Big Sean, Stefflon Don",HalseyVEVO,10,2018-04-06 13:00:03,"Halsey|""Alone""|""hopeless fountain kingdom""|""hfk""|""astralwerks""|""music video""|""official video""|""halsy""|""Stefflon Don""|""Big Sean""|""Stefflondon""|""rap""|""rapper""|""download""|""mp3""|""dying to meet me""|""I can just tell you this""|""halsey single""|""halsey song""|""halsey radio hit""|""Hannah Lux Davis""|""Brandon Bonfiglio""",970186,95675,1828,5882,https://i.ytimg.com/vi/ZEkImgh--PE/default.jpg,False,False,False,"Alone available now: http://www.iamhalsey.com/alone\n\nlisten to Alone on Apple Music: http://www.iamhalsey.com/insidemyheadapple\nlisten to Alone” on Spotify: http://www.iamhalsey.com/insidemyhead\norder deluxe box set, limited edition vinyl & more in the official store: http://www.iamhalsey.com/store\norder album on iTunes: http://www.iamhalsey.com/hfkitunes\nsave hopeless fountain kingdom on Spotify: http://www.iamhalsey.com/hfkpresave\nsave Alone on Spotify: https://halsey.lnk.to/savealone\norder deluxe edition CD on Target.com: http://www.iamhalsey.com/hfktarget \norder Urban Outfitters exclusive red-splattered clear vinyl: http://www.iamhalsey.com/hfkuovinyl\nlisten to Halsey Essentials on Apple Music: https://halsey.lnk.to/appleessentials\n\nFollow Halsey\nhttp://iamhalsey.com\nhttp://twitter.com/halsey\nhttps://www.facebook.com/HalseyMusic\nhttp://instagram.com/iamhalsey\nSpotify: http://www.iamhalsey.com/spotify\nMailing list: http://www.iamhalsey.com/mailinglist\n\nDirector: Hannah Lux Davis & Halsey\nProducer: Brandon Bonfiglio & Targa Sahyoun\n\nMusic video by Halsey performing Alone. © 2018 Astralwerks\n\nhttp://vevo.ly/rwmO1X",False
4oYYVrEFWE8,2018-04-07 00:00:00,Cardi B: Invasion of Privacy [Full Interview] | Beats 1 | Apple Music,Beats 1 Radio,10,2018-04-06 04:29:52,"Apple Music|""Beats 1""|""Beats 1 Radio""|""Beats Radio""|""Zane Lowe""|""Ebro Darden""|""Julie Adenuga""|""Matt Wilkinson""|""music interviews""|""apple""|""appl""|""beats by dre""|""Ebro""|""pop""|""hip hop""|""indie""|""grime""|""afrobeats""",544143,13051,822,2222,https://i.ytimg.com/vi/4oYYVrEFWE8/default.jpg,False,False,False,"Cardi B opens up to Ebro Darden in Miami on April 2 about her debut album, 'Invasion of Privacy,' fighting the rumors and staying true to herself. Listen to Cardi B's new album: 'Invasion of Privacy'\nhttp://apple.co/CardiBAlbum \n\nApple Music: Millions of songs. Zero ads. No commitment. http://apple.co/Trial \nExplore Beats 1 for free: http://apple.co/B1\n\nAbout Beats 1:\nWorldwide. Always on. Listen for free on Apple Music or on demand with a subscription. \nSubscribe on YouTube: https://apple.co/B1YouTube\nFollow Beats 1 on Instagram: https://apple.co/B1Instagram\nFollow Beats 1 on Twitter : https://apple.co/B1Twitter\nLIKE Beats 1 on Facebook: https://apple.co/B1Facebook\nTumblr: https://apple.co/B1Tumblr\n\nAbout Apple Music:\nListen to over 45 million songs, online or off, totally ad-free. Plus create and share your own playlists, get exclusive content and personalized recommendations, and stream radio stations with unlimited skips. \nFollow Apple Music on Instagram: http://apple.co/AMInstagram\nFollow Apple Music on Twitter: https://apple.co/AMTwitter\nLIKE Apple Music on Facebook: http://apple.co/AMFacebook\n\nCardi B: Invasion of Privacy [Full Interview] | Beats 1 | Apple Music\nhttps://www.youtube.com/user/officialbeatsmusictv",False
yN0O8UaTnRA,2018-04-07 00:00:00,John Cena's Epic Response to Dwayne Johnson's Threat,Jimmy Kimmel Live,24,2018-04-05 09:00:03,"jimmy|""kimmel""|""live""|""late""|""night""|""talk""|""show""|""funny""|""comedic""|""comedy""|""clip""|""comedian""|""john""|""cena""|""dwayne""|""johnson""|""the""|""rock""|""pro""|""wrestling""|""wwe""|""threat""|""wrestler""|""rivalry""|""john cena""|""the rock""|""dwayne the rock johnson""|""pro wrestling""",2096196,39093,1688,2625,https://i.ytimg.com/vi/yN0O8UaTnRA/default.jpg,False,False,False,"John responds to the threat that Dwayne 'The Rock' Johnson made toward him when he was on our show last night. John's has an epic and very passionate message back.\n\nDwayne Johnson Wants Jimmy Kimmel to Deliver His Baby https://youtu.be/_a382GtsKUc\n \nSUBSCRIBE to get the latest #KIMMEL: http://bit.ly/JKLSubscribe\n \nWatch Mean Tweets: http://bit.ly/KimmelMT10\n \nConnect with Jimmy Kimmel Live Online:\n \nVisit the Jimmy Kimmel Live WEBSITE: http://bit.ly/JKLWebsite\nLike Jimmy Kimmel on FACEBOOK: http://bit.ly/KimmelFB\nLike Jimmy Kimmel Live on FACEBOOK: http://bit.ly/JKLFacebook\nFollow @JimmyKimmel on TWITTER: http://bit.ly/KimmelTW\nFollow Jimmy Kimmel Live on TWITTER: http://bit.ly/JKLTwitter\nFollow Jimmy Kimmel Live on INSTAGRAM: http://bit.ly/JKLInstagram\n \nAbout Jimmy Kimmel Live:\n \nJimmy Kimmel serves as host and executive producer of Emmy-winning Jimmy Kimmel Live, ABC's late-night talk show.\n\nJimmy Kimmel Live is well known for its huge viral video successes with 5.6 billion views on YouTube alone.\nSome of Kimmel's most popular comedy bits include - Mean Tweets, Lie Witness News, Jimmy's Twerk Fail Prank, Unnecessary Censorship, YouTube Challenge, The Baby Bachelor, Movie: The Movie, Handsome Men's Club, Jimmy Kimmel Lie Detective and music videos like I (Wanna) Channing All Over Your Tatum and a Blurred Lines parody with Robin Thicke, Pharrell, Jimmy and his security guard Guillermo.\nNow in its sixteenth season, Kimmel's guests have included: Johnny Depp, Meryl Streep, Tom Cruise, Halle Berry, Harrison Ford, Jennifer Aniston, Will Ferrell, Katy Perry, Tom Hanks, Scarlett Johansson, Channing Tatum, George Clooney, Larry David, Charlize Theron, Mark Wahlberg, Kobe Bryant, Steve Carell, Hugh Jackman, Kristen Wiig, Jeff Bridges, Jennifer Garner, Ryan Gosling, Bryan Cranston, Jamie Foxx, Amy Poehler, Ben Affleck, Robert Downey Jr., Jake Gyllenhaal, Oprah, and unfortunately Matt Damon.\n\nJohn Cena's Epic Response to Dwayne Johnson's Threat\nhttps://youtu.be/yN0O8UaTnRA",False
7SAisWFutbw,2018-04-07 00:00:00,Dr. Evil Gets Fired from Trump's Cabinet,The Tonight Show Starring Jimmy Fallon,23,2018-04-05 03:46:17,"The Tonight Show|""Jimmy Fallon""|""Dr. Evil""|""Gets Fired""|""Trump""|""Cabinet""|""NBC""|""NBC TV""|""Television""|""Funny""|""Talk Show""|""comedic""|""humor""|""snl""|""Fallon Stand-up""|""Fallon monologue""|""tonight""|""show""|""jokes""|""funny video""|""interview""|""variety""|""comedy sketches""|""talent""|""celebrities""|""video""|""clip""|""highlight""|""Austin Powers""|""Goldmember""|""The Spy Who Shagged Me""|""Saturday Night Live""|""White House""",1966578,30298,1451,2122,https://i.ytimg.com/vi/7SAisWFutbw/default.jpg,False,False,False,"Jimmy interviews the latest person to be fired from the Trump administration, Dr. Evil (Mike Myers).\n\nSubscribe NOW to The Tonight Show Starring Jimmy Fallon: http://bit.ly/1nwT1aN\n\nWatch The Tonight Show Starring Jimmy Fallon Weeknights 11:35/10:35c\nGet more Jimmy Fallon: \nFollow Jimmy: http://Twitter.com/JimmyFallon\nLike Jimmy: https://Facebook.com/JimmyFallon\n\nGet more The Tonight Show Starring Jimmy Fallon: \nFollow The Tonight Show: http://Twitter.com/FallonTonight\nLike The Tonight Show: https://Facebook.com/FallonTonight\nThe Tonight Show Tumblr: http://fallontonight.tumblr.com/\n\nGet more NBC: \nNBC YouTube: http://bit.ly/1dM1qBH\nLike NBC: http://Facebook.com/NBC\nFollow NBC: http://Twitter.com/NBC\nNBC Tumblr: http://nbctv.tumblr.com/\nNBC Google+: https://plus.google.com/+NBC/posts\n\nThe Tonight Show Starring Jimmy Fallon features hilarious highlights from the show including: comedy sketches, music parodies, celebrity interviews, ridiculous games, and, of course, Jimmy's Thank You Notes and hashtags! You'll also find behind the scenes videos and other great web exclusives.\n\nDr. Evil Gets Fired from Trump's Cabinet\nhttp://www.youtube.com/fallontonight",False
HwkLbeEYz6E,2018-04-07 00:00:00,Yodeling Walmart Kid EDM Remix (OFFICIAL AUDIO) + DOWNLOAD LINK,GalacticFusion,20,2018-04-03 01:03:53,"walmart|""EDM""|""TRAP""|""REMIX""|""YODELING WALMART KID EDM FLIP""|""YODELING WALMART KID EDM REMIX""|""WALMART KID""|""walmart kid singing""|""walmart yodeling kid""|""walmart yodeling kid remix""",2062332,60966,912,3305,https://i.ytimg.com/vi/HwkLbeEYz6E/default.jpg,False,False,False,Snapchat: ferrod26\n\nDownload link (MP3) http://sprysphere.com/3USb\n\n1 HOUR VERSION: https://youtu.be/WRpFfJpFou0\n\nOriginal Source: https://soundcloud.com/thelowercase/kid-singing-in-walmart-flip,False
guRbfQFddfg,2018-04-07 00:00:00,John Krasinski Answers the Web's Most Searched Questions | WIRED,WIRED,24,2018-04-04 16:00:48,"autocomplete|""google autocomplete""|""google autocomplete interview""|""ott autocomplete""|""wired""|""wired autocomplete""|""wired autocomplete interview""|""john krasinski""|""jim halpert""|""a quiet place""|""a quiet place john krasinski""|""john krasinski interview""|""john krasinski autocomplete""|""jon krasinski""|""john krasinski the office""|""jim halpert actor""|""john krasinski funny""|""john krasinski funny moments""|""john krasinski a quiet place""|""wired.com""",1942418,57127,701,2876,https://i.ytimg.com/vi/guRbfQFddfg/default.jpg,False,False,False,"'A Quiet Place' director and star John Krasinski takes the WIRED Autocomplete Interview and answers the internet's most searched questions about himself. Does John Krasinski play basketball? Is he married to Jenna Fischer? Can John Krasinski sing?\n\nStill haven’t subscribed to WIRED on YouTube? ►► http://wrd.cm/15fP7B7 \n\n\nABOUT WIRED\nWIRED is where tomorrow is realized. Through thought-provoking stories and videos, WIRED explores the future of business, innovation, and culture.\n\nJohn Krasinski Answers the Web's Most Searched Questions | WIRED",False
PkRo5l8679g,2018-04-07 00:00:00,"THE MAN WHO KILLED DON QUIXOTE Official Trailer (2018) Adam Driver,  Terry Gilliam Movie HD",ONE Media,1,2018-04-05 09:33:56,"Cinema|""Trailer""|""Official""|""Movie""|""Film""|""The Man who Killed Don Quixote""|""Adam Driver""|""Terry Gilliam""",651769,4816,213,521,https://i.ytimg.com/vi/PkRo5l8679g/default.jpg,False,False,False,"THE MAN WHO KILLED DON QUIXOTE Official Trailer (2018) Adam Driver,  Terry Gilliam Movie HD\n© 2018 - Océan Films\n\nComedy, Kids, Family and Animated Film, Blockbuster,  Action Cinema, Blockbuster, Scifi Movie or Fantasy film, Drama...   We keep you in the know! \n\nSubscribe now to catch the best movie trailers 2017 and the latest official movie trailer, film clip, scene, review, interview.",False
HfIgfy0HJHU,2018-04-07 00:00:00,Chadwick Black Panther Boseman Is Hosting SNL,Saturday Night Live,24,2018-04-06 02:00:06,"snl|""saturday night live""|""chadwick boseman""|""cardi b""|""chadwick boseman snl""|""snl host chadwick boseman""|""cardi b snl""|""chadwick boseman snl promo""|""leslie jones""|""black panther""|""s43""|""s43e17""|""episode 17""|""live""|""new york""|""comedy""|""sketch""|""funny""|""hilarious""|""late night""|""host""|""music""|""guest""|""laugh""|""impersonation""|""actor""|""improv""|""musician""|""Chadwick Boseman""|""Black Panther""|""Avengers""|""Avengers: Infinity War""|""Jackie Robinson""|""42""|""James Brown""|""Get on Up""|""Cardi B""|""Bodak Yellow""|""Bartier Cardi""|""Be Careful""",258110,6281,279,534,https://i.ytimg.com/vi/HfIgfy0HJHU/default.jpg,False,False,False,"Chadwick Boseman hosts Saturday Night Live on April 7, 2018, with musical guest Cardi B.\n\n#SNL #SNL43\n\nGet more SNL: http://www.nbc.com/saturday-night-live\nFull Episodes: http://www.nbc.com/saturday-night-liv...\n\nLike SNL: https://www.facebook.com/snl\nFollow SNL: https://twitter.com/nbcsnl\nSNL Tumblr: http://nbcsnl.tumblr.com/\nSNL Instagram: http://instagram.com/nbcsnl \nSNL Pinterest: http://www.pinterest.com/nbcsnl/",False
nsZvmFUXkrI,2018-04-07 00:00:00,"Racist Superman | Rudy Mancuso, Alesso & King Bach",Rudy Mancuso,23,2018-04-04 16:00:01,"racist superman|""rudy""|""mancuso""|""alesso""|""king""|""bach""|""racist""|""superman""|""rudy mancuso maia mitchell magic official music video""|""domino""|""new year new me""|""separated at birth""|""hannah""|""stocking""|""juanpa""|""zurita""|""lele""|""pons""|""separated""|""at""|""birth""|""poo bear ft justin bieber jay electronica hard to face reality official lyric""|""Poo Bear ft. Justin Bieber & Jay Electronica - Hard to Face Reality (Official Lyric Video)""|""lelepons""|""hannahstocking""|""rudymancuso""|""shots""|""anitta""",4137184,212760,9630,22712,https://i.ytimg.com/vi/nsZvmFUXkrI/default.jpg,False,False,False,WATCH MY PREVIOUS VIDEO ▶ https://youtu.be/lRkTgVynmbM\n\nSUBSCRIBE ► https://www.youtube.com/channel/UC5jkXpfnBhlDjqh0ir5FsIQ?sub_confirmation=1\n\nTHANKS FOR WATCHING! LIKE & SUBSCRIBE FOR MORE VIDEOS!\n-----------------------------------------------------------\nFIND ME ON: \nInstagram | http://instagram.com/rudymancuso\nTwitter | http://twitter.com/rudymancuso\nFacebook | http://facebook.com/rudymancuso\n\nCAST: \nRudy Mancuso | http://youtube.com/c/rudymancuso\nAlesso | http://youtube.com/c/alesso \nAnwar Jibawi | http://youtube.com/c/anwar\nKing Bach | https://instagram.com/kingbach\nJustin Bieber | https://instagram.com/justinbieber\nCorentin | https://instagram.com/corentin\nSimon Rex | https://instagram.com/simonrex415\nTimothy DeLaGhetto | https://instagram.com/timothydelaghetto\nIRO | https://instagram.com/iro_music\nMaia Mitchell | https://instagram.com/maiamitchell\nKlarity | https://instagram.com/klarity\n\nMUSIC:\nAnitta - Vai Malandra (Alesso & KO:YU Remix) | https://youtu.be/p55AlBd8XDU\n\nShots Studios Channels:\nAlesso | https://youtube.com/c/alesso\nAnitta | http://youtube.com/c/anitta\nAnwar Jibawi | http://youtube.com/c/anwar\nAwkward Puppets | http://youtube.com/c/awkwardpuppets\nHannah Stocking | http://youtube.com/c/hannahstocking\nInanna Sarkis | http://youtube.com/c/inanna\nLele Pons | http://youtube.com/c/lelepons\nMaejor | http://youtube.com/c/maejor\nMike Tyson | http://youtube.com/c/miketyson \nRudy Mancuso | http://youtube.com/c/rudymancuso\nShots Studios | http://youtube.com/c/shots\n\n#Rudy\n#RudyMancuso\n#Alesso\n#KingBach\n#Anwar,False
w3Rd-KZeVp4,2018-04-07 00:00:00,Khabib Nurmagomedov Comments on Confrontation with Conor McGregor's Teammate Artem Lobov (UFC 223),MMAWeekly.com,17,2018-04-05 00:05:24,"MMA|""mixed martial arts""|""MMAWeekly.com""|""MMAWeeklyVideos""|""UFC""|""Ultimate Fighting Championship""|""Khabib Nurmagomedov""|""Conor McGregor""|""Artem Lobob""|""UFC 223""|""Press Conference""",113106,239,224,147,https://i.ytimg.com/vi/w3Rd-KZeVp4/default.jpg,False,False,False,"Khabib Nurmagomedov obviously didn't want to talk about the confrontation between him and Conor McGregor's teammate Artem Lobov at the UFC 223 press conference. But, when asked by a fan during his Q&A he gave a little.\n\nWebsite: http://www.MMAWeekly.com/\n\nSubscribe on Youtube: https://www.youtube.com/subscription_center?add_user=MMAWeeklyVideos\nFacebook: https://www.facebook.com/MMAWeeklycom-176775391774/\nTwitter: https://twitter.com/MMAWeeklycom/\nInstagram: https://www.instagram.com/mmaweekly/\nGoogle+: https://plus.google.com/u/0/b/109861839212178013154/+mmaweekly/posts",False
VM-g_bkFdzo,2018-04-07 00:00:00,[STATION] TEN 텐 'New Heroes' MV,SMTOWN,10,2018-04-06 09:00:05,"NCT|""텐""|""TEN""|""SM STATION""|""슴스테""|""New Heroes""|""NCT U""|""NCT 2018""",1113267,206212,507,19119,https://i.ytimg.com/vi/VM-g_bkFdzo/default.jpg,False,False,False,"The 52nd STATION track, TEN's New Heroes has been released!\nListen and download on iTunes & Apple Music, Spotify, and Google Play Music http://smarturl.it/STATION2_52\n\nNCT Official\nhttp://www.nct2018.com\nhttp://nct.smtown.com\nhttp://www.youtube.com/nctsmtown\nhttp://www.facebook.com/NCT.smtown\nhttp://www.instagram.com/nct\nhttp://twitter.com/NCTsmtown\n\nSM STATION Official\nhttp://www.instagram.com/smtownstation\nhttp://www.facebook.com/station.smtown\n\n[STATION] TEN 텐 'New Heroes' MV ℗ S.M.Entertainment",False
J75enyWdbBM,2018-04-07 00:00:00,David Guetta & Sia - Flames (Official Video),David Guetta,10,2018-04-05 16:20:51,"david guetta|""sia""|""flames""|""danny trejo""|""music video""|""clip""",769927,39492,1641,2309,https://i.ytimg.com/vi/J75enyWdbBM/default.jpg,False,False,False,"BUY/LISTEN: http://guetta.co/flames\nStarring Danny Trejo, Lauren Mary Kim, Courtney Chen, Erin Wu \nDirector: Lior Molcho\nProducers: Chen Biton & Lior Molcho\nDirector of Photography: Danit Sigler\nSet Designer: Katie C Shipley \nHair & Makeup Supervisor: Ana Gabriela Quiñonez \nWardrobe Supervisor: Chandra Dyani Chavez \nStunt Coordinator: Deven MacNair \nFight Director: Alfred Hsing\nA Neon Cat Production\n(P) & (C) 2018 What A Music Ltd, Under Exclusive Licence to Parlophone/Warner Music France, a Warner Music Group Company\n\nDavid Guetta & Sia - Flames\n(Sia Furler, Chris Braide, David Guetta, Giorgio Tuinfort, Marcus van Wattum)\nProduced By David Guetta and Giorgio Tuinfort\nAdditional Production by Marcus van Wattum\nAll Instruments and Programming by David Guetta and Giorgio Tuinfort\nGuitars by Pierre-Luc Rioux\nPiano by Giorgio Tuinfort\nAdditional Programming by Marcus van Wattum\nVocals produced by Chris Braide\nMixed by Serban Ghenea at MixStar Studios, Virginia Beach, VA\nEngineered for Mix by John Hanes\nPublishers: Sony/ATV Music Publishing; BMG Platinum Songs/ Magical Thinking BMI All Rights Administered By BMG Rights Management (US) LLC; JackBack Publishing Ltd (SACEM) Administred by Bernstein Shapiro (ASCAP); NEW CLASSIC (BUMA); NEW CLASSIC (BUMA);\n(P) & (C) 2018 What A Music Ltd, Under Exclusive Licence to Parlophone/Warner Music France, a Warner Music Group Company\n\nFollow David Guetta:\nhttp://www.davidguetta.com\nhttp://facebook.com/DavidGuetta\nhttp://www.twitter.com/DavidGuetta\nhttp://www.instagram.com/davidguetta",False
bI31WqFDxNs,2018-04-07 00:00:00,A Very Special Message from Deadpool,20th Century Fox,1,2018-04-04 01:44:40,"Trailer|""Deadpool""|""20th Century Fox (Production Company)""|""Deadpool Movie""|""Ryan Reynolds (Celebrity)""|""Ed Skrein (Musical Artist)""|""T. J. Miller (TV Writer)""|""Gina Carano (Martial Artist)""|""Red band""|""Red band deadpool""|""Marvel""|""Marvel Comics""|""Comic Book (Comic Book Genre)""|""Dead pool""|""Deadpool green band""|""Deadpool red band""|""Action""|""Comedy""|""Action Comedy""|""X-Men (Award-Winning Work)""|""deadpool movie""|""deadpool sequel""|""deadpool 2""|""2nd deadpool movie""",1308341,40021,486,1156,https://i.ytimg.com/vi/bI31WqFDxNs/default.jpg,False,False,False,"Enter to win Deadpool’s Pink Suit and Send a Big F-You to Cancer at https://Fox.co/DeadpoolPinkSuitYT\nLearn more about Fuck Cancer at https://LetsFCancer.com\n\nAfter surviving a near fatal bovine attack, a disfigured cafeteria chef (Wade Wilson) struggles to fulfill his dream of becoming Mayberry’s hottest bartender while also learning to cope with his lost sense of taste. Searching to regain his spice for life, as well as a flux capacitor, Wade must battle ninjas, the yakuza, and a pack of sexually aggressive canines, as he journeys around the world to discover the importance of family, friendship, and flavor – finding a new taste for adventure and earning the coveted coffee mug title of World’s Best Lover. \n\nIn Theaters May 18, 2018\n\nConnect with Deadpool Online: http://fox.co/DeadpoolMovieSite\nLike Deadpool on FACEBOOK: http://fox.co/DeadpoolFB\nFollow Deadpool on TWITTER: http://fox.co/DeadpoolTwitter\nFollow Deadpool on INSTAGRAM: http://fox.co/DeadpoolInstagram",False
kX0vO4vlJuU,2018-04-07 00:00:00,BTS (방탄소년단) 'Euphoria : Theme of LOVE YOURSELF 起 Wonder',ibighit,10,2018-04-05 15:00:05,"BIGHIT|""빅히트""|""방탄소년단""|""BTS""|""BANGTAN""|""방탄""",10208424,1795544,10956,201589,https://i.ytimg.com/vi/kX0vO4vlJuU/default.jpg,False,False,False,"BTS (방탄소년단) 'Euphoria : Theme of LOVE YOURSELF 起 Wonder'\n\n\n\ncredits:\n\n\nDirector : YongSeok Choi (Lumpens)\nAssistant Director : WonJu Lee (Lumpens)\nDirector of Photography : HyunWoo Nam(GDW)\nGaffer : HyunSuk Song (Real Lighting)\nArt Director : JinSil Park Bona Kim (MU:E)\nProducer : Emma SungEun Kim (GE Production)\n\n\n\nBigHit Entertainment. Rights are reserved selectively in the video.\nUnauthorized reproduction is a violation of applicable laws. \nManufactured by BigHit Entertainment, Seoul, Korea\n\n\n\nConnect with BTS:\nhttp://www.ibighit.com\nhttp://weibo.com/BTSbighit\nhttp://twitter.com/BTS_bighit\nhttp://twitter.com/BTS_twt\nhttps://www.facebook.com/ibighit/\nhttp://www.facebook.com/bangtan.official\nhttp://instagram.com/BTS.bighitofficial\n\n\nBU content certified by Big Hit Entertainment",False
H4Hb6HcCm_E,2018-04-07 00:00:00,Cardi B - Drip feat. Migos [Official Audio],Cardi B,22,2018-04-04 04:00:55,"Cardi B|""Drip""|""Migos""|""Motorsport""|""Offset""|""Quavo""|""Takeoff""|""Invasion of Privacy""|""Bardi""|""Bardi Gang""|""Bodak Yellow""|""Bartier Cardi""|""Be Careful""|""Offset Cheating""|""l3uG4T8pJfw""|""sXP6vliZIHI""|""Cardi Music""|""New Cardi B""|""Cardi B Leak""|""Cardi B Drip""|""Cardi B Album""|""Cardi B Offset""|""Cardi B Bartier Carti""|""Cardi B Invasion of Privacy""|""Cardi B - DRIP (feat. Migos)""|""Cardi B Single""",4269095,164259,7796,17396,https://i.ytimg.com/vi/H4Hb6HcCm_E/default.jpg,False,False,False,Cardi B - Drip feat. Migos off Invasion of Privacy\nStream/Download: https://CardiB.lnk.to/IOPId\n\n\nExclusive Bardi Gang merchandise available here: http://smarturl.it/BardiGangMerchYT\n\nFollow Cardi B\nhttp://cardibofficial.com/\nhttp://Facebook.com/IAmCardiB\nhttp://Instagram.com/IAmCardiB\nhttp://Twitter.com/IAmCardiB\nhttp://Soundcloud.com/IAmCardiB,False
_7z85ipjSwA,2018-04-07 00:00:00,"Future, Young Thug - Group Home",FutureVEVO,10,2018-04-04 14:00:03,"future|""young thug""|""group home""|""group home official video""|""mask off""|""bum bum tam tam""|""low life""|""patek water""|""kings dead""|""feds did a sweep""|""mink flow""|""all da smoke""|""super slimey""|""hndrxx""|""yo gotti""|""gucci mane""|""rick ross""|""relationship""|""pick up the phone""|""Epic/300/Atlantic Recording Corporation""|""Future & Young Thug""|""Group Home""|""Rap""",1106785,39283,1920,3200,https://i.ytimg.com/vi/_7z85ipjSwA/default.jpg,False,False,False,"Super Slimey available at:\niTunes http://smarturl.it/SUPERSLIMEY/itunes\nApple Music http://smarturl.it/SUPERSLIMEY/applemusic\nSpotify  http://smarturl.it/SUPERSLIMEY/spotify\nGoogle Play http://smarturl.it/SUPERSLIMEY/googleplay\nAmazon Digital http://smarturl.it/SUPERSLIMEY/amazonmusicbuy\nDeezer http://smarturl.it/SUPERSLIMEY/deezer\nSoundcloud http://smarturl.it/SUPERSLIMEY/soundcloud\nTidal  http://smarturl.it/SUPERSLIMEY/tidal\n\nFuture online: \nhttps://twitter.com/1future \nhttps://www.instagram.com/future \nhttps://soundcloud.com/futureisnow \nhttps://www.facebook.com/FutureOfficial \nhttp://freebandz.com/\n\nYoung Thug online: \nhttps://twitter.com/youngthug \nhttps://www.instagram.com/thuggerthugger1/ \nhttps://www.facebook.com/youngthugmusic\n\n(C) 2018 Epic Records, a division of Sony Music Entertainment. With 300 Entertainment/Atlantic Recordings Corporation.",False
