id,trending_date,Label,channel_title,category_id,publish_time,tags,views,likes,dislikes,comment_count,thumbnail_link,comments_disabled,ratings_disabled,video_error_or_removed,description,popular_tag
QerVvvNem1w,2017-12-19 00:00:00,OCEAN'S 8 - Trailer Teaser,Warner Bros. Pictures,24,2017-12-18 14:35:14,"Ocean's 8|""Ocean's 8 Movie""|""Sandra Bullock""|""Cate Blanchett""|""Anne Hathaway""|""Mindy Kaling""|""Sarah Paulson""|""Awkwafina""|""Rihanna""|""Helena Bonham Carter""|""Gary Ross""|""Summer 2018""|""Movies""|""Film""|""Comedy""|""Heist""|""Crime""|""Action""|""Warner Bros""|""Warner Bros Pictures""|""WB""|""WB Pictures""|""Village Roadshow Pictures""",632993,7802,5669,2930,https://i.ytimg.com/vi/QerVvvNem1w/default.jpg,False,False,False,#Oceans8 trailer drops tomorrow.,False
h_67XloYXTc,2017-12-19 00:00:00,Will Smith Watched His Sons Jump Out of an Airplane,TheEllenShow,24,2017-12-14 14:00:26,"Will|""Smith""|""Will Smith""|""scares""|""scares on ellen""|""instagram""|""selfie""|""fresh prince of bel air""|""actor""|""Ellen""|""degeneres""|""ellen degeneres""|""the ellen show""|""ellen fans""|""ellen tickets""|""ellentube""|""ellen audience""|""fresh""|""prince""|""bel""|""air""|""interview""|""jaden""|""smith""|""skydiving""|""wax""|""figure""|""funny""|""jada""|""pinket""|""scare""|""tbt""",2092066,33584,1037,1289,https://i.ytimg.com/vi/h_67XloYXTc/default.jpg,False,False,False,"Movie star Will Smith ticked a few things off of his bucket list, including bungee jumping and skydiving with his brave sons.",False
VH0wjFRNKXw,2017-12-19 00:00:00,GYMNASTICS MEETS CHEERLEADING!,Nile Wilson,17,2017-12-13 18:00:02,"nile wilson|""nile wilson gymnastics""|""nile wilson olympics""|""olympic gymnast""|""amazing gymnastics""|""gymnastics""|""strength training""|""strength""|""hard work""|""vlogging""|""vlog""|""success""|""fitness""|""gymnastics meets cheerleading""|""gymnastics vs cheersleading""|""ultimate gymnastics challenge""|""twin sisters strength challenge""|""beautiful twin sisters""|""twin gymnastics""",428620,16746,257,806,https://i.ytimg.com/vi/VH0wjFRNKXw/default.jpg,False,False,False,"➢ The Green Twins - https://www.instagram.com/thegreen_twins/\n\n➢ Aviators - http://www.aviatorscheer.co.uk\n\n➢ NEIL & NILE- https://www.youtube.com/channel/UCRSSEcNnFKURWw1NZ7DpRCg\n➢ Join my FREE 7 Steps to Success - http://www.bodybible.life/\n➢ Merch- http://www.nwclothing.co.uk/\n➢ Enquiries - luke@activatemanagement.co.uk\n➢R&B- https://open.spotify.com/user/1177145901/playlist/0DqvE5p0HqNfDbE3sS8rKZ\n➢House - https://open.spotify.com/user/1177145901/playlist/2Vw8Wv059AoDWKJRaBTfzE\n➢ Handstand Programme 🤸🏼‍♂️https://bodybible.life/individual-programmes-2/\n➢ Depop -https://www.depop.com/joannaj\n➢ Gymnastics Gear ~ https://www.turn-gymnastics.com/\n➢ Intro Song ~ Tom Zanetti, Darlin'\n➢ Soundcloud ~ https://soundcloud.com/nile-wilson-2/sets/wobblers\n➢Instagram https://instagram.com/nilemw/\n➢ Body Bible instagram https://www.instagram.com/nw_bodybible/\n➢Twitter https://twitter.com/NileMW\n➢Facebook https://www.facebook.com/NileWilsonGy…\n➢SnapChat - nilewilson\n➢Songs ~ https://www.youtube.com/user/officialdjwelshy",False
mriYyuDmB58,2017-12-19 00:00:00,Zendaya Shows One of Her and Zac Efron's Trapeze Fails for The Greatest Showman,The Tonight Show Starring Jimmy Fallon,23,2017-12-12 11:00:07,"The Tonight Show|""Jimmy Fallon""|""Zendaya""|""Shows""|""Zac Efron""|""Trapeze""|""Fails""|""The Greatest Showman""|""NBC""|""NBC TV""|""Television""|""Funny""|""Talk Show""|""comedic""|""humor""|""snl""|""Fallon Stand-up""|""Fallon monologue""|""tonight""|""show""|""jokes""|""funny video""|""interview""|""variety""|""comedy sketches""|""talent""|""celebrities""|""video""|""clip""|""highlight""|""Spider-Man: Homecoming""|""Mary Jane""|""MJ""|""Michelle""|""K.C. Undercover""|""K.C. Cooper""|""Shake It Up!""|""Rocky Blue""|""Zapped""|""Zoey Stevens""|""musical""",2687148,65579,510,1775,https://i.ytimg.com/vi/mriYyuDmB58/default.jpg,False,False,False,"Zendaya walks Jimmy through how she built up upper body strength - and trust - to do trapeze with Zac Efron for The Greatest Showman and shows footage of one of their many bloopers from filming.\n\nSubscribe NOW to The Tonight Show Starring Jimmy Fallon: http://bit.ly/1nwT1aN\n\nWatch The Tonight Show Starring Jimmy Fallon Weeknights 11:35/10:35c\nGet more Jimmy Fallon: \nFollow Jimmy: http://Twitter.com/JimmyFallon\nLike Jimmy: https://Facebook.com/JimmyFallon\n\nGet more The Tonight Show Starring Jimmy Fallon: \nFollow The Tonight Show: http://Twitter.com/FallonTonight\nLike The Tonight Show: https://Facebook.com/FallonTonight\nThe Tonight Show Tumblr: http://fallontonight.tumblr.com/\n\nGet more NBC: \nNBC YouTube: http://bit.ly/1dM1qBH\nLike NBC: http://Facebook.com/NBC\nFollow NBC: http://Twitter.com/NBC\nNBC Tumblr: http://nbctv.tumblr.com/\nNBC Google+: https://plus.google.com/+NBC/posts\n\nThe Tonight Show Starring Jimmy Fallon features hilarious highlights from the show including: comedy sketches, music parodies, celebrity interviews, ridiculous games, and, of course, Jimmy's Thank You Notes and hashtags! You'll also find behind the scenes videos and other great web exclusives.\n\nZendaya Shows One of Her and Zac Efron's Trapeze Fails for The Greatest Showman\nhttp://www.youtube.com/fallontonight",False
2lCW-iaOZ_M,2017-12-19 00:00:00,The Nerd Crew: The Last Jedi FULL REVIEW (SPOILERS!!!),RedLetterMedia,24,2017-12-12 07:56:01,"redlettermedia|""red letter media""|""red""|""letter""|""media""|""plinkett""|""half in the bag""|""mike stoklasa""|""jay bauman""|""rich evans""|""Nerd Crew""|""Star Wars""|""The Last Jedi review""|""last jedi""",557877,25670,12847,6010,https://i.ytimg.com/vi/2lCW-iaOZ_M/default.jpg,False,False,False,The Nerd Crew releases their review of The Last Jedi after attending the star studded premiere in Los Angeles!,False
vn9mMeWcgoM,2017-12-19 00:00:00,Jurassic World: Fallen Kingdom - Official Trailer [HD],Universal Pictures,24,2017-12-08 01:44:25,"Jurassic World|""Fallen Kingdom""|""Jurassic Park""|""T-Rex""|""Dinosaur""|""J.A. Bayona""|""Steven Spielberg""|""Colin Trevorrow""|""Chris Pratt""|""Bryce Dallas Howard""|""BD Wong""|""James Cromwell""|""Ted Levine""|""Justice Smith""|""Geraldine Chaplin""|""Daniella Pineda""|""Toby Jones""|""Jeff Goldblum""|""Rafe Spall""|""Derek Connolly""|""Isla Nublar""|""Raptor""",41612497,566948,28954,68309,https://i.ytimg.com/vi/vn9mMeWcgoM/default.jpg,False,False,False,"Jurassic World: Fallen Kingdom\nIn Theaters June 22, 2018 \n\nhttps://www.jurassicworld.com\n\nIt’s been four years since theme park and luxury resort Jurassic World was destroyed by dinosaurs out of containment.  Isla Nublar now sits abandoned by humans while the surviving dinosaurs fend for themselves in the jungles.\n\nWhen the island’s dormant volcano begins roaring to life, Owen (Chris Pratt) and Claire (Bryce Dallas Howard) mount a campaign to rescue the remaining dinosaurs from this extinction-level event.  Owen is driven to find Blue, his lead raptor who’s still missing in the wild, and Claire has grown a respect for these creatures she now makes her mission.  Arriving on the unstable island as lava begins raining down, their expedition uncovers a conspiracy that could return our entire planet to a perilous order not seen since prehistoric times.\n\nWith all of the wonder, adventure and thrills synonymous with one of the most popular and successful series in cinema history, this all-new motion-picture event sees the return of favorite characters and dinosaurs—along with new breeds more awe-inspiring and terrifying than ever before.  Welcome to Jurassic World: Fallen Kingdom.  \n\nStars Pratt and Howard return alongside executive producers Steven Spielberg and Colin Trevorrow for Jurassic World: Fallen Kingdom.  They are joined by co-stars James Cromwell, Ted Levine, Justice Smith, Geraldine Chaplin, Daniella Pineda, Toby Jones, Rafe Spall and Isabella Sermon, while BD Wong and Jeff Goldblum reprise their roles.\n\nDirected by J.A. Bayona (The Impossible), the epic action-adventure is written by Jurassic World’s director, Trevorrow, and its co-writer, Derek Connolly.  Producers Frank Marshall and Pat Crowley once again partner with Spielberg and Trevorrow in leading the filmmakers for this stunning installment.  Belén Atienza joins the team as a producer.",False
HKIIgYFhQlE,2017-12-19 00:00:00,G-Eazy - Sober (Audio) ft. Charlie Puth,GEazyMusicVEVO,10,2017-12-08 05:00:01,"BPG/RVG/RCA Records|""G-Eazy feat. Charlie Puth""|""Rap""|""Sober""",3905540,130790,1197,4230,https://i.ytimg.com/vi/HKIIgYFhQlE/default.jpg,False,False,False,New Album ‘The Beautiful & Damned’ Available Everywhere http://smarturl.it/TBAD\nGet exclusive TB&D bundles here: http://smarturl.it/TBAD/officialstore\nSubscribe for more exclusive G-Eazy footage: http://bit.ly/GEazyYTSub\nG-Eazy Official Site: http://g-eazy.com/\nG-Eazy On Twitter: https://twitter.com/G_Eazy\nG-Eazy On Facebook: https://www.facebook.com/G.Eazy\nG-Eazy on Instagram: https://www.instagram.com/g_eazy,False
5ELQ6u_5YYM,2017-12-19 00:00:00,Black Mirror - Season 4 | Official Trailer [HD] | Netflix,Netflix,24,2017-12-06 15:00:01,"08282016NtflxUSCAN|""Black Mirror""|""Netflix""|""Netflix Original Series""|""San Junipero""|""Charlie Brooker""|""Arkangel""|""USS Callister""|""U.S.S. Callister""|""Hang the DJ""|""Metalhead""|""Black Museum""|""Crocodile""|""Jodie Foster""|""Toby Haynes""|""Jesse Plemons""|""Cristin Milioti""|""Jimmi Simpson""|""Michaela Joel""|""Billy Magnussen""|""John Hillcoat""|""Timothy Van Patten""|""David Slade""|""Colm McCarthy""|""Letitia Wright""|""Babs""|""Olusanmokun""|""Humans""|""the twilight zone""|""stranger things""|""Mr. Robot""|""Orphan Black""|""bm4main""",1076928,22757,306,1730,https://i.ytimg.com/vi/5ELQ6u_5YYM/default.jpg,False,False,False,"It’s hard to imagine a bright future, but we must. Charlie Brooker’s Black Mirror returns to Netflix December 29th.\n\nWatch Black Mirror on Netflix:\nhttps://www.netflix.com/title/70264888\n\nSUBSCRIBE: http://bit.ly/29qBUt7\n\nAbout Netflix:\nNetflix is the world’s leading Internet television network with over 100 million members in over 190 countries enjoying more than 125 million hours of TV shows and movies per day, including original series, documentaries and feature films. Members can watch as much as they want, anytime, anywhere, on nearly any Internet-connected screen. Members can play, pause and resume watching, all without commercials or commitments.\n\nConnect with Netflix Online:\nVisit Netflix WEBSITE: http://nflx.it/29BcWb5\nLike Netflix Kids on FACEBOOK: http://bit.ly/NetflixFamily\nLike Netflix on FACEBOOK: http://bit.ly/29kkAtN\nFollow Netflix on TWITTER: http://bit.ly/29gswqd\nFollow Netflix on INSTAGRAM: http://bit.ly/29oO4UP\nFollow Netflix on TUMBLR: http://bit.ly/29kkemT\n\nBlack Mirror - Season 4 | Official Trailer [HD] | Netflix\nhttp://youtube.com/netflix",False
N9s2YY3g2r0,2017-12-19 00:00:00,Wheel Love - 50to01 (Full Film),50to01 TV,1,2017-12-06 08:47:44,"50to01|""wheel love""|""wheel""|""love""|""full""|""film""|""josh bryceland""|""josh lewis""|""max nerurkar""|""sam dale""|""mtb""",99835,2398,35,324,https://i.ytimg.com/vi/N9s2YY3g2r0/default.jpg,False,False,False,"Feel the love, share the buzz. A message from home created in the orange months. Enjoy! www.50to01.com",False
5c7FL9QV1bs,2017-12-19 00:00:00,The Moclans Teach Ed How To Play Latchcomb | Season 1 Ep. 12 | THE ORVILLE,The Orville,24,2017-12-08 02:00:46,"The Orville|""Seth MacFarlane""|""Family Guy""|""Space Adventure""|""Peter Macon""|""Bortus""|""Ed Mercer""|""Fox""|""Fox Broadcasting""|""TV Comedy""|""Animation On Fox""|""Ted 2""|""Peter Griffin""|""Seth McFarlane""|""Brannon Braga""|""David A. Goodman""|""Jason Clark""|""Liz Heldens""|""Science Fiction""|""Space""|""Outer Space""|""Jon Favreau""|""The Jungle Book""|""Friday Night Lights""|""Neighbors""|""Agents of S.H.I.E.L.D""|""Season 1""|""Episode 12""|""Mad Idolatry""|""The Moclans""|""Teach Ed""|""How To Play Latchcomb""|""Latchcomb isn't for everyone""",21856,547,11,126,https://i.ytimg.com/vi/5c7FL9QV1bs/default.jpg,False,False,False,"Latchcomb isn't for everyone, and Ed quickly finds this out.\n\nSubscribe now for more The Orville clips: http://fox.tv/SubscribeTheOrville\n\nSee more of The Orville on our official site: http://fox.tv/TheOrville\nLike The Orville on Facebook: http://fox.tv/TheOrville_FB\nFollow The Orville on Twitter: http://fox.tv/TheOrville_TW\nFollow The Orville on Instagram: http://fox.tv/TheOrville_IG\n\nLike FOX on Facebook: ‪http://fox.tv/FOXTV_FB‬‬\nFollow FOX on Twitter: ‪http://fox.tv/FOXTV_Twitter‬‬\nAdd FOX on Google+: ‪http://fox.tv/FOXPlus‬‬\n\nFrom Emmy Award-winning executive producer and creator Seth MacFarlane (FAMILY GUY, “Ted”) and directed by Jon Favreau (“The Jungle Book,” “Iron Man”), THE ORVILLE is a one-hour science fiction series set 400 years in the future that follows the adventures of the U.S.S. Orville, a mid-level exploratory vessel. Its crew, both human and alien, faces the wonders and dangers of outer space, while also dealing with the familiar, often humorous problems of regular people in a workplace…even though some of those people are from other planets, and the workplace is a faster-than-light spaceship. In the 25th century, Earth is part of the Planetary Union, a far-reaching, advanced and mostly peaceful civilization with a fleet of 3,000 ships. Down on his luck after a bitter divorce, Planetary Union officer ED MERCER (MacFarlane) finally gets his chance to command one of these ships: the U.S.S. Orville. Determined to prove his worth and write a new chapter in his life, Ed finds that task all the more difficult when the First Officer assigned to his ship is his ex-wife, KELLY GRAYSON (Adrianne Palicki, “Agents of S.H.I.E.L.D.,” “Friday Night Lights”). As the new commander, Ed assembles a qualified, but eccentric crew, including his best friend, GORDON MALLOY (Scott Grimes, “ER,” “Justified”), who has problems with authority, but is the best helmsman in the fleet; DR. CLAIRE FINN (Penny Johnson Jerald, “24,” “The Larry Sanders Show”), one of the Union’s most accomplished physicians; BORTUS (Peter Macon, “Shameless,” “Bosch”), an alien from a single-sex species; ISAAC (Mark Jackson, “That Royal Today”), an artificial life-form from a machine society that thinks biological life-forms are inferior; navigator JOHN LAMARR (J. Lee, FAMILY GUY, “The Cleveland Show”), whose casual humor cuts through even the most dire situations; ALARA KITAN (Halston Sage, “Neighbors,” “Goosebumps”), a young, inexperienced security officer whose home planet’s high gravity gives her superior physical strength; and YAPHIT, a gelatinous creature voiced by comedian Norm Macdonald (“The Middle,” “Saturday Night Live”). Somehow, Ed and Kelly must put the past behind them and, with the help of the crew, navigate fascinating and sometimes dangerous adventures in outer space, as well as the tumultuous and captivating day-to-day personal relationships with their colleagues.\n\nThe Moclans Teach Ed How To Play Latchcomb | Season 1 Ep. 12 | THE ORVILLE\nhttps://www.youtube.com/channel/UC-AtVTn-F0RUtdXDXzhXzmQ",False
6mDsa-AqNcQ,2017-12-19 00:00:00,India's Geography Problem,Wendover Productions,27,2017-12-05 15:30:01,"india|""geography""|""problem""|""geopolitics""|""politics""|""issue""|""power""|""geo""|""water""|""borders""|""china""|""tibet""|""nepal""|""bhutan""|""bangladesh""|""indian""|""pakistan""|""east pakistan""|""british empire""|""britain""|""british""|""partition""|""international relations""|""wendover productions""|""wendover""|""half as interesting""|""hai""|""explained""|""interesting""|""animated""|""international""|""defense""|""human""|""people""|""countries""",780934,25844,1622,6122,https://i.ytimg.com/vi/6mDsa-AqNcQ/default.jpg,False,False,False,"Build your website for 10% off by going to http://squarespace.com/wendover\n\nSubscribe to Half as Interesting (The other channel from Wendover Productions): https://www.youtube.com/halfasinteresting\n\nCheck out my podcast with Brian from Real Engineering:\nhttps://itunes.apple.com/us/podcast/showmakers/id1224583218?mt=2 (iTunes link)\nhttps://www.youtube.com/channel/UC_10vJJqf2ZK0lWrb5BXAPg (YouTube link)\n\nSupport Wendover Productions on Patreon: https://www.patreon.com/wendoverproductions\n\nGet a Wendover Productions t-shirt for $20: \nhttps://store.dftba.com/products/wendover-productions-shirt\n\nYoutube: http://www.YouTube.com/WendoverProductions\nTwitter: http://www.Twitter.com/WendoverPro\nEmail: WendoverProductions@gmail.com\nReddit: http://Reddit.com/r/WendoverProductions\n\nAnimation by Josh Sherrington (https://www.youtube.com/heliosphere)\nSound by Graham Haerther (http://www.Haerther.net)\nThumbnail by Joe Cieplinski (http://joecieplinski.com/)\n\nMusic: So Far Away by Riot, Lithium By Kevin MacLeod, Hydra by Huma Huma, Namaste by Audionautix, and Raw Deal by Gunnar Olsen\n\nBig thanks to Patreon supporters: M, Pete, Ken Lee, Victor Zimmer, Paul Jihoon Choi, Dylan Benson, Etienne Dechamps, Donald, Chris Allen, Abil Abdulla, Anson Leng, Johnn & Becki Johnston, Connor J Smith, Arkadiy Kulev, Hagai Bloch Gabot, William Chappell, Eyal Matsliah, Joseph Bull, Marcelo Alves Vieira, Hank Green, Plinio Correa, Brady Bellini",False
0lXX3dJUAGY,2017-12-19 00:00:00,Are Intelligent People More Lonely?,The School of Life,27,2017-12-05 14:00:01,"the school of life|""relationships""|""alain de botton""|""philosophy""|""wisdom""|""wellness""|""mindfullness""|""psychology""|""lonely""|""loneliness""|""intelligence""|""why am i lonely""|""how not to be lonely""|""it's hard being smart""|""c'est dur d'être intelligent""|""es ist schwer""|""schlau zu sein""|""很聪明很难""|""यह मुश्किल हो रहा है स्मार्ट""|""es difícil ser inteligente""|""é difícil ser inteligente""|""meetup""|""intelligent""|""cleverness""|""smart""|""high iq""|""school of life""|""genius""|""iq""|""intelligent people""|""facts""|""science""|""people""|""intellect""|""arrogant""",353435,13961,514,1200,https://i.ytimg.com/vi/0lXX3dJUAGY/default.jpg,False,False,False,"It sounds like a hugely arrogant and self-serving suggestion to imply that cleverness might lead you to loneliness. But if you define cleverness in a selective (and modest) way, there may truly be an aspect whereby it can lead to a certain isolation. \nFor gifts and more from The School of Life, visit our online shop: https://goo.gl/jw4fnn\nJoin our mailing list: http://bit.ly/2e0TQNJ \nOr visit us in person at our London HQ: https://goo.gl/nuDuCY\nDownload our App: https://goo.gl/UE9jVJ\n\nFURTHER READING\n\n“It sounds like a very mean and undemocratic thought, trading off the peculiar glamour that isolation has in a Romantic culture – in order to gain an oblique sense of superiority and perhaps pass off an absence of social skills as a virtue.\n\nIt is important, therefore, to be clear what is meant here by intelligence. It has nothing to do with degrees or any of the criteria by which we ordinarily measure cleverness. What is meant is emotional intelligence, which exists (or not) in every strata and nook of society…”\n\nYou can read more on this and other subjects on our blog, here: https://goo.gl/zrSj1X\n\nMORE SCHOOL OF LIFE\n\nOur website has classes, articles and products to help you think and grow: https://goo.gl/W1TZoj\n\nWatch more films on SELF in our playlist: \nhttp://bit.ly/TSOLself\n\nYou can submit translations and transcripts on all of our videos here: https://www.youtube.com/timedtext_cs_panel?c=UC7IcJI8PUf5Z3zKxnZvTBog&tab=2 \nFind out how more here: https://support.google.com/youtube/answer/6054623?hl=en-GB \n\n\nSOCIAL MEDIA\n\nFeel free to follow us at the links below:\n\nDownload our App: https://goo.gl/UE9jVJ\nFacebook: https://www.facebook.com/theschooloflifelondon/  \nTwitter: https://twitter.com/TheSchoolOfLife   \nInstagram: https://www.instagram.com/theschooloflifelondon/ \n\n\nCREDITS\n\nProduced in collaboration with:\n \nLuca Bowles\nhttp://www.lucabowles.com/",False
0XR-FwfdOos,2017-12-19 00:00:00,David Davis on Brexit: 'we've got 50-60 sector analyses done',Steve Topple,22,2017-12-06 12:02:34,[none],14236,47,60,55,https://i.ytimg.com/vi/0XR-FwfdOos/default.jpg,False,False,False,David Davis telling Andrew Marr on 25 June 2017 that the government has done 50-60 sector analyses on the impact of Brexit.,False
dsNNfiA6qjs,2017-12-19 00:00:00,"Nick Crompton - JAKE PAUL, TEAM 10 & MARTINEZ TWINS (Honest Interview)",Caspar,24,2017-12-04 18:58:55,"nick crompton|""jake""|""paul""|""logan""|""every""|""day""|""10""|""team""|""bro""|""instagram""|""dobre""|""funny""|""wow""|""crazy""|""vlog""|""adventure""|""boyfriend""|""comedy""|""logan paul vlog""|""logan paul""|""jake paul""|""jake paul music""|""reaction videos""|""hollywood""|""litmas song""|""logan paul reaction""|""jake paul album""|""christmas songs""|""react""|""litmas jake paul""|""maverick""|""parrot""|""litmas""|""surprise""|""emotion""|""relationship""|""crompton""|""nick""|""family""|""lopez""|""jakepaulers""|""facebook""|""brothers""|""logang""|""new""|""erika""|""song""|""ricegum""|""gum""|""ricegum diss track""|""ricegum song""|""big shaq""",1203368,63889,4078,4509,https://i.ytimg.com/vi/dsNNfiA6qjs/default.jpg,False,False,False,"I spoke to Team 10 COO, Nick Crompton about his success with Team 10, Jake Paul and the drama surrounding the group. \n- Nick's channel: http://youtube.com/thenickcrompton\n- Jake's channel: https://youtube.com/user/JakePaulProductions\n\nFind Caspar:\nMain YouTube: http://youtube.com/Caspar\nSide YouTube: http://youtube.com/MoreCaspar\nTwitter: http://twitter.com/Caspar_Lee\nInstagram: http://instagram.com/Caspar_Lee\nFacebook: http://fb.com/CaspLee\n\nx",False
TKc65We4Yhs,2017-12-19 00:00:00,Day of the Dead: Bloodline Red-Band Trailer (2018),New Trailer Buzz,1,2017-12-06 09:00:04,"day of the dead|""day of the dead remake""|""day of the dead bloodline""|""day of the dead bloodline trailer""|""trailer""|""2017""|""official""|""official Trailer""|""movie""|""film""",207284,1557,264,441,https://i.ytimg.com/vi/TKc65We4Yhs/default.jpg,False,False,False,"Day of the Dead: Bloodline Red-Band Trailer - 2018 Remake of George A. Romeros Day of the Dead\nSubscribe for more: http://www.youtube.com/subscription_center?add_user=NewTrailersBuzz\n\nAbout Day of the Dead Bloodline\n\nA small group of military personnel and survivalists dwell in an underground bunker as they seek to find a cure in a world overrun by zombies.\n\nDay of the Dead: Bloodline is an upcoming Bulgarian-American action horror film directed by Hèctor Hernández Vicens and the screenplay by Mark Tonderai and Lars Jacobson based on the characters created by George A. Romero. The film stars Sophie Skelton, Johnathon Schaech, Jeff Gum, Marcus Vanco and Mark Rhino Smith. It is a remake of the 1985 film Day of the Dead",False
5Kk5QxB9lWk,2017-12-19 00:00:00,How to get stuff done,Anna Akana,23,2017-12-06 01:45:00,"anna|""akana""|""ana""|""annaakana""|""how to get stuff done""|""productive""|""productivity""|""multitasking""|""getting stuff done""|""stuff""|""done""|""finish""|""work""|""self help""|""advice""",239613,18765,189,707,https://i.ytimg.com/vi/5Kk5QxB9lWk/default.jpg,False,False,False,"This video is sponsored by Chromebooks! Find out more about Chromebooks here: https://www.google.com/chromebook/\n\nSo much I want to tell you ▶ http://bit.ly/AnnaBook\nGhost & Stars ▶ http://GhostAndStars.com\n\nbusiness\nAkanaActing@gmail.com\nTom Spriggs at The Coronel Group\n\n\nshot & edited by Eric Lombart\nhttp://youtube.com/EricLombart\n\ngfx by Bethany Radloff\nhttp://youtube.com/BethBeRad\n\nmake ups by Caitlyn Brisbin\nhttp://instagram.com/CatCalico\n\ngrip - Melissa Gasca, John Lee, Megan Pham, Zack Wallnau\n\nsound - John Lee",False
zhbjf49Lv9o,2017-12-19 00:00:00,Camila Cabello teases what to expect on her new album,SiriusXM,10,2017-12-07 16:38:42,"camila cabello|""morning mash up""",30898,1399,12,86,https://i.ytimg.com/vi/zhbjf49Lv9o/default.jpg,False,False,False,"Camila Cabello talks about her new album, collaborations, and how she found her voice with the Morning Mash Up Crew.\n\nSubscribe to SiriusXM on Youtube: http://www.youtube.com/siriusxm\n\nConnect with SiriusXM Online\nFacebook: http://www.facebook.com/siriusxm\nTwitter: http://www.twitter.com/siriusxm\nInstagram: http://www.instagram.com/siriusxm\nGoogle+: http://www.google.com/+siriusxm\n\nYou can hear entire episodes of SiriusXM programming on SiriusXM On Demand. For more information and a free trial go to: http://www.siriusxm.com/ondemand",False
