id,trending_date,Label,channel_title,category_id,publish_time,tags,views,likes,dislikes,comment_count,thumbnail_link,comments_disabled,ratings_disabled,video_error_or_removed,description,popular_tag
zwEn-ambXLw,2018-04-07 00:00:00,This Is Me - Cover by Shoshana Bean Featuring Travis Wall,Shoshana Bean,10,2018-03-22 08:30:07,"travis wall|""shoshana bean""|""greatest showman""|""pasek and paul""|""sytycd""|""wicked""|""lgbtq""|""love""|""dance""|""acoustic""|""cover""|""equality""|""vocals""",246809,8626,146,328,https://i.ytimg.com/vi/zwEn-ambXLw/default.jpg,False,False,False,"I was lucky enough to lay the original demo for this song almost 3 years ago. \n\nI am now lucky to share this acoustic cover version with the insanely talented Travis Wall who conceived, directed, produced and choreographed.\n\nDownload the song here: https://itunes.apple.com/us/album/this-is-me-single/1352620763\n\nI was lucky enough to sing the original demo for this song almost 3 years ago. This acoustic cover is available for download and streaming and all proceeds go to benefit the LA LGBTQ Center.",False
jnQ4V-wajLY,2018-04-07 00:00:00,Jhené Aiko feat. Kurupt -Never Call Me (Slauson Hills Edition),Jhené Aiko,10,2018-03-20 19:16:04,[none],4738235,111850,2327,4720,https://i.ytimg.com/vi/jnQ4V-wajLY/default.jpg,False,False,False,"Music video by Jhené Aiko featuring Kurupt performing Never Call Me. \n\nSLAUSON HILLS\n\n© 2018 2 Fish, LLC / ArtClub International, LLC / Def Jam Recordings, a division of UMG Recordings, Inc.",False
fGqdIPer-ms,2018-04-07 00:00:00,Migos - Walk It Talk It ft. Drake,MigosVEVO,10,2018-03-18 21:49:53,"Migos|""Walk It""|""Talk It""|""Walk Talk""|""Walk It Talk It""|""Drake""|""Quavo""|""Offset""|""Takeoff""|""Culture""|""Culture II""|""Culture 2""|""Don Cornelius""|""Jamie Foxx""|""Soul Train""",60415682,1118601,49587,66602,https://i.ytimg.com/vi/fGqdIPer-ms/default.jpg,False,False,False,"Listen to Culture II everywhere now: https://Migos.lnk.to/Culture2YD\n\nPurchase exclusive Migos merch featured from their official store: https://Migos.lnk.to/StoreYD\n\nFollow Migos:\nhttps://facebook.com/THEMigosAtl\nhttps://twitter.com/migos\nhttps://instagram.com/migos\n\nCheck out GIFS from this video at: https://giphy.com/Migos\n\nDirector: Daps & Quavo\nProducer: Sara Lacombe\nExecutive Producers: Daps & Sara Lacombe\nSecond Unit Director: Joseph Desrosiers\nDirector of Photography: Corey Jennings\nStylist: Zoe Costello\nBackground Stylist: Rasheeda Ameera\nVideo Commissioner: Sara Lacombe & Kevin Kloecker\n\nMusic video by Migos performing Walk It Talk It. (C) 2018 Quality Control Music, LLC and UMG Recordings, Inc.\n\nhttp://vevo.ly/RJgyLa",False
yOOiVK31h7g,2018-04-07 00:00:00,Camila Cabello Performs 'Never Be the Same',TheEllenShow,24,2018-03-21 14:06:00,"Camila Cabello|""Camila""|""Cabello""|""music""|""muscian""|""music artist""|""singer""|""song""|""performance""|""never be the same""|""havana""|""fifth harmony""|""solo""|""camila cabello never be the same""|""camila cabello fifth harmony""|""ellen degeneres""|""ellen""|""degeneres""|""the ellen degeneres show""|""the ellen show""|""season 15""|""season 15 episode 121""|""plm""|""camila cabello nick jonas""|""ellen show""|""ellen fan""|""fans""|""ellen tv show""|""ellentube""|""ellen clips""|""ellen videos""|""ellen show clips""|""ellen show performance""|""never""|""same""|""hiatus""",1763271,76063,1879,5904,https://i.ytimg.com/vi/yOOiVK31h7g/default.jpg,False,False,False,"Pop star Camila Cabello performed her hit song, Never Be the Same.",False
7WbdxpZ6Khc,2018-04-07 00:00:00,Cardi B Acceptance Speech - Best New Artist | 2018 iHeartRadio Music Awards,iHeartRadio,10,2018-03-12 04:54:50,"cardi b award show|""cardi b iheartradio awards""|""cardi b wins award""|""cardi b award acceptance speech""|""cardi b award speech bet""|""cardi b awards""|""cardi b award show speech""|""cardi b wins award speech""|""cardi b wins grammy award""",411908,10808,338,522,https://i.ytimg.com/vi/7WbdxpZ6Khc/default.jpg,False,False,False,Subscribe ► http://bit.ly/1Jy0DbO\n\nWatch Cardi B's reaction and speech during the 2018 iHeartRadio Music Awards when she wins Best New Artist!\n\n------------------------\n\nListen Free to More Artists  on Your Phone!\n♥ Download Our App for Free in Google Play: http://bit.ly/1HTBLLg\n♥ Download Our App for Free on iTunes: http://apple.co/1EJpwuA\n\nStay on the Pulse of Music & Entertainment!\n♥ Facebook: http://on.fb.me/1F1TcFX\n♥ Instagram: http://bit.ly/1e1AOUS\n♥ Twitter: http://bit.ly/1HZk5KQ\n♥ Blog: http://bit.ly/1GiT59D,False
FhwktRDG_aQ,2018-04-07 00:00:00,WON'T YOU BE MY NEIGHBOR? - Official Trailer [HD] - In Select Theaters June 8,Focus Features,24,2018-03-20 12:28:59,"Focus Features|""Movie Trailers""|""Trailers""|""Independent Film""|""Cinema""|""Clips""|""Featurettes""|""mister rogers""|""new trailers""|""official trailer""|""mr rogers trailer""|""mister rogers trailer""|""mister rogers documentary""|""mr rogers documentary""|""morgan neville""|""documentary trailer""|""sundance trailer""|""mr rogers movie trailer""|""mister rogers movie trailer""|""tom hanks mr rogers""|""tom hanks mr rogers trailer""|""rogers movie""|""wont you be my neighbor trailer""|""wont you be my neighbor""",3187867,92224,2320,7971,https://i.ytimg.com/vi/FhwktRDG_aQ/default.jpg,False,False,False,"Watch the official trailer for Morgan Neville's new movie, Won't You Be My Neighbor? #MrRogersMovie\n\nFrom Academy Award® -winning filmmaker Morgan Neville (20 Feet from Stardom), Won’t You Be My Neighbor? takes an intimate look at America’s favorite neighbor: Mister Fred Rogers. A portrait of a man whom we all think we know, this emotional and moving film takes us beyond the zip-up cardigans and the land of make-believe, and into the heart of a creative genius who inspired generations of children with compassion and limitless imagination.\n\nhttp://mrrogersmovie.com\nhttps://www.facebook.com/mrrogersmovie\nhttps://twitter.com/mrrogersmovie\nhttps://www.instagram.com/mrrogersmovie",False
dx9mF1KJr0s,2018-04-07 00:00:00,Kelly Clarkson - I Don't Think About You [Official Video],Kelly Clarkson,10,2018-03-20 13:00:20,"Kelly Clarkson|""Kelly""|""Clarkson""|""I Don't Think About you""|""IDTAY""|""Meaning of life""|""MOL""|""Kelly Clarkson new music""|""Kelly Clarkson new single""|""Official video""|""I Don't Think About You official video""|""Love So Soft""|""The Voice""|""Voice NBC""|""The Voice coach""|""Minute and a glass of wine""",2856317,84581,1380,4248,https://i.ytimg.com/vi/dx9mF1KJr0s/default.jpg,False,False,False,I Don't Think About You available now: https://Atlantic.lnk.to/IDontThinkAboutYouID\n\nMEANING OF LIFE available now: https://Atlantic.lnk.to/MeaningoflifeID\n\nShop “I Don’t Think About You” Merch: http://smarturl.it/IDTAYMerch\n\nFollow Kelly Clarkson: \nhttps://kellyclarkson.com/\nhttps://www.facebook.com/kellyclarkson\nhttps://twitter.com/kelly_clarkson\nhttps://www.instagram.com/kellyclarkson/,False
lTyDsnDq66A,2018-04-07 00:00:00,Iggy Azalea: Savior,The Late Late Show with James Corden,24,2018-03-21 08:35:00,"The Late Late Show|""Late Late Show""|""James Corden""|""Corden""|""late night""|""late night show""|""comedy""|""comedian""|""celebrity""|""celeb""|""celebrities""|""CBS""|""joke""|""jokes""|""funny""|""funny videos""|""funny video""|""humor""|""hollywood""|""famous""|""Iggy Azalea""|""Music Performance""|""Music""|""Nonrecurring""|""Evergreen""",635192,25888,1629,1738,https://i.ytimg.com/vi/lTyDsnDq66A/default.jpg,False,False,False,"Late Late Show music guest Iggy Azalea returns to Stage 56, performing Savior off her upcoming album, Surviving the Summer.\n\nMore Late Late Show:\nSubscribe: http://bit.ly/CordenYouTube\nWatch Full Episodes: http://bit.ly/1ENyPw4\nFacebook: http://on.fb.me/19PIHLC\nTwitter: http://bit.ly/1Iv0q6k\nInstagram: http://bit.ly/latelategram\n\nWatch The Late Late Show with James Corden weeknights at 12:35 AM ET/11:35 PM CT. Only on CBS.\n\nGet new episodes of shows you love across devices the next day, stream live TV, and watch full seasons of CBS fan favorites anytime, anywhere with CBS All Access. Try it free! http://bit.ly/1OQA29B\n\n---\nEach week night, THE LATE LATE SHOW with JAMES CORDEN throws the ultimate late night after party with a mix of celebrity guests, edgy musical acts, games and sketches. Corden differentiates his show by offering viewers a peek behind-the-scenes into the green room, bringing all of his guests out at once and lending his musical and acting talents to various sketches. Additionally, bandleader Reggie Watts and the house band provide original, improvised music throughout the show. Since Corden took the reigns as host in March 2015, he has quickly become known for generating buzzworthy viral videos, such as Carpool Karaoke.",True
2aQykuIaJVI,2018-04-07 00:00:00,Lin-Manuel Miranda & Ben Platt Found Tonight [Official Video],Atlantic Records,10,2018-03-19 13:00:46,"music|""official""|""music video""|""dear evan hansen""|""hamilton""|""hamildrops""|""ben platt""|""lin-manuel miranda""|""found tonight""|""found""|""tonight""|""broadway""|""hamilton music""|""dear evan hansen music""|""pitch perfect""|""broadway songs""|""broadway music""|""parkland""|""charity""|""pasek and paul""",3876489,186528,3233,13155,https://i.ytimg.com/vi/2aQykuIaJVI/default.jpg,False,False,False,"A portion of the proceeds from this record will be going to the March For Our Lives Initiative. Donate now at https://marchforourlives.com/.\nDownload/Stream: https://Atlantic.lnk.to/FoundTonightID\n\nLin-Manuel Miranda & Ben Platt \nFound/Tonight\nWords and Music by Lin-Manuel Miranda, Benj Pasek and Justin Paul\nPublished by 5000 Broadway Music (ASCAP) administered by WB Music Corp. / Pick in a Pinch Music (ASCAP) and breathelike music (ASCAP) All rights admin. by Kobalt Songs Music Publishing\n\nProduced, Arranged, and Orchestrated by Alex Lacamoire\nAssociate Producer: Thomas Kail\nRecorded and Mixed by Derik Lee at Atlantic Studios, NYC\nAssistant Engineers: Ebonie Smith, Joseph Pomarico\nMastered by Randy Merrill at Sterling Sound, NYC\nPiano:   Alex Lacamoire\nViolin:   Justin Smith\nViola:     Todd Low\nCello:     Adele Stein\n\nVideo Credits:\nDP: Steven Salgado\nEdited by: Katia Spivakova\nSecond Cam: Angie Bambii\nProduced by: Derec Dunn\n\nFollow Lin-Manuel: \nhttps://twitter.com/Lin_Manuel\nhttps://www.facebook.com/Lin-Manuel-Miranda-156195014444203/\n\nFollow Ben Platt:\nhttps://twitter.com/BenSPLATT\nhttps://www.facebook.com/BenPlattOfficial\nhttps://instagram.com/BenSPLATT",False
IMQCrDQWcvQ,2018-04-07 00:00:00,NINJA PISSED AT JAKE PAUL FOR USING HIM AS CLICKBAIT LIVE!!! (FORNITE BATTLE ROYALE),Azayn,20,2018-03-18 18:47:36,"fortnite|""fortnite moments""|""fortnite wtf moments""|""fortnite battle royale""|""fortnite funny moments""|""fortnite funny fails""|""fortnite loot""|""fortnite twitch moments""|""fortnite ninja and jake paul""|""fortnite jake paul""|""fortnite ninja""|""fortnite ninja reacts""|""fortnite jake paul clickbait""|""fortnite ninja reacts to jake paul""|""fortnite savage moments""|""fortnite ninja talks about jake paul""|""fortnite ninja 2018""|""Jake Paul""|""Ninja""",2130958,23350,7486,0,https://i.ytimg.com/vi/IMQCrDQWcvQ/default.jpg,True,False,False,"Ninja Reacts to Jake Paul using him in his title as click bait and roasts the crap out of him. Fortnite Competitive Gameplay! Fortnite Clutch! Fortnite Battle Royale Highlights and Reactions\n\n\n!!!!! 1000x VBUCKS GIVEAWAY!!!!!!!\nRules To Enter: \n1. Subscribe to the Channel and Press the Bell Icon ( Most Important One)\n2. Like The Video\n3. Follow My Twitter (https://twitter.com/Azayn7)\n\nWinner Chosen At The End Of March\n\nComment, Like, Subscribe and Share !!!!!!!\n\nCheck Out\nNinja:\nhttps://www.twitch.tv/ninja\nhttps://www.youtube.com/user/NinjasHyper\nhttps://twitter.com/Ninja\nhttps://www.instagram.com/Ninja/\n\n\nIntro Song: https://www.youtube.com/watch?v=r7Ve8ExE8YY\n\nDonation for better equipment: https://streamlabs.com/azayn\n\nSub for more content: http://bit.ly/SubToAzayn\n\nCopyright Disclaimer, Under Section 107 of the Copyright Act 1976, allowance is made for 'fair use' for purposes such as criticism, comment, news reporting, teaching, scholarship, and research. Fair use is a use permitted by copyright statute that might otherwise be infringing. Non-profit, educational or personal use tips the balance in favor of fair use",False
4hrrK3rXrR0,2018-04-07 00:00:00,Iman Shumpert On Falling In Love w/ Teyana Taylor | Teyana & Iman | Premieres March 26th 9/8c,VH1,24,2018-03-20 15:00:02,"VH1|""celebrity""|""pop culture""|""VH+1""|""reality tv""|""reality show""|""gossip""|""celebrity news""|""fashion""|""movies""|""television""|""artists""|""classic""|""music""|""Teyana & Iman""|""teyana""|""iman""|""Teyana Taylor""|""Iman Shumpert""|""Cleveland Cavaliers""|""basketball player""|""black""|""black love""|""young love""|""new series""|""My Super Sweet 16""|""kanye west""|""musician""|""model""|""actress""|""Junie""|""Iman Tayla Shumpert Jr.""|""marriage""|""in love""|""authentic""|""Fade""|""G.O.O.D. Music""|""NBA""|""Pharrell Williams""|""Fade 2 Fit""|""Flash Dance""|""Freak On""|""Cruel Summer""",426056,11875,145,659,https://i.ytimg.com/vi/4hrrK3rXrR0/default.jpg,False,False,False,"Iman Shumpert tells the story of how he met and fell for Teyana Taylor, and how they eventually made baby Junie.\n\n#TeyanaAndIman #VH1\n\nSubscribe to VH1:  http://on.vh1.com/subscribe\n\nTeyana & Iman is an intimate look into newlyweds Teyana Taylor and Iman Shumpert. Redefining the contemporary notion of the modern love story, this power couple shares an unconventional romance defined by an unbreakable bond. As they take on the music, sports, and fashion worlds, the success in their careers is only rivaled by their passion for one another and their daughter Junie. Teyana & Iman features plenty of red-hot moments, playful humor, and a 360-degree view of true #RelationshipGoals.\n\nShows + Pop Culture + Music + Celebrity. VH1: We complete you.\n\nConnect with VH1 Online\nVH1 Official Site: http://vh1.com\nFollow @VH1 on Twitter: http://twitter.com/VH1\nFind VH1 on Facebook: http://facebook.com/VH1\nFind VH1 on Tumblr : http://vh1.tumblr.com\nFollow VH1 on Instagram : http://instagram.com/vh1\nFind VH1 on Google + : http://plus.google.com/+vh1\nFollow VH1 on Pinterest : http://pinterest.com/vh1\n\nIman Shumpert On Falling In Love w/ Teyana Taylor | Teyana & Iman | Premieres March 26th 9/8c http://www.youtube.com/user/VH1",True
fHc-O9MBGnw,2018-04-07 00:00:00,Annihilation (2018) - Bear Scene | HD,The Movie Guy,24,2018-03-12 20:05:34,"annihilation|""bear scene""|""screaming bear""|""humanoid""|""alien""|""lena""|""kane""|""alex garland""|""science fiction""|""horror""|""film""|""movie""|""movieclip""|""music""|""sound""|""visuals""|""natalie portman""|""oscar isaac""",728146,5040,230,1731,https://i.ytimg.com/vi/fHc-O9MBGnw/default.jpg,False,False,False,"Annihilation is a 2018 science fiction horror film written and directed by Alex Garland, based on the novel of the same name by Jeff VanderMeer. The film stars Natalie Portman, Jennifer Jason Leigh, Gina Rodriguez, Tessa Thompson, Tuva Novotny, and Oscar Isaac, and follows a group of military scientists who enter The Shimmer, a mysterious quarantined zone that is full of mutating landscapes and creatures.",False
YGXiVHTy0JE,2018-04-07 00:00:00,[M/V] 부석순(SEVENTEEN) - 거침없이(Just do it),SEVENTEEN,10,2018-03-21 09:00:02,"세븐틴|""SEVENTEEN""|""BSS""|""부석순""|""승관""|""도겸""|""호시""|""거침없이""|""JUST DO IT""",1624114,184465,1131,12415,https://i.ytimg.com/vi/YGXiVHTy0JE/default.jpg,False,False,False,"‘거침없이’는 세븐틴의 뮤직 프로듀서인 우지가 직접 곡 작업에 참여했고, 작사에는 부석순의 멤버 전원이 함께 참여했다. 중독성 강한 기타 리프가 인상적인 곡으로 직설적이면서도 재치 있게 풀어낸 가사는 물론 신나는 리듬으로 ‘부석순’의 긍정적인 에너지를 그대로 전달한다.\n\n\nBSS(SEVENTEEN) 'Just do it' on iTunes : https://itunes.apple.com/album/%EA%B1%B0%EC%B9%A8%EC%97%86%EC%9D%B4-just-do-it-single/1361943500?l=ko&ls=1&app=itunes\n\n\nSEVENTEEN Official Homepage: http://www.seventeen-17.com\nSEVENTEEN Official Facebook: https://www.facebook.com/seventeennews\nSEVENTEEN Official Twitter: https://twitter.com/pledis_17\nSEVENTEEN Official Instagram: http://www.instagram.com/saythename_17\nSEVENTEEN Official Fancafe: http://cafe.daum.net/pledis-17\n\n\nⓒ Pledis Entertainment. All Rights Reserved",False
CMzzImAolMc,2018-04-07 00:00:00,I SPENT £308 IN PRIMARK| I CAN'T EVEN...JUST WATCH BECAUSE ITS BEEN SO LONG!,Patricia Bright,26,2018-03-17 22:11:24,"online fashion|""best online fashion shops""|""Fenty""|""online store review""|""summer fashion""",1321546,63169,1482,5647,https://i.ytimg.com/vi/CMzzImAolMc/default.jpg,False,False,False,"Hey beauties! So I finally went to Primark for the first time in ages...here's what went down! xx\n\nLink to my first Merch drop!- https://represent.com/store/patricia\nOversized Jacket: https://rstyle.me/n/cx7zga2nbw\n\nFollow me on instagram - https://www.instagram.com/thepatriciabright/\nTwitter: https://twitter.com/PattyOLovesU\n\nFor business and sponsorship opportunities please contact patstrueworld@gmail.com\n\n* Some links are affiliate, meaning that if you care to purchase any of the products with the link in the description box, I make a small commission, it does not change the price in any way, however it enables me making more content without having to do as many sponsored videos. I am not paid or asked  to use these links.",False
Ns7h153aFb0,2018-04-07 00:00:00,ASOS Try-On Haul FAIL + My New BAG! | Fleur De Force,Fleur DeForce,26,2018-03-18 17:00:03,"fleurdeforce|""fleur de force""|""fleurdevlog""|""fleur de vlog""|""asos try on""|""asos try on haul""|""asos fail""|""asos""|""try on haul""|""clothing haul""|""fashion""|""high street fashion""|""new bag""|""chloe""|""bag unboxing""|""what's in my bag""",206165,6616,233,518,https://i.ytimg.com/vi/Ns7h153aFb0/default.jpg,False,False,False,"Did my first ASOS haul in FOREVER, which turned out to be (mostly) a disaster! Plus a couple of other recent purchases... EXPAND this little box for more info, links etc xo\n\nPRODUCTS FEATURED: \nReligion Cable Knit Jumper: http://bit.ly/2FFug13 \nEsprit Stripe And Frill Jumper: http://bit.ly/2FI9N7t \nReligion Sheer High Neck Shirt With Hardware Trim: http://bit.ly/2HEVDor\nPimkie Tie Neck Ruffle Sleeve Blouse: http://bit.ly/2HyI35R\nASOS Tulle Midi Dress with Ruching: http://bit.ly/2pg5pXn \nASOS Sheer Smock Mini Dress in Spot Mesh: http://bit.ly/2HBmfqa \nRiver Island Drop Hem Eyelet Detail Mini Dress: http://bit.ly/2pdXSYY\nStradivarius Stripe Satin Wrap Midi Dress: http://bit.ly/2FEyKF1 \nLeather Jacket: \nChloe Faye Day Bag: http://bit.ly/2FOuRZW \n\nALSO Find Me Here…\nVLOG Channel: http://www.youtube.com/fleurdevlog \nTwitter: @fleurdeforce\nBlog: http://www.fleurdeforce.com\nInstagram: @FleurDeForce\nFacebook: https://www.facebook.com/fleurdeforce\n\nSHOP:\nMy Books: http://amzn.to/2IicUEV \nMy Lash & Brow Range: http://shopstyle.it/l/Bfyy \nMy Wardrobe: http://bit.ly/2p0oCw3 \n\nOTHER VIDEOS YOU MIGHT LIKE\nNew In Feb: https://www.youtube.com/watch?v=Bo3JVsGweCI\nWhat’s In My Changing Bag: https://www.youtube.com/watch?v=wpBnp1cBpWg \nWardrobe Clearout: HANDBGAS!: https://www.youtube.com/watch?v=EzUgDRjQA2c&t=391s \n\nThis video is not sponsored but some links are affiliate links.",False
fzCct3j-pH8,2018-04-07 00:00:00,"N.E.R.D, Rihanna - Lemon (Drake Remix - Audio) ft. Drake",NERDVEVO,10,2018-03-18 00:01:01,"Hip Hop|""Lemon""|""N.E.R.D & Rihanna feat. Drake""|""i am OTHER/Columbia""",2544110,47393,2858,2563,https://i.ytimg.com/vi/fzCct3j-pH8/default.jpg,False,False,False,Get the Lemon (Drake Remix): http://smarturl.it/LemonRemix?IQid=youtube\n \nGet the new album NO_ONE EVER REALLY DIES now: http://smarturl.it/nerd?IQid=youtube\n\nJoin: http://nooneeverreallydies.com/signup\n\nFollow N.E.R.D:\nhttp://nooneeverreallydies.com\nhttp://facebook.com/nerd\nhttp://twitter.com/nerdarmy\nhttp://instagram.com/nerd \nhttp://smarturl.it/nerdapple\nhttp://smarturl.it/nerdspotify,False
QwievZ1Tx-8,2018-04-07 00:00:00,Marvel Studios' Avengers: Infinity War - Official Trailer,Marvel Entertainment,24,2018-03-16 13:02:41,"marvel|""comics""|""comic books""|""nerd""|""geek""|""superhero""|""super hero""|""infinity war""|""avengers""|""captain america""|""black panther""|""iron man""|""hulk""|""black window""|""wakanda""|""winter soldier""",56293347,1592657,33719,199294,https://i.ytimg.com/vi/QwievZ1Tx-8/default.jpg,False,False,False,"In theaters April 27. Get your tickets now: http://www.fandango.com/infinitywar\n\nFind out more on Marvel.com - http://bit.ly/2Iv6ouB\n\nFollow Marvel on Twitter: ‪https://twitter.com/marvel\nLike Marvel on Facebook: ‪https://www.facebook.com/Marvel\n\nFor even more news, stay tuned to:\nTumblr: ‪http://marvelentertainment.tumblr.com/\nInstagram: https://www.instagram.com/marvel\nGoogle+: ‪https://plus.google.com/+marvel\nPinterest: ‪http://pinterest.com/marvelofficial",False
pmMjkMtpnTc,2018-04-07 00:00:00,Wanna One (워너원) - 'BOOMERANG (부메랑)' M/V,CJENMMUSIC Official,10,2018-03-19 09:00:02,"CJ E&M|""CJENM""|""CJENMMUSIC""|""K-CULTURE""|""korean Music""|""MV""|""Music Video""|""K-Pop""|""Kpop""|""뮤비""|""뮤직비디오""|""Wanna One""|""워너원""|""BOOMERANG""|""부메랑""|""강다니엘""|""박지훈""|""이대휘""|""김재환""|""옹성우""|""박우진""|""라이관린""|""윤지성""|""황민현""|""배진영""|""하성운""|""프로듀스101""|""프듀101""",15007407,643285,23624,81734,https://i.ytimg.com/vi/pmMjkMtpnTc/default.jpg,False,False,False,"화려한 골든 에이지의 시작!\nWanna One 2nd Mini Album 0+1=1 (I PROMISE YOU)\n\n'BOOMERANG(부메랑)'은 자신감 강한 남자의 거부할 수 없는 짝사랑이\n사랑하는 그녀와 만나 다시 그에게 돌아오길 바라는 마음과\n영원히 그녀만을 바라보겠다는 약속을 담은 곡이다.\n\nMore About Wanna One @ \nOfficial Facebook: https://www.facebook.com/WannaOne.official \nOfficial Twitter: https://twitter.com/WannaOne_twt \nOfficial Instagram: https://www.instagram.com/wannaone.official \nOfficial Post: http://post.naver.com/wannaone_official \nOfficial fan cafe: http://cafe.daum.net/WannaOneOfficial\n\n♬ Available on iTunes, Apple Music : https://apple.co/2FWt5Gz\n     Listen on Spotify : https://spoti.fi/2GzRh4W\n\n\nCJ E&M Music은 아시아 No.1 엔터테인먼트 기업인 CJ E&M의 음악사업 브랜드로 음원/음반의 투자/제작/유통부터 콘서트/페스티벌 개최까지 포함하고 있습니다. CJ E&M MUSIC과 함께 하는 K-POP 아티스트들의 신곡과 뮤직비디오, 미공개 독점 영상 등을 이곳 YOUTUBE 채널에서 가장 먼저 만나보세요.\n\nCJ E&M Music is a music business brand of CJ E&M, Asia's No.1 entertainment company. CJ E&M Music covers investment, production and distribution of album and also provides the best music festival and concerts. Meet the K-POP artists' brand new music videos and exclusive video clips on the official YouTube of CJ E&M Music.",False
juYDGDEIGVk,2018-04-07 00:00:00,Star Wars: Episode VIII - The Last Jedi [Deleted Scenes],TopTens,1,2018-03-17 16:46:38,"Star Wars|""Star Wars The Last Jedi""|""Star Wars Episode VIII""|""Star Wars Episode 8""|""Rey""|""Star Wars Deleted scenes""|""popular""|""viral videos""|""Star wars BluRay""|""Star Wars Blu Ray""|""Star wars trailer""|""Star Wars Collector's edition""",373520,3159,681,1649,https://i.ytimg.com/vi/juYDGDEIGVk/default.jpg,False,False,False,Star Wars: Episode VIII - The Last Jedi Deleted Scenes,False
H95362B0YOg,2018-04-07 00:00:00,Wale - Staying Power (Official Music Video),Wale,10,2018-03-19 17:18:44,"Wale|""Hip Hop""|""DC""|""DMV""|""rapper""|""Ben's Chili Bowl""|""National Airport""|""BET""|""Shine tour""|""Shine""|""Staying Power""|""It's Complicated""|""EP""|""Lupe Fiasco""|""Fat Trel""|""Shy Glizzy""|""East Coast""|""Lyricist""|""Royce da 59""|""Nigerian""|""Maybach Music""|""Atlantic Records""|""Every Blue Moon""|""Black Bonnie""|""Let It Go""|""Effortless""|""All Star Break Up""|""My Love""|""Fine Girl""|""Lil Wayne""|""Drake""|""AYYDOT""|""1st Impressions""|""EBM""|""MMG""|""DJ Akademiks""|""Ebro""|""Breakfast Club""",665833,18966,304,1760,https://i.ytimg.com/vi/H95362B0YOg/default.jpg,False,False,False,Music video by Wale performing Staying Power (Explicit)\n\n© 2018 Every Blue Moon / MMG\n\nListen to Wale Staying Power on Apple Music here: https://t.co/piOavT7ImZ\n\nVideo Producer: VIEWALL\nSong Producer: AYYDOT,False
