id,trending_date,Label,channel_title,category_id,publish_time,tags,views,likes,dislikes,comment_count,thumbnail_link,comments_disabled,ratings_disabled,video_error_or_removed,description,popular_tag
ByucbuSe958,2017-12-22 00:00:00,SZA x Calvin Harris - The Weekend (Funk Wav Remix (Audio)),SZAVEVO,10,2017-12-15 08:00:02,"R&B|""SZA x Calvin Harris""|""The Weekend""|""Top Dawg Entertainment/RCA Records""",636653,18400,519,720,https://i.ytimg.com/vi/ByucbuSe958/default.jpg,False,False,False,SZA x Calvin Harris The Weekend (Funk Wav Remix) available now: http://smarturl.it/WeekendRemix\n\nSZA's CTRL available on:\nApple Music - http://smarturl.it/iCTRL\nSpotify - http://smarturl.it/sCTRL\nSoundcloud - http://smarturl.it/scCTRL\nTidal - http://smarturl.it/tCTRL\nAmazon Music - http://smarturl.it/aCTRL\nGoogle Play - http://smarturl.it/gCTRL\n\nFollow SZA:\nhttp://szactrl.com\nhttp://instagram.com/sza\nhttp://twitter.com/sza\nhttp://facebook.com/sza\n\nFollow Calvin Harris:\nhttp://calvinharris.com\nhttp://instagram.com/calvinharris\nhttp://twitter.com/calvinharris\nhttp://facebook.com/calvinharris,False
6TOSV3-7hzU,2017-12-22 00:00:00,PLAYERUNKNOWN'S BATTLEGROUNDS - The Game Awards 2017 Gameplay Trailer,PLAYERUNKNOWN'S BATTLEGROUNDS,20,2017-12-08 04:04:56,"PUBG|""Battle Royale""",570451,6747,299,757,https://i.ytimg.com/vi/6TOSV3-7hzU/default.jpg,False,False,False,"Welcome to Miramar, an all-new Battle Royale experience.\n\nAvailable on Steam Early Access: http://store.steampowered.com/app/578080/PLAYERUNKNOWNS_BATTLEGROUNDS/\n\nFor the latest updates, follow us on:\n\nTwitter: https://twitter.com/PUBATTLEGROUNDS\nFacebook: https://www.facebook.com/playBATTLEGROUNDS\nForums: http://forums.playBATTLEGROUNDS.com",False
rEzEGto67Jw,2017-12-22 00:00:00,Trump holds rally in Florida,Washington Post,25,2017-12-09 03:21:21,"breaking news video|""video updates""|""live video""|""live updates""|""breaking news""|""press conference""|""live speeches""|""real time coverage""",83677,925,294,412,https://i.ytimg.com/vi/rEzEGto67Jw/default.jpg,False,False,False,"President Trump holds a rally in Pensacola, Fla. Subscribe to The Washington Post on YouTube: http://bit.ly/2qiJ4dy\n\nFollow us:\n\nTwitter: https://twitter.com/washingtonpost\nInstagram: https://www.instagram.com/washingtonpost/\nFacebook: https://www.facebook.com/washingtonpost/",False
6uBuxJXlWrQ,2017-12-22 00:00:00,Man saves rabbit from California fires - BBC News,BBC News,25,2017-12-07 17:16:01,"bbc|""bbc news""|""news""|""ventura""|""animals""|""rabbit""|""california""|""wildfire""",164979,1932,49,540,https://i.ytimg.com/vi/6uBuxJXlWrQ/default.jpg,False,False,False,"Footage has captured the moment a man stopped his car to rescue a wild rabbit from wildfires in California. The incident took place on 101 freeway in La Conchita. More than 150 homes have been destroyed in the Ventura area, near Los Angeles, and 50,000 people evacuated.\n\nPlease subscribe HERE http://bit.ly/1rbfUog\n\nWorld In Pictures https://www.youtube.com/playlist?list=PLS3XGZxi7cBX37n4R0UGJN-TLiQOm7ZTP\nBig Hitters https://www.youtube.com/playlist?list=PLS3XGZxi7cBUME-LUrFkDwFmiEc3jwMXP\nJust Good News https://www.youtube.com/playlist?list=PLS3XGZxi7cBUsYo_P26cjihXLN-k3w246",False
GFMyMxMYDNk,2017-12-22 00:00:00,How Star Wars was saved in the edit,RocketJump,27,2017-12-07 19:00:01,"rocketjump|""rocket""|""jump""|""rj""|""vfx""|""action""|""vghs""|""freddie""|""freddiew""|""wong""|""star wars""|""a new hope""|""video essay""|""editing""|""marcia lucas""",795148,36423,332,1862,https://i.ytimg.com/vi/GFMyMxMYDNk/default.jpg,False,False,False,A video essay exploring how Star Wars' editors recut and rearranged Star Wars: A New Hope to create the cinematic classic it became.\n\nCheck out more essays at http://youtube.com/rjfilmschool\n\nWritten by David Welch (@watsonwelch)\nNarrated and Edited by Joey Scoma (@joey2meals)\n\nReferences:\nDeleted Magic\nhttps://www.youtube.com/watch?v=f2r4Nffrc6Y&t=1585s\n\nDeleted Scenes\nhttps://www.youtube.com/watch?v=f00IkrWvur4\n\nHarmy's Star Wars: Despecialized Edition\nhttps://www.youtube.com/watch?v=dHfLX_TMduY&t=201s\n\nEmpire of Dreams\nhttps://www.youtube.com/watch?v=Nw_VeZk_q0U\n\nMore awesome videos at RocketJump.com!\n\nRJ Store ➤ http://shop.rocketjump.com\nFollow RocketJump on Twitter ➤ http://bit.ly/RJtweet\nFollow RJFS on Twitter ➤ https://twitter.com/rjfilmschool\nJoin the discussion ➤ https://discuss.rocketjump.com/\n\nFor licensing and usage inquiries please email licensing@rocketjump.com,False
oQx3h5D9pwg,2017-12-22 00:00:00,The Voidz initiate Julian (band name change/album announce),The Voidz,22,2017-12-08 15:16:05,[none],48348,2055,23,404,https://i.ytimg.com/vi/oQx3h5D9pwg/default.jpg,False,False,False,Look for The Voidz new album - coming out in early 2018! \nThe band name has officially changed from 'Julian Casablancas+The Voidz' to just 'The Voidz'\nHere's how it happened... true story.\n\n\nCult Records\nRCA\n\nthevoidz.com,False
ECLwG0sHrAw,2017-12-22 00:00:00,Metro Exodus - Game Awards 2017 Trailer,XCageGame,20,2017-12-08 04:26:06,"Trailer|""Gameplay""|""Game Awards 2017""|""Walkthrough""|""No Commentary""|""Nintendo""|""Switch""|""3DS""|""Microsoft""|""Xbox""|""Playstation""|""Playstation4""|""PS4""|""Lets Play""|""Xcagegame""|""E3""|""Mario""|""Gaming""|""2017""|""2018""",111614,1164,45,136,https://i.ytimg.com/vi/ECLwG0sHrAw/default.jpg,False,False,False,Metro Exodus - Game Awards 2017 Trailer\n\n►Twitter : https://twitter.com/Xcagegame\n►Future Walkthroughs / Gameplays: http://goo.gl/wCvNro\n►Nintendo ID/ PSN / Xbox Live: Cageccc /Switch: SW-1782-6512-8513\n► No Commentary Gameplay Walkthrough by Xcagegame\n►Game Informations :,False
-GvVeT7pNT8,2017-12-23 00:00:00,DAY 11: Gigi Hadid by Phil Poynter #LOVEADVENT2017,LOVE TV by LOVE Magazine,22,2017-12-11 08:30:00,"Gigi Hadid|""Phil Poynter""|""Love Advent""|""LOVEADVENT2017""|""Freestyle""",747200,1990,1170,438,https://i.ytimg.com/vi/-GvVeT7pNT8/default.jpg,False,False,False,"I love seeing everyone else's videos. It's celebratory of epic human beings and always pushes boundaries. The fashion circle is a family, so the Love Advent kind of feels like a Holiday Year Book in a way. Headmaster Grand style.\n\nGigi Hadid on Day 11 gives us her power moves and free-form favourite workouts. With her tomboy sexy look, she is killing it with high kicks, round kicks, punches and volleyball spikes throughout her training session with Rob Piela from Gotham Gym.",False
s0qeYQZ7mEo,2017-12-23 00:00:00,12/11/17: White House Press Briefing,The White House,25,2017-12-11 20:09:02,[none],42538,896,102,969,https://i.ytimg.com/vi/s0qeYQZ7mEo/default.jpg,False,False,False,The White House,False
tnCbI51JpAM,2017-12-23 00:00:00,PlayStation Presents - PSX 2017 Opening Celebration | English,PlayStation,20,2017-12-09 07:55:02,"PlayStation|""god of war""|""death stranding""|""Detroit: become human""|""dreams""|""dreams ps4""|""horizon zero dawn""|""the last guardian""|""playstation experience 2017""|""playstation vr""|""PS4""|""PSVR""|""PSX 2017""|""trailers""|""gameplay""",618370,12841,2643,958,https://i.ytimg.com/vi/tnCbI51JpAM/default.jpg,False,False,False,"Join us as we kick off PSX 2017 with PlayStation Presents, starting at 8 PM Pacific on Friday December 8th. Listen in on candid discussions with some of PlayStation’s top developers, get the latest on some of the biggest games coming in 2018, and be the first to witness some special announcements.",False
rXfnPGGfSh8,2017-12-23 00:00:00,Manic Street Preachers - International Blue (Lyric Video),ManicStPreachersVEVO,10,2017-12-08 08:00:05,"Alternative/Indie|""Columbia""|""International Blue""|""Manic Street Preachers""",85123,1767,67,299,https://i.ytimg.com/vi/rXfnPGGfSh8/default.jpg,False,False,False,"Manic Street Preachers - International Blue (Lyric Video)\n\nPurchase/listen to 'International Blue' here: http://smarturl.it/ManicsIB?IQid=YT\nTaken from the new album, 'Resistance Is Futile,' available to pre-order here: https://store.manicstreetpreachers.com\n\n----------------\n\nFollow Manic Street Preachers\nWebsite: http://www.manicstreetpreachers.com/\nFacebook: https://www.facebook.com/manicstreetpreachers\nTwitter: https://twitter.com/manics\nYouTube: http://smarturl.it/MSPSubscribe?IQid=ManicSPIU\nSpotify: http://smarturl.it/MSPSpotify?IQid=ManicSPIU\nOther streaming services: http://smarturl.it/MSPStream?IQid=ManicSPIU\n\nMore from Manic Street Preachers\nMotorcycle Emptiness: https://youtu.be/gavcjNniIvk\nYour Love Alone Is Not Enough: https://youtu.be/A_OnFHJou4o\nA Design For Life: https://youtu.be/TfEoVxy7VDQ",False
Sqbv7cCM5AI,2017-12-23 00:00:00,björk: utopia,Björk,10,2017-12-08 15:02:33,"utopia|""björk""|""Alternative""|""Indie Pop""|""bjork""|""official video""|""nick and warren""|""Warren Du Preez""|""Nick Thornton Jones""",769315,20998,1434,2209,https://i.ytimg.com/vi/Sqbv7cCM5AI/default.jpg,False,False,False,"the official video for utopia, taken from björk's new studio album.\n\nutopia is out now. listen here: https://bjork.lnk.to/utopiaYT\n\nVideo Credits:\n\nDirected by  Warren Du Preez and Nick Thornton Jones\n\nCreative Direction by Björk\n\nSilicone prosthetics, braid jewellery and flutes by James Merry \n\nExecutive Producer - Campbell Beaton / Immortal Productions \n\nDirector of Photography - Daniel Landin \n\nCGI Design and VFX Supervisor - Matt Chandler @ Analog\n\nChoreography - Margret Bjarnadottir\n\nProduction Designer - Heimir Sverrisson\n\nMake Up Artist - Hungry\n\nHair Stylist - Raphael Salley \n\nStylist - Edda Gudmundsdóttir\n\nFlutists costume - threeasfour \n\nProps & set decoration - Hrafnhildur Hólmgeirsdóttir\n\nWith thanks to Remi Paringaux \n\nEditor - Owen Oppenheimer @ The Quarry \n\nColourist - Jessica Vile @ Framestore \n\nGrade Producer - Chris Anthony @ Framestore\n\nOnline Producer - Matt Shannon @ Analog\n\nLead 2D retouch - Duncan Horn @ nineteentwenty\n\nAssistant 2D retouch - Rob Lilley @ nineteentwenty\n\nLead 2D Artist - Fabio Zaveti @ Analog\n\nCompositors - Igor Gama, Andre Dias, & Alessandro Melillo @ Analog\n\nLead 3D Artist - Matt Chandler @ Analog\n\n3D Artists - Maurizio De Angelis, Tim Woods, & Gustav Larsson @ Analog\n\n3D Animation - Julien Loth @ Analog\n\nTypography by M/M (Paris)\n\nConcept Drawings - Alex Noble\n\nAssistant to James Merry - Mao Alheimsdottir  \n\nFlutists -\n\nBerglind María Tómasdóttir\nBjörg Brjánsdóttir\nMelkorka Ólafsdóttir\nEmilía Rós Sigfúsdóttir\nÁshildur Haraldsdóttir\nÞuríður Jónsdóttir\nSteinunn Vala Pálsdóttir\nDagný Marinósdóttir\nSigríður Hjördís Indriðadóttir\nSólveig Magnúsdóttir\nHafdís Vigfúsdóttir\n\nKimono Co-ordinator - Kenshi Ohkubo\n\nKimono Stylist - Chiaki Ruri\n\nIceland Service Producer - Rafnar Hermannsson @ TruNorth\n\nEdit Producer - Charlie Morris\n\nUK Production Manager - Sam Jackson\n\nIceland Co-ordinator - Gudrun L Magnusdottir\n1st AD - Gagga JonsDottir\n1 AC - Snorri Fairweather\n2 AC - Brynja Dogg Fridriksdottir\nKey Grip - Sigurgeir Thordarsson\nCrane Tech - Viktor David Johannsson\nGaffer - Finnur Thor Gudjonsson\n\nBest Boy - Valdmar Johannsson\n\nElectricians - Maria Run Johannsdottir & Eythor Ingvarsson\n\nDimmer Board Op - Agnar Hermannsson\n\nSet Decorator - Hrafnhildur Holmgeirsdottir\n\nProps - Victor Petur\n\nVTR - Rutur Skaeringur\n\nCatering - Erla Asmundsdottir\n\nKey PA - Tindur Karasson\n\nRunner - Thelma Torfadottir\nLead Hair assistant - Sigurbjorg Iris Holmgeirsdottir\nHair Assistants - Audur Birna Gudnadottir & Kristofer Thorri Haraldsson\n\nLead MU asttstant - Frida Maria Hardardottir\n\nMU assistants - Flors Karitas Bueno & Sigrun Sig\n\n\n\nclick here to subscribe to the official björk channel: http://bit.ly/subscribetobjork\n\nhttp://www.bjork.com/\nhttps://www.facebook.com/bjork\nhttps://twitter.com/bjork",False
NXin9D2Nc10,2017-12-23 00:00:00,Scarlets VS Benetton. Highlights GAME Champions Cup Rugby Union. 09/12/2017,Fahd W Rugby,17,2017-12-09 21:49:00,"Scarlets|""Benetton""|""Champions Cup""",2881,9,0,0,https://i.ytimg.com/vi/NXin9D2Nc10/default.jpg,False,False,False,Scarlets 33 - 28 Benetton Highlights GAME Champions Cup Rugby Union. 09/12/2017,False
dyBFAX4SDEc,2017-12-23 00:00:00,The Legend of Zelda: Breath of the Wild - Expansion Pass: DLC Pack 2 The Champions’ Ballad Trailer,Nintendo,20,2017-12-08 02:31:28,"nintendo|""play""|""play nintendo""|""game""|""gameplay""|""fun""|""video game""|""kids""|""action""|""adventure""|""rpg""|""nintendo switch""|""pro controller""|""joy con""|""awards""|""award show""|""video game awards""|""tga""|""the game awards""|""video game industry""|""game of the year""|""Best Game Direction""|""Best Art Direction""|""The Game Awards 2017""|""breath of the wild""|""the legend of zelda""|""dlc""|""dlc 2""|""the champions ballad""|""motorcycle""|""lozbotw""|""expansion pass""|""revali""|""mipha""|""urbosa""|""daruk""|""shrine""|""equips""|""kass""|""champions' ballad""|""ancient""",1952508,50462,1073,7260,https://i.ytimg.com/vi/dyBFAX4SDEc/default.jpg,False,False,False,"Revali, Mipha, Daruk, and Urbosa fell 100 years ago in an attempt to defend the homes they love. You must rise today. The next installment of The Legend of Zelda: Breath of the Wild Expansion Pass: The Champions' Ballad is here. The exhilarating adventure continues!\n\nLearn more about DLC Pack 2 The Champions’ Ballad! https://goo.gl/AZHQe3\n\n#NintendoSwitch #TheGameAwards2017 #LegendofZelda #BreathoftheWild\n\nSubscribe for more Nintendo fun! https://goo.gl/09xFdP\n\nVisit Nintendo.com for all the latest! http://www.nintendo.com/\n\nLike Nintendo on Facebook: http://www.facebook.com/Nintendo\nFollow us on Twitter: http://twitter.com/NintendoAmerica\nFollow us on Instagram: http://instagram.com/Nintendo\nFollow us on Pinterest: http://pinterest.com/Nintendo\nFollow us on Google+: http://google.com/+Nintendo",False
iWFgvbf_Zu8,2017-12-23 00:00:00,FromSoftware's new project,FROMSOFTWARE,20,2017-12-08 02:00:25,[none],787002,10169,244,2398,https://i.ytimg.com/vi/iWFgvbf_Zu8/default.jpg,False,False,False,Here is a tiny glimpse into our new project.\n\n新作タイトルのティザー映像です。ご期待いただければ幸いです。,False
ceJcHUoO734,2017-12-23 00:00:00,In the Valley of Gods Announcement Trailer,Campo Santo Productions,20,2017-12-08 02:10:51,"campo santo|""firewatch""|""video games""|""egypt""|""videogames""|""gaming""|""adventure game""",362065,7986,2157,0,https://i.ytimg.com/vi/ceJcHUoO734/default.jpg,True,False,False,"http://www.inthevalleyofgods.com\nFrom the creators of Firewatch, In the Valley of Gods is a single-player first-person adventure. Explore a remote and ancient valley in the Egyptian desert, uncovering treasure and treachery in pursuit of a discovery that could bring you fame and fortune—or leave you for dead, buried beneath the sands.",False
r8FQ5wUYm9c,2017-12-23 00:00:00,Don't Talk - Cyanide & Happiness Shorts,ExplosmEntertainment,23,2017-12-07 06:00:01,"shorts|""c&hshorts""|""c&h shorts""|""c and h shorts""|""cyanide and happiness shorts""|""cartoon""|""funny""|""cyanide""|""happiness""|""C&H""|""cy&h""|""cyanide and happiness""|""explosm""|""exlposm""|""cyanide & happiness""|""explosm.net""|""explosm animated""|""explosm comics""|""cartoon movies""|""animated""|""humor""|""comedy""|""explosmentertainment""|""don't talk""|""talk""|""talking""|""movie""|""movie theatre""|""movies""|""watching""|""new movie""|""premiere""|""film""",2608451,89524,1308,5065,https://i.ytimg.com/vi/r8FQ5wUYm9c/default.jpg,False,False,False,"Subscribe to Explosm!  ► http://bit.ly/13xgq7a\n\nDon't go in there!!!\n\nCyanide and Happiness delivers daily comics to your face-hole on www.explosm.net since 2005!\n\nCredits:\nCreated By: Rob DenBleyker, Kris Wilson, Dave McElfatrick\nDirected By: Mike Salcedo\nScreenplay By: Mike Salcedo\nStory By: Mike Salcedo Rob DenBleyker\nVoice Actors:\nRob DenBleyker - Guy\nDenise Magdale - Giant Girl\nAnimation Director: Bill Jones\nAnimation: Kris Behr, Matt Thurman\nCharacter Design: Stacey Silva\nBackground Art: Denise Magdale, Shawn Coss, Connor Murphy\nAnimatic: Geoff Galt\nEditor: Taylor Ransom\nTechnical Director: Jon Murphy\nSound FX: Ben Governale\nAssistant Sound Design: Samm Barrett\nMusic: Steve Lehmann\nSupervising Producer: Derek Miller\nProduced By: Adam Nusrallah\nProduction Manager: Explosm - Autumn Netherton\nProduction Assistant: Lorraine Bett",False
TIVvCUWMMAY,2017-12-23 00:00:00,Monster Hunter World: No Russian,The Shadowscale,20,2017-12-10 03:08:36,"Monster Hunter|""Monster Hunter: World""|""Beta""|""PS4""|""Great Jagras""|""Jagras""|""Bowgun""|""Heavy bowgun""",74616,2616,43,225,https://i.ytimg.com/vi/TIVvCUWMMAY/default.jpg,False,False,False,Do you think this may have been a little overkill?\nTitle reference: https://youtu.be/gXBDkevx5lM?t=1m26s\nFeatured on Kotaku's Highlight Reel: https://youtu.be/Fzfla8Byn-w,False
mkpINSUnDpA,2017-12-23 00:00:00,Ramsay Shuts Down Restaurant After Finding RAW Chicken Next to Cooked Chicken! | Kitchen Nightmares,Kitchen Nightmares,24,2017-12-06 18:00:07,"gordon Ramsay it’s raw|""gordon Ramsay best insults""|""kitchen nightmares full episode""|""kitchen nightmares watch online""|""gordon ramsay likes the food""|""gordon ramsay donkey""|""gordon Ramsay idiot sandwich""|""gordon Ramsay steak""|""gordon Ramsay caviar""|""Gordon Ramsey""|""gordon""|""Ramsay""|""Ramsey""|""chef Ramsay""|""raw""|""it’s raw""|""its raw""|""chicken""|""shrimp""|""raw chicken""|""Nino""|""kitchen nightmares""|""kitchen nightmares us""",3153709,35135,918,5140,https://i.ytimg.com/vi/mkpINSUnDpA/default.jpg,False,False,False,"It's not bread pudding, it's rotting shrimp.\nIf you liked this clip check out the rest of Gordon's channels:\n\nhttp://www.youtube.com/gordonramsay\nhttp://www.youtube.com/thefword\nhttp://www.youtube.com/kitchennightmares\n\nMore Gordon Ramsay:\nWebsite: http://www.gordonramsay.com\nFacebook: http://www.facebook.com/GordonRamsay01\nTwitter: http://www.twitter.com/GordonRamsay",False
m1sdAmSq4vs,2017-12-23 00:00:00,"SOULCALIBUR VI Announcement Trailer | PS4, XB1, PC",Bandai Namco Entertainment America,20,2017-12-08 02:48:54,"soulcalibur|""trailer""|""ps4""|""xb1""|""pc""|""soulcalibur 6""|""soulcalibur VI""|""fighting game""|""fgc""|""gameplay""|""new""|""mitsurugi""|""sophitia""|""sc6""|""competitive games""|""unreal 4""|""videogames""|""playstation""|""xbox""|""steam""|""announcement""|""soul caliber""|""vgas""|""video game awards""",787814,14386,284,4676,https://i.ytimg.com/vi/m1sdAmSq4vs/default.jpg,False,False,False,"Welcome back to The Stage of History! SOULCALIBUR VI is coming to PS4, XB1, and Steam in 2018. Check out the announcement trailer and get ready for the triumphant return of 3D weapons-based fighting.\n\nFollow SOULCALIBUR VI on our Social Channels: \nFacebook: https://www.facebook.com/SoulCalibur/\nTwitter: https://twitter.com/soulcalibur",False
rRzxEiBLQCA,2017-12-24 00:00:00,TWICE Heart Shaker M/V,jypentertainment,10,2017-12-11 08:59:59,"TWICE Heart Shaker|""TWICE 하트셰이커""|""트와이스 Heart Shaker""|""트와이스 하트셰이커""|""Heart Shaker""|""하트셰이커""|""TWICE""|""트와이스""|""Heart Shaker M/V""|""Heart Shaker MV""|""Heart Shaker Music Video""|""Heart Shaker 뮤직비디오""|""Heart Shaker 뮤비""|""하트셰이커 M/V""|""하트셰이커 MV""|""하트셰이커 뮤직비디오""|""하트셰이커 뮤비""|""하트셰이커 Music Video""|""TWICE M/V""|""TWICE MV""|""TWICE Music Video""|""TWICE 뮤직비디오""|""TWICE 뮤비""|""트와이스 M/V""|""트와이스 MV""|""트와이스 Music Video""|""트와이스 뮤직비디오""|""트와이스 뮤비""|""TWICE Merry Happy""|""트와이스 Merry Happy""|""트와이스 메리 해피""|""Merry Happy""|""Merry & Happy""|""메리해피""",55754734,1052809,103994,169779,https://i.ytimg.com/vi/rRzxEiBLQCA/default.jpg,False,False,False,TWICE(트와이스) Heart Shaker M/V\n\nThe 1st Album : Repackage Merry & Happy\niTunes & Apple Music\nhttps://itunes.apple.com/album/merry-happy/1323890122\n\nTWICE Official YouTube: http://www.youtube.com/c/TWICEonAir\nTWICE Official Facebook: http://www.facebook.com/JYPETWICE\nTWICE Official Twitter: http://www.twitter.com/JYPETWICE\nTWICE Official Instagram: http://www.instagram.com/TWICETAGRAM\nTWICE Official Homepage: http://TWICE.jype.com\nTWICE Official Fan's: http://fans.jype.com/TWICE\n\nⓒ 2017 JYP Entertainment. All Rights Reserved,False
hsh54g9JmC0,2017-12-24 00:00:00,TAEYEON 태연 'This Christmas' MV,SMTOWN,10,2017-12-12 09:00:04,"태연|""TAEYEON""|""This Christmas - Winter is Coming""|""This Christmas""|""Winter album""|""소녀시대""|""Girls' Generation""",4811392,245227,5389,12725,https://i.ytimg.com/vi/hsh54g9JmC0/default.jpg,False,False,False,"TAEYEON's winter album This Christmas – Winter is Coming has been released.\nListen and download on iTunes & Apple Music, Spotify, and Google Play Music http://smarturl.it/TAEYEONthischristmas\n#TAEYEON #태연 #Winter_album #ThisChristmas_WinterisComing #TitleTrack #ThisChristmas #171212 #6PM\n\n[Tracklist]\n01 The Magic of Christmas Time\n02 This Christmas\n03 Let It Snow \n04 Candy Cane\n05 Christmas without You\n06 쉿 (Shhhh)\n07 겨울나무 (I’m all ears)\n08 This Christmas (Inst.) \n\nTAEYEON Official\nhttp://taeyeon.smtown.com\nhttp://www.youtube.com/GIRLSGENERATION\nhttp://www.facebook.com/girlsgeneration\nhttp://twitter.com/girlsgeneration\n\nTAEYEON 태연 'This Christmas' MV ℗ S.M.Entertainment",False
