id,trending_date,Label,channel_title,category_id,publish_time,tags,views,likes,dislikes,comment_count,thumbnail_link,comments_disabled,ratings_disabled,video_error_or_removed,description,popular_tag
ZANqw73F9Pw,2018-04-03 00:00:00,Harper Grace Sings Original Tune R.I.P. for Her Solo Performance - American Idol 2018 on ABC,American Idol,24,2018-04-02 00:19:28,"ABC|""americanidol""|""idol""|""american idol""|""ryan""|""seacrest""|""ryan seacrest""|""katy""|""perry""|""katy perry""|""luke""|""bryan""|""luke bryan""|""lionel""|""richie""|""lionel richie""|""season 16""|""american idol XVI""|""television""|""ad""|""spring""|""2018""|""music""|""reality""|""competition""|""song""|""sing""|""audition""|""auditions""|""performance""|""live""|""fox""|""AI""|""hollywood""|""contestant""|""official""|""american""|""official american idol""|""hollywood week""|""hometown audition""",648868,19938,294,986,https://i.ytimg.com/vi/ZANqw73F9Pw/default.jpg,False,False,False,"Harper Grace Sings Original Tune R.I.P. for her Hollywood Week Solo Performance on American Idol 2018.\n\nSee more of American Idol on our official site: http://www.americanidol.com\nLike American Idol on Facebook: https://www.facebook.com/AmericanIdol\nFollow American Idol on Twitter: https://twitter.com/americanidol\nFollow American Idol on Instagram: https://www.instagram.com/americanidol/\n\nLike ABC on Facebook: https://www.facebook.com/ABCNetwork/\nFollow ABC on Twitter: ‪https://twitter.com/abcnetwork\nFollow ABC on Instagram: ‪https://www.instagram.com/abcnetwork/\n\nAMERICAN IDOL, the iconic series that revolutionized the television landscape by pioneering the music competition genre, will return to airwaves on SUNDAY, MARCH 11 at 8|7c, at its new home on ABC.\n\nThe nationwide search for the next superstar kicked off in August 2017, as the Idol Bus traveled from Portland, Oregon, to Orlando, Florida, in its pursuit for talent, covering 23 cities across the country. Auditioning was made easier than ever as hopefuls also had the opportunity to submit audition videos online, as well as via select social media platforms using an official tag, #TheNextIdol, cultivating over 300,000 posts. Also, for the first time in “American Idol” history, hopefuls had the opportunity to audition through a livestream platform.\n\nHelping to determine who America will ultimately vote for to become the next singing sensation, are music industry forces and superstar judges, Luke Bryan, Katy Perry and Lionel Richie. Emmy® Award-winning host and producer Ryan Seacrest will return as host of the beloved series.",False
kD-_iyS95AQ,2018-04-03 00:00:00,History of TV Theme Songs with Will Smith,The Tonight Show Starring Jimmy Fallon,23,2018-03-23 04:08:32,"The Tonight Show|""Jimmy Fallon""|""History of TV Theme Songs""|""Will Smith""|""NBC""|""NBC TV""|""Television""|""Funny""|""Talk Show""|""comedic""|""humor""|""snl""|""Fallon Stand-up""|""Fallon monologue""|""tonight""|""show""|""jokes""|""funny video""|""interview""|""variety""|""comedy sketches""|""talent""|""celebrities""|""video""|""clip""|""highlight""|""Suicide Squad""|""Deadshot""|""Bad Boys""|""remix""|""song covers""|""Golden Girls""|""Thank You For Being A Friend""|""The Jeffersons""|""Good Times""|""Andy Griffith Show""|""Full House""|""Martin""|""The Fresh Prince of Bel-Air""|""I Am Legend""",5356479,67845,2132,3646,https://i.ytimg.com/vi/kD-_iyS95AQ/default.jpg,False,False,False,"Will Smith and Jimmy perform a live remix of some of the best sitcom theme songs of all time, including Will's classic Fresh Prince theme. Full list of TV tunes below:\n\nThe Golden Girls\nThe Jeffersons\nDiff'rent Strokes\nGood Times\nThe Andy Griffith Show\nI Dream of Jeannie\nFull House\nThe Greatest American Hero\nMartin\nThree's Company\nThe Fresh Prince of Bel-Air\n\nSubscribe NOW to The Tonight Show Starring Jimmy Fallon: http://bit.ly/1nwT1aN\n\nWatch The Tonight Show Starring Jimmy Fallon Weeknights 11:35/10:35c\nGet more Jimmy Fallon: \nFollow Jimmy: http://Twitter.com/JimmyFallon\nLike Jimmy: https://Facebook.com/JimmyFallon\n\nGet more The Tonight Show Starring Jimmy Fallon: \nFollow The Tonight Show: http://Twitter.com/FallonTonight\nLike The Tonight Show: https://Facebook.com/FallonTonight\nThe Tonight Show Tumblr: http://fallontonight.tumblr.com/\n\nGet more NBC: \nNBC YouTube: http://bit.ly/1dM1qBH\nLike NBC: http://Facebook.com/NBC\nFollow NBC: http://Twitter.com/NBC\nNBC Tumblr: http://nbctv.tumblr.com/\nNBC Google+: https://plus.google.com/+NBC/posts\n\nThe Tonight Show Starring Jimmy Fallon features hilarious highlights from the show including: comedy sketches, music parodies, celebrity interviews, ridiculous games, and, of course, Jimmy's Thank You Notes and hashtags! You'll also find behind the scenes videos and other great web exclusives.\n\nHistory of TV Theme Songs with Will Smith\nhttp://www.youtube.com/fallontonight",False
eqMC2qENv1c,2018-04-03 00:00:00,Usain Bolt's Full Training Session with Borussia Dortmund! | #BVBolt,Borussia Dortmund,17,2018-03-23 10:52:35,"BVB|""Borussia Dortmund""|""Bundesliga""|""Usain Bolt""|""Bolt""|""#BVBolt""|""Puma""|""Training""|""Live Training""|""Live""|""Livestream""|""Live-Stream""|""Live Stream""|""Brackel""|""Dortmund""|""Bolt BVB""|""Bolt BVB Training""|""Bolt BVB live""|""Usain Bolt BVB""|""Heja BVB""|""Usain Bolt Training""|""Usain Bolt Football""|""score""|""goal""|""tunnel""|""nutmegged""|""nutmeg""|""BVBolt""",774572,5380,442,496,https://i.ytimg.com/vi/eqMC2qENv1c/default.jpg,False,False,False,World record alert at the BVB training ground! On Friday Borussia Dortmund welcomed none other than the fastest man on the planet: Usain Bolt!\nRelive the training session with Borussia Dortmund on our YouTube channel! #BVBolt\n▶Subscribe: https://goo.gl/kujepC\nBVB total!: https://www.bvbtotal.de/\nFacebook: https://facebook.com/BVB\nTwitter: https://twitter.com/BVB\nInstagram: https://www.instagram.com/bvb09\nWebsite: https://www.bvb.de/\nSnapchat: bvbsnaps,False
UuGl1BVCr1Q,2018-04-03 00:00:00,Roseanne Barr & John Goodman on Roseanne Return,Jimmy Kimmel Live,24,2018-03-23 07:30:00,"jimmy|""kimmel""|""live""|""late""|""night""|""talk""|""show""|""funny""|""comedic""|""comedy""|""clip""|""comedian""|""roseanne""|""barr""|""john""|""goodman""|""dan""|""conner""|""couch""|""classic""|""sitcom""|""tv""|""roseanne barr""|""john goodman""|""roseanne conner""|""dan conner""",928963,4605,399,859,https://i.ytimg.com/vi/UuGl1BVCr1Q/default.jpg,False,False,False,"Roseanne and John arrive on their infamous couch, talk about the how the revival came to be, John's character dying and coming back to life, and Roseanne reveals details about quitting the show and her problem with authority.\n\nTrump is Furious and Bad at Spelling https://youtu.be/wOAFHhs0Ots\n \nSUBSCRIBE to get the latest #KIMMEL: http://bit.ly/JKLSubscribe\n \nWatch Mean Tweets: http://bit.ly/KimmelMT10\n \nConnect with Jimmy Kimmel Live Online:\n \nVisit the Jimmy Kimmel Live WEBSITE: http://bit.ly/JKLWebsite\nLike Jimmy Kimmel on FACEBOOK: http://bit.ly/KimmelFB\nLike Jimmy Kimmel Live on FACEBOOK: http://bit.ly/JKLFacebook\nFollow @JimmyKimmel on TWITTER: http://bit.ly/KimmelTW\nFollow Jimmy Kimmel Live on TWITTER: http://bit.ly/JKLTwitter\nFollow Jimmy Kimmel Live on INSTAGRAM: http://bit.ly/JKLInstagram\n \nAbout Jimmy Kimmel Live:\n \nJimmy Kimmel serves as host and executive producer of Emmy-winning Jimmy Kimmel Live, ABC's late-night talk show.\n\nJimmy Kimmel Live is well known for its huge viral video successes with 5.6 billion views on YouTube alone.\nSome of Kimmel's most popular comedy bits include - Mean Tweets, Lie Witness News, Jimmy's Twerk Fail Prank, Unnecessary Censorship, YouTube Challenge, The Baby Bachelor, Movie: The Movie, Handsome Men's Club, Jimmy Kimmel Lie Detective and music videos like I (Wanna) Channing All Over Your Tatum and a Blurred Lines parody with Robin Thicke, Pharrell, Jimmy and his security guard Guillermo.\nNow in its sixteenth season, Kimmel's guests have included: Johnny Depp, Meryl Streep, Tom Cruise, Halle Berry, Harrison Ford, Jennifer Aniston, Will Ferrell, Katy Perry, Tom Hanks, Scarlett Johansson, Channing Tatum, George Clooney, Larry David, Charlize Theron, Mark Wahlberg, Kobe Bryant, Steve Carell, Hugh Jackman, Kristen Wiig, Jeff Bridges, Jennifer Garner, Ryan Gosling, Bryan Cranston, Jamie Foxx, Amy Poehler, Ben Affleck, Robert Downey Jr., Jake Gyllenhaal, Oprah, and unfortunately Matt Damon.\n\nRoseanne Barr & John Goodman on Roseanne Return\nhttps://youtu.be/UuGl1BVCr1Q",False
FFsp5b4AUTE,2018-04-03 00:00:00,"Roman Reigns is brutally ambushed by Brock Lesnar: Raw, March 19, 2018",WWE,17,2018-03-20 01:25:57,"wwe|""world wrestling entertainment""|""wrestling""|""wrestler""|""wrestle""|""superstars""|""कुश्ती""|""पहलवान""|""डब्लू डब्लू ई""|""मैच""|""सुपरस्टार""|""व्यावसायिक कुश्ती""|""مصارعه""|""Raw""|""Roman Reigns""|""Brock Lesnar""|""Paul Heyman""|""Kurt Angle""|""sp:ty=high""|""sp:st=wrestling""|""sp:scp=athlete_in_match""|""sp:dt=2018-03-19T20:00:00-04:00""|""sp:ev=wwe-raw""|""sp:ath=wwe-romanr""|""sp:ath=wwe-kuan""|""sp:ath=wwe-brle""|""reigns""|""wwe raw""|""wwe raw highlights""|""monday night raw""|""roman reigns vs brock lesnar""|""wwe monday night raw""|""wrestlemania 34""|""brock lesnar wwe""",9648943,95586,19156,21762,https://i.ytimg.com/vi/FFsp5b4AUTE/default.jpg,False,False,False,"After Roman Reigns violated his suspension and was taken into custody for trespassing, The Beast Incarnate eviscerated his WrestleMania opponent.\nGet your first month of WWE Network for FREE: http://wwenetwork.com\nSubscribe to WWE on YouTube: http://bit.ly/1i64OdT\nVisit WWE.com: http://goo.gl/akf0J4\nMust-See WWE videos on YouTube: https://goo.gl/QmhBof",False
DfxhWPvhFCQ,2018-04-03 00:00:00,Iggy Azalea Burned Nick Young's Designer Clothes | WWHL,Watch What Happens Live with Andy Cohen,24,2018-03-19 15:59:58,"What What Happens live|""reality""|""interview""|""fun""|""celebrity""|""Andy Cohen""|""talk""|""show""|""program""|""Bravo""|""Watch What Happens Live""|""WWHL""|""bravo andy""|""Watch""|""What""|""Happens""|""Singer""|""Iggy Azalea""|""burned""|""ex-fiance""|""NBA player""|""Nick Young""|""designer""|""clothes""|""warning""|""iggy""|""azalea""|""nick""|""young""|""nba""|""lakers""|""swaggy p""|""iggy azalea (celebrity)""|""iggy azalea nick young""|""engagement""|""music""|""real""|""pregnant""|""iggy azalea vs azaliea banks""|""basketball""|""nba highlights""",642908,5898,2566,1986,https://i.ytimg.com/vi/DfxhWPvhFCQ/default.jpg,False,False,False,"Singer Iggy Azalea talks about how she burned ex-fiance NBA player Nick Young’s designer clothes and says that she gave him a warning before doing it.\n►► Subscribe To WWHL: http://bravo.ly/WWHLSub\n\nWatch WWHL Sun-Thu 11/10c:\nWWHL Website: http://www.bravotv.com/watch-what-happens-live\nFollow WWHL: https://twitter.com/BravoWWHL\nLike WWHL: https://www.facebook.com/WatchWhatHappensLive\nWWHL Tumblr: http://bravowwhl.tumblr.com/\n\n'Watch What Happens: Live' is Bravo's late-night, interactive talk show that features guests from the world of entertainment, politics, and pop culture. Hosted by Andy Cohen, the series includes lively debates on everything from fashion, the latest on everyone's favorite Bravolebrities, and what celebrity is making headlines that week. Past guests who have joined Cohen in the Bravo Clubhouse include Sarah Jessica Parker, Tina Fey, Khloe Kardashian, Jennifer Lopez, Liam Neeson, Kelly Ripa, Jimmy Fallon, Anderson Cooper, Jennifer Lawrence, and Lance Bass.\n\nWatch More Bravo:\nBravo Website: http://www.bravotv.com/\nBravo Youtube: http://www.youtube.com/videobybravo\nFollow Bravo: http://www.twitter.com/bravotv\nLike Bravo: https://www.facebook.com/BRAVO\nPin Bravo: http://www.pinterest.com/bravobybravo\nBravo Instagram: http://www.instagram.com/bravotv\nBravo Tumblr: http://bravotv.tumblr.com/\n\nIggy Azalea Burned Nick Young's Designer Clothes | WWHL",True
e9byydi6cns,2018-04-03 00:00:00,Queens Of The Stone Age - Head Like a Haunted House,QueensStoneAgeVEVO,10,2018-03-19 14:00:03,"Queens|""Of""|""The""|""Stone""|""Age""|""Head""|""Like""|""Haunted""|""House""|""Beggars""|""Alternative""|""Rock""|""Alternative/Punk""|""QOTSA Villains""|""QOTSA Villians""|""New Queens""",404861,12193,557,795,https://i.ytimg.com/vi/e9byydi6cns/default.jpg,False,False,False,"Music video by Queens Of The Stone Age performing Head Like a Haunted House.\n\nProduced, Edited and Directed by Liam Lynch\n\nTour Dates & Tickets: http://smarturl.it/QOTSALive\n\nMatador Store: http://smarturl.it/Villains_Matador\nApple Music: http://smarturl.it/Villains_iTunes\nAmazon: http://smarturl.it/Villains_AmazonMusic\nGoogle Play: http://smarturl.it/Villains_GooglePlay\nOfficial Store: https://store.qotsa.com/\nSpotify: http://smarturl.it/Villains/spotify\nhttp://www.qotsa.com/\nhttps://www.facebook.com/QOTSA/\nhttps://www.instagram.com/queensofthestoneage/\n\n(C) 2018 Matador Records\n\nhttp://vevo.ly/zQPAz6",False
fzmM0AB60QQ,2018-04-03 00:00:00,Lost in Space | Official Trailer [HD] | Netflix,Netflix,24,2018-03-06 14:30:02,"Netflix|""Trailer""|""Netflix Original Series""|""Netflix Series""|""television""|""movies""|""streaming""|""movies online""|""television online""|""documentary""|""comedy""|""drama""|""08282016NtflxUSCAN""|""watch movies""|""Lost in Space""|""space""|""Sci-Fi""|""sci fi""|""science fiction""|""the robinson family""|""Robinson family""|""Danger Will Robinson""|""Dr. Smith""|""Will Robinson""|""teaser""|""trailer""|""sneak peek""|""spaceship""|""robot""|""robots""|""jupiter""|""space exploration""",3250746,40204,1614,5695,https://i.ytimg.com/vi/fzmM0AB60QQ/default.jpg,False,False,False,"The Robinson family, part of a highly trained mission to establish a new colony in space, is unexpectedly pulled off course forcing them to crash land on a lost planet. Danger will find them. Lost in Space premieres  April 13, 2018.\n\nWatch Lost in Space on Netflix: https://www.netflix.com/title/80104198\n\nSUBSCRIBE: http://bit.ly/29qBUt7\n\nAbout Netflix:\nNetflix is the world’s leading Internet television network with over 117 million members in over 190 countries enjoying more than 125 million hours of TV shows and movies per day, including original series, documentaries and feature films. Members can watch as much as they want, anytime, anywhere, on nearly any Internet-connected screen. Members can play, pause and resume watching, all without commercials or commitments.\n\nConnect with Netflix Online:\nVisit Netflix WEBSITE: http://nflx.it/29BcWb5\nLike Netflix Kids on FACEBOOK: http://bit.ly/NetflixFamily\nLike Netflix on FACEBOOK: http://bit.ly/29kkAtN\nFollow Netflix on TWITTER: http://bit.ly/29gswqd\nFollow Netflix on INSTAGRAM: http://bit.ly/29oO4UP\nFollow Netflix on TUMBLR: http://bit.ly/29kkemT\n\nLost in Space | Official Trailer [HD] | Netflix\nhttp://youtube.com/netflix",False
kNg_RFDYpTw,2018-04-03 00:00:00,MAKEUP ROULETTE with Laura Lee || Kristen Hancher,Kristen Hancher,26,2018-03-03 17:00:03,"kristen hancher|""kristen hancher channel""|""kristen hancher youtube""|""kristen hancher youtube channel""|""kristenhancher musical.ly""|""vlog""|""challenge""|""beauty""|""musical.ly""|""comedy""|""makeup""|""makeup challenge""|""makeup roulette""|""beauty guru""|""https://www.youtube.com/user/laura88lee""|""https://www.youtube.com/user/NikkieTutorials""|""https://www.youtube.com/user/jeffreestar""|""https://www.youtube.com/user/MannyMua733""|""https://www.youtube.com/watch?v=jsDR2y3FPKE""|""https://www.youtube.com/user/theepatrickstarrr""",482479,18294,864,1179,https://i.ytimg.com/vi/kNg_RFDYpTw/default.jpg,False,False,False,Watch Laura Lee make me over: https://www.youtube.com/watch?v=YfwR4FPYSDk&feature=youtu.be\nSubscribe to Laura Lee: https://www.youtube.com/user/laura88lee\n\nInstagram: https://instagram.com/kristenhancher/\nBusiness Email: teamkristen@mattdugan.com,False
8gHURYmTzFs,2018-04-03 00:00:00,MY ULTIMATE 'SECRET' MAKEUP LOOK,Lisa Eldridge,26,2018-03-01 20:27:01,"Lisa Eldridge|""Lisa Elridge""|""Lisa Eldrige""|""Makeup""|""Make-up""|""Make up""|""Tutorial""|""How To""|""Look""|""Professional""|""Pro""|""Makeup artist""|""Makeup course""|""Beauty""|""cosmetics""|""best""|""top""|""makeupbylisaeldridge""|""lisa eldridge foundation""|""Rihanna""|""Kylie Cosmetics""|""Kim Kardashian""|""Fenty Beauty""|""Chrissy Teigen""|""Kendal Jenner""|""Kardashian""|""Meghan Markle""|""Khloe Kardashian""|""Jeffree Star""|""no makeup makeup""|""ultimate""|""secret""|""no makeup""|""subtle""|""highlight""|""foundation""|""concealer""|""basic""|""easy""|""natural""|""natural makeup""|""oscars""",487735,23553,370,1530,https://i.ytimg.com/vi/8gHURYmTzFs/default.jpg,False,False,False,"For 110% undetectable makeup (in daylight!). Follow me on instagram here http://instagram.com/lisaeldridgemakeup \nFor all the products that are featured in this film click on the links below:\n100% of advertising revenue is donated to charity.\n\nMake Up For Ever - Ultra HD Foundation - 125: http://lisae.me.uk/27300-28600\nZOEVA - Face Shape Brush - 110: http://lisae.me.uk/26750-28600\nStila - Convertible Color - Rose: http://lisae.me.uk/26570-28600\nPerricone MD - No Blush Blush: http://lisae.me.uk/28601-28600\nRMS Beauty - Living Luminizer: http://lisae.me.uk/27850-28600\nBare Minerals - BarePro 16hr Full Coverage Concealer - Medium - Neutral : http://lisae.me.uk/28602-28600\nCass Art  - Pro Art - Masterstroke Filbert - 0 : http://lisae.me.uk/27299-28600\nChanel - Natural Finish Loose Powder - Translucent: http://lisae.me.uk/7521-28600\nSuqqu - Cheek Brush: http://lisae.me.uk/3019-28600\nScreenface - Mini Puff: http://lisae.me.uk/28605-28600\nPerricone MD - No Eyeshadow Eyeshadow: http://lisae.me.uk/28590-28600\nKimiko  - Super Fine Eyebrow Pencil - Coffee: http://lisae.me.uk/28604-28600\nShu Uemura - Eyelash Curlers: http://lisae.me.uk/25771-28600\nDHC - Double Protection Mascara: http://lisae.me.uk/26003-28600\nCharlotte Tilbury - Rock 'N' Kohl - Eye Cheat : http://lisae.me.uk/26819-28600\nLancôme - Double-ended Eyebrow Brush: http://lisae.me.uk/27580-28600\nGlossier - Boy Brow - Brown: http://lisae.me.uk/27727-28600\nLancôme - Le Lip Liner - Charme: http://lisae.me.uk/28283-28600\nGosh Cosmetics - Eyebrow Kit: http://lisae.me.uk/25350-28600\nPaula Dorf - Sheer Crease Brush: http://lisae.me.uk/2743-28600\nSK-II - Mid Day Essence: http://lisae.me.uk/27351-28600\n\nOn my nails is Nailberry - Romance : http://lisae.me.uk/28607-28600\n\nFor for all the products used in this film and for makeup tips and information visit my site : http://www.lisae.me.uk/28600\n\n\nLisa Eldridge X \n\nFollow me on Snapchat THELISAELDRIDGE\nFollow me on Instagram http://instagram.com/LisaEldridgemakeup\nFollow me on Google+ https://www.google.com/+LisaEldridge\nFollow me on Twitter at http://twitter.com/Lisa_Eldridge\nFollow me on Facebook http://facebook.com/LisaEldridgeDotCom\nFollow me on Pinterest http://pinterest.com/lisaeldridge\n\nDisclaimer\nI can’t guarantee that all of the make-up and skincare products I recommend will suit you. I only use products I personally think are good having tried them on myself and my clients but everyone's skin is different and it's possible to be allergic to anything. Wherever possible, test products out on yourself before purchasing.\n\nI only feature products I like, or want to try. The products I use in these videos are either purchased by me or sent to me by make-up companies to use in my professional capacity as a make-up artist for fashion and celebrity photo shoots, red carpet etc. I am also sent products by many of the top magazines to judge for awards.\n\nI do not accept payment and am not sponsored to make any of the films on this channel. Some of the links under the videos and blog posts on my site are affiliated however and as stated before, I only feature products I like, or want to try.\n\nFor the my full policy click here - http://www.lisaeldridge.com/info/",False
3adHok6ytJI,2018-04-03 00:00:00,THE OUTLAW JOHNNY BLACK Trailer #1 NEW (2018) Michael Jai White Comedy Movie HD,MovieAccessTrailers,24,2018-03-02 22:21:47,"the outlaw johnny black trailer|""the outlaw johnny black""|""trailer""|""2018""|""new""|""new trailer""|""official""|""official trailer""|""hd trailer""|""michael jai white""|""comedy""|""movie""|""film""|""hd""",433624,9182,409,943,https://i.ytimg.com/vi/3adHok6ytJI/default.jpg,False,False,False,"THE OUTLAW JOHNNY BLACK Trailer #1 NEW (2018) Michael Jai White Comedy Movie HD\n\nKickstarter - https://www.indiegogo.com/projects/the-outlaw-johnny-black-movie-action#/\n\nMore info about the film:\nhttp://www.outlawjohnnyblackmovie.com\n\nhttp://www.jaiganticstudios.com \n\nSubscribe To MovieAccessTrailers To Catch Up All The New Movie Trailer, Movie Clips, TV Spots & Trailer Compilation Just For You. Subscribe Now and Turn The Notification On To Never Miss Any Official 2018 Movie Trailer From Us.",False
BQ31l1gPGKM,2018-04-03 00:00:00,J. Balvin - Ahora,jbalvinVEVO,10,2018-02-26 05:00:01,"J Balvin|""Ahora""|""J Balvin Ahora""|""Machika""|""Mi Gente""|""Ginza""|""La Familia""|""J.""|""Balvin""|""UMLE""|""Latino""|""Latin""|""Pop""",74572317,610489,26045,25437,https://i.ytimg.com/vi/BQ31l1gPGKM/default.jpg,False,False,False,"“Ahora” disponible ya en todas las plataformas digitales: \nhttps://umle.lnk.to/AHORAFp\n\nConnect with J Balvin: \nFacebook | https://www.facebook.com/JBalvinOficial/ \nInstagram | https://www.instagram.com/jbalvin/\nTwitter | https://twitter.com/JBALVIN \n\nMusic video by J. Balvin performing Ahora. (C) 2018 UMG Recordings, Inc.\n\nhttp://vevo.ly/tLU7lu",False
h3EJICKwITw,2018-04-03 00:00:00,Juice Wrld - All Girls Are The Same (Dir. by @_ColeBennett_),Cole Bennett,24,2018-02-26 04:33:17,"juice wrld|""juice world""|""999""|""all girls are the same""|""all girls r the same""|""nick mira""|""cole bennett""|""lyrical lemonade""|""music video""|""hip hop""|""rap""|""2018""",5529883,173300,2139,16624,https://i.ytimg.com/vi/h3EJICKwITw/default.jpg,False,False,False,"Juice Wrld - All Girls Are The Same \nSong Produced Nick Mira\nShot, Edited & Directed by Cole Bennett\n\n\nhttps://soundcloud.com/uiceheidd/all-girls-are-same-999-prod-nick-mira\n\nhttp://instagram.com/juicewrld999\nhttp://twitter.com/juiceworlddd\n\n—\n\nOfficial Channel of Cole Bennett / Lyrical Lemonade\n\nSubscribe for updates on music videos, interviews, performance videos, etc.\n\nCole Bennett\n\nhttp://www.twitter.com/_colebennett_\nhttp://www.instagram.com/_colebennett_\n\nLyrical Lemonade\n\nhttp://www.twitter.com/lyricalemonade\nhttp://www.instagram.com/lyricalemonade\nhttp://www.lyricallemonade.com",False
c0arVTRwytA,2018-04-03 00:00:00,【公式】「劇場版ポケットモンスター みんなの物語」予告編1,ポケモン公式YouTubeチャンネル,1,2018-02-27 01:00:03,"pokemon|""Pokémon""|""ポケモン""|""ポケットモンスター""|""みんなの物語""|""ピカチュウ""|""サトシ""|""映画""|""ポケモン映画""|""イーブイ""|""ウソッキー""|""ラッキー""|""ワニノコ""|""トゲピー""|""マリル""|""ムチュール""|""ルギア""|""映画再生リスト""",1385396,0,0,0,https://i.ytimg.com/vi/c0arVTRwytA/default.jpg,True,True,False,2018年7月13日（金）公開 「劇場版ポケットモンスター みんなの物語」\n映画公式サイト　http://www.pokemon-movie.jp/\n\nこの夏、“キミにきめた！”に続く、\n感動ストーリー「みんなの物語」ここに爆誕！\n\n■ストーリー\n人々が風と共に暮らす街・フウラシティでは、\n1年に1度だけ開催される“風祭り”が行われていた。\n祭りの最終日には伝説のポケモン・ルギアが現れて、\n恵みの風をもたらすという古くからの言い伝えが残る中、\n街に集まる人々はそれぞれの想いを抱きながら、祭りに参加していた……。\n\nポケモン初心者の女子高生、リサ。\n嘘がやめられなくなってしまったホラ吹き男、カガチ。\n自分に自信が持てない気弱な研究家、トリト。\nポケモンを毛嫌いする変わり者のおばあさん、ヒスイ。\n森の中で一人佇む謎の少女、ラルゴ。\n\nサトシとピカチュウが彼らと出会い、\nみんなの物語が動き出す――。\n\n\n©Nintendo･Creatures･GAME FREAK･TV Tokyo･ShoPro･JR Kikaku \n©Pokémon ©2018 ピカチュウプロジェクト,False
