Id,Label,timeset,channel_title,category_id,trending_date,publish_time,views,likes,dislikes,comment_count,componentnumber,modularity_class
s12qaVEyW14,H3 Podcast #63 - Ninja,,H3 Podcast,24,2018-05-17 00:00:00,2018-04-24 01:12:00,1578649,51891,2341,9082,0,18
p1DAEZNyJ8E,Avengers: Infinity War | Marvel Family Feud,,Marvel Studios Movies,29,2018-05-17 00:00:00,2018-04-22 23:21:45,3041885,64961,1191,6005,0,17
bZs2ImrTg5w,Drop the Mic: Shawn Mendes vs Odell Beckham Jr. - FULL BATTLE | TBS,,TBS,24,2018-05-17 00:00:00,2018-04-23 05:59:50,4398584,149355,1164,7281,0,4
vUTI4bPdlgE,J. Cole - ATM,,JColeVEVO,10,2018-05-17 00:00:00,2018-04-20 16:00:04,37885546,658260,38670,50075,0,16
f5I79eakR8E,Machine Gun Kelly - 27,,MGKVEVO,10,2018-05-17 00:00:00,2018-04-21 14:00:03,4149897,119650,1919,5421,0,16
VDndE432GpU,SOFI TUKKER - Batshit (Official Video) [Ultra Music],,Ultra Music,10,2018-05-17 00:00:00,2018-04-10 16:36:47,5337228,55942,4911,1606,0,4
86sFN_2kw5k,Martin Garrix & Loopers - Game Over,,Martin Garrix,10,2018-05-17 00:00:00,2018-04-20 12:17:08,5676596,162280,4100,8433,0,4
UHh6kJ-HWYw,Rapper 21 Savage Has Some Money Tips For Broke People | Think | NBC News,,NBC News,25,2018-05-17 00:00:00,2018-04-10 19:10:12,1075976,41550,898,2988,0,18
z5WrgDzNIZ0,6IX9INE Gotti (WSHH Exclusive - Official Music Video),,WORLDSTARHIPHOP,10,2018-05-17 00:00:00,2018-04-15 18:58:59,76687716,1059582,119267,141358,0,4
D2mjQP8cmYA,Anon International Trailer #1 (2018) | Movieclips Trailers,,Movieclips Trailers,1,2018-05-17 00:00:00,2018-04-17 22:12:54,374681,2452,169,284,0,17
DX5_o-mumvE,Nardwuar vs. Cardi B,,NardwuarServiette,10,2018-05-17 00:00:00,2018-04-16 11:27:46,1336800,40314,2197,6444,0,4
r03V9OEJlgg,"A Perfect Circle - So Long, And Thanks For All The Fish [Audio]",,APerfectCircleVEVO,10,2018-05-17 00:00:00,2018-04-16 15:00:04,2057982,25057,2486,5156,0,16
JwAnH6PLimo,Young Thug - Anybody (ft. Nicki Minaj) [Official Sign Video],,Young Thug,24,2018-05-17 00:00:00,2018-04-13 03:00:30,18309990,218788,9721,9477,0,4
sn3Ct2_L4OA,Breaking Benjamin - Torn in Two (Official Video),,BreakingBenjaminVEVO,10,2018-05-17 00:00:00,2018-04-13 04:00:15,3389105,52661,1780,4151,0,16
9jI-z9QN6g8,"Te Bote Remix - Casper, Nio García, Darell, Nicky Jam, Bad Bunny, Ozuna | Video Oficial",,Flow La Movie,10,2018-05-17 00:00:00,2018-04-11 22:00:00,328024035,2540597,162274,110468,0,4
ZbB4SYJNuTo,SUPER JUNIOR 슈퍼주니어 'Lo Siento (Feat. Leslie Grace)' MV,,SMTOWN,10,2018-05-17 00:00:00,2018-04-12 09:00:05,25679632,1003765,16336,126361,0,4
zT7VEhfezn8,Hennessy Carolina Surprises Cardi B w/ A Brand New Gucci Bag! | I Did It | TRL,,TRL,24,2018-05-17 00:00:00,2018-04-10 22:46:30,1391768,31534,528,1374,0,3
9wRQljFNDW8,Dion Lewis' 103-Yd Kick Return TD vs. Denver! | Can't-Miss Play | NFL Wk 10 Highlights,,NFL,17,2017-11-14 00:00:00,2017-11-13 02:05:26,81377,655,25,177,0,26
Om_zGhJLZ5U,TL;DW - Every DCEU Movie Before Justice League,,Screen Junkies,1,2017-11-14 00:00:00,2017-11-12 18:00:03,288922,7515,792,2111,0,17
goP4Z5wyOlM,Iraq-Iran earthquake: Deadly tremor hits border region - BBC News,,BBC News,25,2017-11-14 00:00:00,2017-11-12 21:16:40,34785,308,26,413,0,18
8NHA23f7LvU,Jason Momoa Wows Hugh Grant With Some Dothraki | The Graham Norton Show,,The Graham Norton Show,24,2017-11-14 00:00:00,2017-11-10 19:06:23,1496225,16116,236,605,0,17
cOc3tsFWoRs,Jason Momoa & Lisa Bonet: Love at First Sight,,The Late Late Show with James Corden,24,2017-11-14 00:00:00,2017-11-10 09:35:00,1497519,15504,353,1084,0,23
wnwF1FHybDQ,Mark Wahlberg's Kids Use Him for His Celeb Connections,,Late Night with Seth Meyers,23,2017-11-14 00:00:00,2017-11-10 11:00:04,225286,1731,193,206,0,3
pz95u3UVpaM,Camila Cabello - Havana (Vertical Video) ft. Young Thug,,CamilaCabelloVEVO,10,2017-11-14 00:00:00,2017-11-10 05:01:00,5476737,286268,4083,12254,0,4
yuBqWcSKrCk,"Owen Wilson on Meeting Julia Roberts, and Tandem Biking",,TheEllenShow,24,2017-11-14 00:00:00,2017-11-10 14:00:10,304926,3305,130,275,0,0
dW4wpGg64pE,Meryl Streep Meets Anna Wintour at Vogue,,Vogue,24,2017-11-14 00:00:00,2017-11-09 18:20:27,1017803,25122,628,1504,0,13
k29YnfttqEU,Mean Tweets – Country Music Edition #3,,Jimmy Kimmel Live,23,2017-11-14 00:00:00,2017-11-09 04:58:04,1315873,9312,584,769,0,3
htvR_dBs3eg,Sam Smith - The Thrill of It All ALBUM REVIEW,,theneedledrop,10,2017-11-14 00:00:00,2017-11-10 21:38:57,98422,2926,106,798,0,4
7fm7mll2qvg,Sigrid - Strangers (Lyric Video),,SigridVEVO,10,2017-11-14 00:00:00,2017-11-10 00:00:00,91776,4604,46,357,0,16
q-WipZ9p0wk,Three meals that cost me $1.50 each,,Brothers Green Eats,26,2017-11-14 00:00:00,2017-11-09 14:00:08,77630,1991,83,208,0,13
zy0b9e40tK8,Dark | Official Trailer [HD] | Netflix,,Netflix,24,2017-11-14 00:00:00,2017-11-09 09:00:07,378750,5642,146,675,0,17
rL4WkebTT_U,Where is TOKYO'S GREATEST View?,,Abroad in Japan,24,2017-11-14 00:00:00,2017-11-09 15:06:34,151709,9210,71,1103,0,13
Y6eKxjMA9ek,"Dropping And CATCHING A Paper Airplane At 2,000 Feet!",,Tucker Gott,24,2017-11-14 00:00:00,2017-11-09 16:00:09,175852,15909,200,852,0,13
44NYFvhXmW8,Thirty Seconds To Mars - Walk On Water (Official Music Video),,ThirtySecondsToMarsVEVO,10,2017-11-14 00:00:00,2017-11-08 13:00:00,1905487,65854,2442,4490,0,16
9wg3v-01yKQ,Harry Styles - Kiwi,,HarryStylesVEVO,10,2017-11-14 00:00:00,2017-11-08 13:00:01,9632678,810895,16139,59473,0,4
F-j_6IuaYfw,I Miss the Old Taylor,,Wong Fu Productions,24,2017-11-14 00:00:00,2017-11-08 21:05:20,476389,16106,950,2077,0,4
P4YJwy_T9pM,I Picked My Girlfriend's Outfit Blindfolded,,Tyler Williams,22,2017-11-14 00:00:00,2017-11-09 03:16:36,691229,31892,197,1404,0,13
B4gXsobd_ao,What Are Diminutives – and Why We Like Them,,The School of Life,27,2017-11-14 00:00:00,2017-11-09 14:00:01,79306,3809,127,670,0,18
x8eLIJAM58M,KUWTK | Scott Gets Upset Over Being Uninvited to Khloe K.'s Party | E!,,E! Entertainment,24,2017-11-14 00:00:00,2017-11-08 14:00:05,812007,5894,951,851,0,16
8j_BYfVEyhA,"O.T. Genasis Talks About His Come Up, Opens Up About His Son's Autism  + More",,Breakfast Club Power 105.1 FM,24,2017-11-14 00:00:00,2017-11-08 13:34:23,581288,5075,725,1780,0,8
HNa_UWX51_s,Last Friday Night - Katy Perry ('40s Jazz Vibes Style Cover) ft. Olivia Kuper Harris,,PostmodernJukebox,10,2017-11-14 00:00:00,2017-11-09 18:46:37,226088,10844,302,555,0,4
08nkwgZIE4I,P!nk - Barbies (Audio),,PinkVEVO,10,2017-11-14 00:00:00,2017-11-08 22:04:53,651036,23338,442,1101,0,21
5Smb3tZD1Qc,Tamar Braxton Talks Divorce In First Interview,,Tamar Chronicles,24,2017-11-14 00:00:00,2017-11-08 18:00:00,451356,3454,284,623,0,13
YHDbsyyjld0,A Tropical Island with 500 CATS!,,Kitten Lady,15,2017-11-14 00:00:00,2017-11-09 23:44:18,46571,4250,16,408,0,13
uyl6WtHEYOQ,Fire breathing full twist backflips in one minute - Guinness World Records Day,,Guinness World Records,24,2017-11-14 00:00:00,2017-11-10 20:39:51,28539,681,25,45,0,20
bhoFXkVy8JA,Basmati Blues - Trailer,,Blockbuster,1,2017-11-14 00:00:00,2017-10-13 08:20:03,12609,40,79,17,0,17
_w58R1OGQFA,Train - Have Yourself a Merry Little Christmas,,TrainVEVO,10,2017-11-14 00:00:00,2017-11-09 15:00:02,30021,569,42,44,0,18
BEweWXa5Twk,FACE SURGERY WITH MAKEUP,,Christen Dominique,26,2017-11-14 00:00:00,2017-11-09 03:27:36,471266,23634,460,1714,0,13
egXr0PU-kCY,BEAUTY GURU GETS A MAKEOVER... FINALE,,James Charles,24,2017-11-14 00:00:00,2017-11-08 22:17:37,1073134,47793,1886,5358,0,13
fIQ2Ty2OL34,"James Harden Triple-Double 2017.11.09 vs Cavs - 35 Pts, 13 Asts, 11 Rebs, 5 Stls, 2 GOOD!",,FreeDawkins,17,2017-11-14 00:00:00,2017-11-10 04:00:52,18573,420,10,236,0,26
d_j512i2k6c,Could an Earthquake Destroy USA - Biggest Earthquakes Ever,,The Infographics Show,27,2017-11-14 00:00:00,2017-11-08 20:30:01,250193,5748,332,1197,0,18
DOIw62TXYkg,GoPro Gets Melted by Lava and Survives,,PetaPixel,28,2017-11-14 00:00:00,2017-11-07 19:22:49,2457408,2707,200,209,0,18
CR9zYgr84QY,Chocolate Orange Autumn Cupcakes | Cupcake Jemma,,CupcakeJemma,26,2017-11-14 00:00:00,2017-11-09 18:30:01,122669,5723,55,263,0,13
M2-IpsWQUWs,Katy Perry - Swish Swish (Behind the Scenes with Just Dance),,Katy Perry,24,2017-11-14 00:00:00,2017-11-09 19:11:16,56012,6243,106,414,0,13
510KQ_LXGww,My Every Day Autumn Makeup | Zoella,,Zoella,26,2017-11-14 00:00:00,2017-11-08 18:24:16,1390440,86207,1775,710,0,13
CO9dIyNM_9Q,Pitcher Roy Halladay Dies After Crashing ICON A5 Plane He Promoted in October (File),,Storyful News,25,2017-11-14 00:00:00,2017-11-07 22:59:49,244532,633,174,765,0,18
hX643KbiI4s,Selena Gomez Singing Wolves and It Ain't Me FULL Instagram Live | Acoustic,,Tu Fan,24,2017-11-14 00:00:00,2017-11-08 21:50:37,82087,998,93,289,0,13
mwpHSMv1pI4,Girlfriend Gives Me A Surprise Makeover!? | Hannah Hart,,MyHarto,23,2017-11-14 00:00:00,2017-11-09 01:27:53,359120,15130,223,1143,0,3
UFPSIa1cLRQ,Phillip Phillips - Magnetic (Audio),,PhilPhillipsVEVO,10,2017-11-14 00:00:00,2017-11-09 05:00:01,38068,2195,28,154,0,16
o78x918zbFk,TOTAL FAIL! NATASHA DENONA HOLIDAY WTF,,Tati,26,2017-11-14 00:00:00,2017-11-08 18:00:05,1277364,56867,2148,25326,0,13
iNf6VErGDLI,Ozuna - Música Sin Fronteras (A YouTube Documentary),,Ozuna,10,2017-11-14 00:00:00,2017-11-08 14:00:09,1498866,67227,1473,4645,0,4
6ixU_vdE0Es,BOYFRIEND DOES MY MAKEUP | Madelaine Petsch,,Madelaine Petsch,22,2017-11-14 00:00:00,2017-11-08 22:13:18,280065,20289,38,939,0,13
agKDPntMv-E,Stephen A. Smith slams the Philadelphia 76ers for its 'Trust The Process' | First Take | ESPN,,ESPN,17,2017-11-14 00:00:00,2017-11-08 15:59:06,470191,4037,430,1553,0,26
Xl38SuxyrgM,"STEPH CURRY and OMRI CASSPI, postgame GSW (9-3) vs MIN: peaking?, turnovers, Casspi role",,LetsGoWarriors,17,2017-11-14 00:00:00,2017-11-09 07:27:32,16305,147,13,47,0,26
u7pV4vxD1bs,World's first self-driving shuttle crashes on first day of use,,KSNV News 3 Las Vegas,25,2017-11-14 00:00:00,2017-11-08 20:16:47,169511,57,59,79,0,18
zYWt2mnalP8,How To Do Thanksgiving Makeup That Has Nothing To Do With The 566 Federally Recognized Tribes,,Sailor J,24,2017-11-14 00:00:00,2017-11-08 00:03:47,160477,8388,691,950,0,13
PoNWU2cox9w,Inside Keanu Reeves' Custom Motorcycle Shop | WIRED,,WIRED,2,2017-11-14 00:00:00,2017-11-08 15:00:27,704363,16352,224,841,0,19
6hTzM1BPdU8,Kids Describe America to Koji the Illustrator,,HiHo Kids,22,2017-11-14 00:00:00,2017-11-08 21:00:01,130778,5684,53,737,0,13
MCW5HUkrr-o,Impossible Active Audio Noise Cancelling by Muzo,,ElectroBOOM,28,2017-11-14 00:00:00,2017-11-08 17:16:26,560569,29990,341,1788,0,18
VsYmwBOYfW8,Mean Tweets – Jimmy Kimmel Edition,,Jimmy Kimmel Live,23,2017-11-15 00:00:00,2017-11-14 08:30:01,2765121,35529,1705,2388,0,3
jr9QtXwC9vc,The Greatest Showman | Official Trailer 2 [HD] | 20th Century FOX,,20th Century Fox,1,2017-11-15 00:00:00,2017-11-13 14:00:23,2671756,12699,505,1010,0,17
TSqwDQHE1J8,Carey Mulligan Doesn't Tell People She's an Actress,,Late Night with Seth Meyers,23,2017-11-15 00:00:00,2017-11-14 10:00:02,137749,1145,61,131,0,3
Z3OZyb2iWqQ,Colin Farrell Dishes on Rendezvous with Girlfriend,,TheEllenShow,24,2017-11-15 00:00:00,2017-11-14 14:00:32,137860,1950,64,136,0,0
TUmyygCMMGA,Why the rise of the robots won’t mean the end of work,,Vox,25,2017-11-15 00:00:00,2017-11-13 13:45:16,635985,20721,2417,4111,0,18
0zk2SwmCpss,"Joel Embiid Full Highlights 2017.11.13 at Clippers - 32 Points, 16 Rebs, UNSTOPPABLE!",,FreeDawkins,17,2017-11-15 00:00:00,2017-11-14 06:24:27,63780,831,12,301,0,26
B5HORANmzHw,Founding An Inbreeding-Free Space Colony,,SciShow,27,2017-11-15 00:00:00,2017-11-12 22:00:01,286577,9606,248,1196,0,18
HBS9783c0BI,Jaden Smith: Watch Me,,The Late Late Show with James Corden,24,2017-11-15 00:00:00,2017-11-14 06:47:03,102639,3218,1085,475,0,23
sbcbvuitiTc,Stephon Marbury and Jimmer Fredette fight in China,,NBA Highlights · YouTube,17,2017-11-15 00:00:00,2017-11-10 18:23:05,1015189,2133,2483,1465,0,26
069D0NmW39o,"Wildest Superstar distractions: WWE Top 10, Nov. 11, 2017",,WWE,17,2017-11-15 00:00:00,2017-11-11 15:00:00,1155622,16060,883,1018,0,19
kOnQocd799Y,Everything Wrong With Baby Driver In 14 Minutes Or Less,,CinemaSins,1,2017-11-15 00:00:00,2017-11-09 17:14:11,2844271,60500,3667,8122,0,17
wJYE0sFOteE,Inside the Cheese-Aging Caves 30 Feet Under Brooklyn | I Got a Guy | Bon Appétit,,Bon Appétit,26,2017-11-15 00:00:00,2017-11-10 16:01:04,99019,2404,40,135,0,13
viyRD5z6ilQ,Luke Bryan - O Holy Night (Audio),,LukeBryanVEVO,10,2017-11-15 00:00:00,2017-11-10 05:00:01,147193,5405,151,395,0,16
x9mh-SwSKas,Surprise After Surprise | October Vlog,,clothesencounters,26,2017-11-15 00:00:00,2017-11-10 18:42:55,269509,10801,158,653,0,5
g5c1bk8weaQ,FIRST TIME IM DOING THIS! TALKS WITH LIZA.,,Liza Koshy,23,2017-11-15 00:00:00,2017-11-10 03:43:43,3741812,314872,2647,12114,0,3
fCTKDn3Q8xQ,Idiot's Guide to Japanese Squat Toilets,,Rachel and Jun,22,2017-11-15 00:00:00,2017-11-09 11:24:14,1185773,45513,1378,4794,0,13
xg9ebVTL9yE,Empire Of The Sun - Way To Go,,empireofthesunvevo,10,2017-11-15 00:00:00,2017-11-10 05:00:06,178313,9072,98,656,0,16
fbHbTBP_u7U,NF - Let You Down,,NFVEVO,10,2017-11-15 00:00:00,2017-11-09 05:00:05,2185367,96850,1130,8216,0,4
uiA4B5Y63IQ,THE SHAPE OF WATER - Final Trailer,,FoxSearchlight,1,2017-11-15 00:00:00,2017-11-09 22:00:07,366814,4099,172,449,0,17
QOksZ8VogRw,Bastille - World Gone Mad (from Bright: The Album) [Official Music Video],,Atlantic Records,10,2017-11-15 00:00:00,2017-11-09 17:03:42,797436,29425,585,1497,0,4
ttf_EzEkxBk,"Roy Halladay Plane Crash Video, Witnesses Say He Was Showboating | TMZ Sports",,TMZSports,17,2017-11-15 00:00:00,2017-11-08 17:29:15,3505996,5934,3400,5162,0,1
Eg_kW5fw6qU,Could Anastasia Become A Disney Princess?,,SuperCarlinBrothers,22,2017-11-15 00:00:00,2017-11-09 23:27:18,194946,9278,137,2803,0,17
_dhneCO4YEE,"Russian Bots and Trolls | November 8, 2017 Act 2 | Full Frontal on TBS",,Full Frontal with Samantha Bee,22,2017-11-15 00:00:00,2017-11-09 07:00:01,392482,5659,2432,1311,0,10
ozkqm2ifMw8,2CELLOS - Cinema Paradiso [OFFICIAL VIDEO],,2CELLOS,10,2017-11-15 00:00:00,2017-11-10 13:24:10,226317,11702,125,471,0,17
PkRBTF6nt4E,Tesla's biggest problem is one nobody saw coming,,Business Insider,25,2017-11-15 00:00:00,2017-11-10 13:00:02,144694,1012,588,288,0,18
Rq9-mW6HgQE,Sean Astin Knew Nothing About 'Lord Of The Rings' Once Upon A Time,,The Late Show with Stephen Colbert,24,2017-11-15 00:00:00,2017-11-09 08:35:00,908489,12261,339,1600,0,23
LMCuKltaY3M,Elbow - Golden Slumbers (John Lewis Advert 2017),,ElbowVEVO,10,2017-11-15 00:00:00,2017-11-10 08:00:01,180606,2400,159,239,0,16
EYkEshCOhEU,The Ultimate Red Lip Look | Nicole Guerriero,,Nicole Guerriero,22,2017-11-15 00:00:00,2017-11-10 00:24:29,308352,15765,399,984,0,13
6nJw-jPQYVI,A Day in The Life of David Letterman,,Late Show with David Letterman,24,2017-11-15 00:00:00,2015-05-21 07:55:00,193832,1351,25,128,0,23
1Wk8ZRgXQnY,Andy Grammer - The Good Parts (Official Audio),,Andy Grammer,10,2017-11-15 00:00:00,2017-11-09 22:27:45,41251,1561,29,96,0,4
tOFkFZbPdnQ,Typical audience reaction to a bass solo...,,Danny Sapko,10,2017-11-15 00:00:00,2017-11-09 00:44:51,524911,7822,185,403,0,4
qEEtzzi1EII,Birthdays - Simon's Cat | GUIDE TO,,Simon's Cat,15,2017-11-15 00:00:00,2017-11-09 13:34:58,467804,19962,268,953,0,13
RQDphL2MVlM,Everything I Wore This Week! Outfit Diary 1,,Dina Tokio,26,2017-11-15 00:00:00,2017-11-10 22:22:04,77302,3756,123,222,0,13
_qSW96a2aKY,Keith Urban - Female (Official Audio),,Keith Urban,24,2017-11-15 00:00:00,2017-11-08 05:01:25,878560,12961,1468,1788,0,4
2VP846QcA_4,I Trained To Become Batman 🦇 (Justice League),,Michelle Khare,24,2017-11-15 00:00:00,2017-11-09 11:30:00,155533,4621,233,451,0,17
lsfzA7sWlOM,L.A. Noire - Nintendo Switch Trailer,,Nintendo,20,2017-11-15 00:00:00,2017-11-09 19:59:48,161231,7803,169,1479,0,26
l7je4VAUvjA,World's First Engagement Ring Phone Case,,Caters Clips,25,2017-11-15 00:00:00,2017-11-10 08:00:03,90454,211,65,59,0,18
eHIY3HNNqzM,The Script - Arms Open (Acoustic) [Audio],,TheScriptVEVO,10,2017-11-15 00:00:00,2017-11-10 08:00:03,157037,7800,96,326,0,4
5gFpcEKayz4,MØ - When I Was Young (Official Video),,MOMOMOYOUTHVEVO,10,2017-11-15 00:00:00,2017-11-09 09:00:00,895507,38734,550,1270,0,17
r96KpNTcog4,THE MOMENTS BETWEEN THE MONTAGE | Chris & Jack,,Chris and Jack,23,2017-11-15 00:00:00,2017-11-09 14:00:17,134372,7979,80,310,0,3
6Detw08jRhs,MDNA SKIN: Express Yourself,,MDNA SKIN,22,2017-11-15 00:00:00,2017-11-09 18:24:34,55901,477,132,105,0,13
sottGW1p5os,P!nk Carpool Karaoke,,The Late Late Show with James Corden,24,2017-11-16 00:00:00,2017-11-15 06:42:14,3621389,141681,1289,8127,0,23
_BVAJ3PXZ1k,The all-American fruit you've probably never heard of,,Vox,25,2017-11-16 00:00:00,2017-11-15 11:30:00,533940,12633,597,1828,0,18
8hKbIhrb1WU,Kim Kardashian Lets Gender of Third Child Slip,,TheEllenShow,24,2017-11-16 00:00:00,2017-11-15 14:00:02,1559003,29898,884,1838,0,0
RTaDvKMtUeA,Larry David Outtakes – Mean Tweets About Jimmy Kimmel,,Jimmy Kimmel Live,24,2017-11-16 00:00:00,2017-11-15 05:15:45,760341,13283,317,433,0,3
gjXrm2Q-te4,Jimmy Fallon Pays Tribute to His Mother Gloria,,The Tonight Show Starring Jimmy Fallon,23,2017-11-16 00:00:00,2017-11-14 04:55:24,2223948,76806,1169,4176,0,8
9Ca8zWJOlFQ,Apple iPhone X Review: The Best Yet!,,Marques Brownlee,28,2017-11-16 00:00:00,2017-11-15 02:17:29,1825705,77531,4156,12025,0,18
oRF2-ZloSqg,"AJ Styles & Daniel Bryan warn Brock Lesnar about what awaits him: SmackDown LIVE, Nov. 14, 2017",,WWE,17,2017-11-16 00:00:00,2017-11-15 02:26:15,845763,17929,502,2325,0,19
lzgQrHFDNLE,What Does A Cochlear Implant Sound Like?,,SciShow,27,2017-11-16 00:00:00,2017-11-14 22:00:01,177648,6932,786,697,0,18
KJ12FVmumeA,Stephen A. Smith: Jay Cutler is a 'disease' | First Take | ESPN,,ESPN,17,2017-11-16 00:00:00,2017-11-14 16:28:34,281868,1546,245,885,0,26
815lSYphlbw,Japanese Food Tour with Frank Pinello and Sakura Yagi | Sean in the Wild,,First We Feast,26,2017-11-16 00:00:00,2017-11-14 16:00:01,196434,6305,88,762,0,13
64IIfxDrhJY,Titanic (2017) - Dolby Vision Trailer,,Paramount Pictures,1,2017-11-16 00:00:00,2017-11-15 13:32:00,17129,455,18,101,0,17
ryqZUqgjvW8,Justice League - Movie Review Is It What We've Been Waiting For?,,ColliderVideos,24,2017-11-16 00:00:00,2017-11-15 07:51:20,90641,2349,409,1246,0,17
3x0usYgljOk,"Jayson Tatum Full Highlights 2017.11.14 at Nets - 19 Pts, 3 Stls, SMOOTH!",,FreeDawkins,17,2017-11-16 00:00:00,2017-11-15 05:14:50,12494,252,3,91,0,26
SGVbdo2CkgI,Victoria Beckham Gives Strangers Fashion Advice for $2 in Central Park | Vanity Fair,,Vanity Fair,24,2017-11-16 00:00:00,2017-11-14 13:00:16,30341,730,22,34,0,17
KhdecX0qjNA,Demi Lovato - Sorry Not Sorry in the Live Lounge,,BBCRadio1VEVO,10,2017-11-16 00:00:00,2017-11-13 20:11:43,157522,8012,85,286,0,4
symdi5KSJts,Model Fei Fei Sun Perform Skin-Care Magic | Beauty Secrets | Vogue,,Vogue,24,2017-11-16 00:00:00,2017-11-14 13:00:16,212992,7049,209,365,0,13
5hEJsoDP2q4,"Justice League | “Come Together” | Todrick Hall, J.Fla, Mario Bautista, Samantha Harvey, Clara Marz",,todrickhall,24,2017-11-16 00:00:00,2017-11-14 17:00:12,209442,19069,289,836,0,17
MNiweoKXwfg,Watch Norman Reedus Come Face to Face with his ‘Walking Dead’ Double,,INSIDER,24,2017-11-16 00:00:00,2017-11-13 17:00:26,20529,318,11,41,0,18
JBZTZZAcFTw,"What $4,800 Will Get You In NYC | Sweet Digs Home Tour | Refinery29",,Refinery29,26,2017-11-16 00:00:00,2017-11-12 16:00:01,237111,2323,786,636,0,13
pjuPpVLXDQg,Train Swipes Parked Vehicle,,ViralHog,2,2017-11-16 00:00:00,2017-11-13 00:46:11,100120,154,15,48,0,13
0PpNlNJ6Nng,Will It Watermarble?! Sister Edition | Watermarbling 9 random objects in nail polish!,,Simply Nailogical,24,2017-11-16 00:00:00,2017-11-11 19:03:43,2083918,106243,1461,12707,0,18
4v0nOAzcG2A,The Super Google Pixel 2 Camera Upgrade!,,Jonathan Morrison,28,2017-11-16 00:00:00,2017-11-11 15:38:32,300601,10497,382,991,0,18
8mhTWqWlQzU,Wearing Online Dollar Store Makeup For A Week,,Safiya Nygaard,22,2017-11-16 00:00:00,2017-11-11 01:19:33,3031863,121285,1186,6852,0,13
i4YQRLQVixM,How Bkav tricked iPhone X's Face ID with a mask,,Bkav Corp,28,2017-11-16 00:00:00,2017-11-10 07:28:14,1167646,2691,916,1122,0,18
_Iz83-Cmt6A,Little Big Town with Jimmy Webb - Wichita Lineman (Live from the CMA Awards),,CMAVEVO,10,2017-11-16 00:00:00,2017-11-09 22:23:51,58135,519,69,65,0,16
2Vv-BfVoq4g,Ed Sheeran - Perfect (Official Music Video),,Ed Sheeran,10,2017-11-16 00:00:00,2017-11-09 11:04:14,43449654,1788960,24548,93428,0,4
gLswXiRLdkA,A VERY #EXTRA EBAY SHOPPING HAUL!,,Amber Scholl,26,2017-11-16 00:00:00,2017-11-11 02:42:23,525210,24412,1259,1847,0,13
pa_oUisZZy0,Mark Ruffalo Reads Hilarious Thirst Tweets,,BuzzFeed Celeb,22,2017-11-16 00:00:00,2017-11-11 00:30:16,243412,7782,104,340,0,23
G8gJ4RTBxcg,Coconut crab hunts seabird,,New Scientist,28,2017-11-16 00:00:00,2017-11-09 15:20:54,465893,111,14,59,0,18
cccyOn99s4Y,Reacting to Running a Half Marathon | MEGANBYTES EP. 101,,MeganBatoon,24,2017-11-16 00:00:00,2017-11-10 23:00:01,82713,3124,151,250,0,3
arJ5h2TY3I4,FANTASY (feat. Amber Liu) by SUPERFRUIT,,SUPERFRUIT,24,2017-11-16 00:00:00,2017-11-10 17:00:51,1233722,115781,1615,9706,0,4
uTH--XRCGxM,5 Strange Things That Happened to Stranger Things’ Joe Keery on His GQ Photo Shoot,,GQ,24,2017-11-16 00:00:00,2017-11-10 17:01:04,127404,3869,56,111,0,23
e4FApt6z55c,Kimbra - Top of the World (Official Music Video),,kimbramusic,10,2017-11-16 00:00:00,2017-11-10 15:43:00,226659,9725,400,1027,0,4
2XK4omx9uMU,Camila Cabello COMPLETELY NAILS 'Finish The Lyric',,Capital FM,10,2017-11-16 00:00:00,2017-11-10 14:40:32,1354030,57838,512,1257,0,4
abGCYPCk294,"Justice League Reactions, Should Disney Buy Netflix - The John Campea Show",,John Campea,24,2017-11-16 00:00:00,2017-11-11 17:55:27,45236,1581,110,911,0,17
AJYb0Yom5UQ,Howard Stern: George Takei Talks About Harvey Weinstein and Sexually Assault,,cocheusadoooo,23,2017-11-16 00:00:00,2017-10-17 20:01:44,172587,379,49,199,0,13
fNtLIcyjsnI,"Game Night Official Trailer #1 (2018) Rachel McAdams, Jason Bateman Comedy Movie HD",,Zero Media,1,2017-11-16 00:00:00,2017-11-09 17:11:32,2122489,20085,1104,1321,0,17
YlvCVbfS9M0,Alan Walker - All Falls Down (Behind The Scenes),,Alan Walker,10,2017-11-16 00:00:00,2017-11-11 15:11:18,935744,37129,622,2673,0,4
DIU3xPdhCBI,Sam Smith surprises brides at their wedding! (At The BBC),,BBC Music,10,2017-11-16 00:00:00,2017-11-09 22:26:10,1262652,28119,1047,1113,0,8
QFfEtKvXMAs,Niall Horan - Too Much To Ask (Acoustic),,NiallHoranVEVO,10,2017-11-16 00:00:00,2017-11-10 17:00:05,505794,55628,192,3033,0,4
jp9hK-jY6yY,When Someone Has A Crush on You | Lilly Singh,,IISuperwomanII,23,2017-11-16 00:00:00,2017-11-09 22:21:13,3680540,216119,3570,20544,0,3
lJFqvRwOiis,Walking while black,,Vox,25,2017-11-17 00:00:00,2017-11-16 12:55:39,505886,23207,5375,7030,0,18
vKbyfdJXoDg,Jordan Peele Crashed A 'Get Out' College Course,,The Late Show with Stephen Colbert,24,2017-11-17 00:00:00,2017-11-16 08:35:00,406769,6593,397,1253,0,23
eDelIZDzmwQ,Blake Shelton Is Milking His Title of Sexiest Man Alive,,TheEllenShow,24,2017-11-17 00:00:00,2017-11-16 14:00:04,340348,5474,372,653,0,0
t1Liix4gi7k,Gigi Hadid Gives Jimmy the Only Men's Pair of Her EyeLoveMore Mules,,The Tonight Show Starring Jimmy Fallon,23,2017-11-17 00:00:00,2017-11-16 05:13:33,1035804,18816,737,1133,0,8
oMupq6zB1Tc,Should Hillary Clinton Be Impeached?,,Jimmy Kimmel Live,24,2017-11-17 00:00:00,2017-11-15 08:30:01,769769,6133,1124,2837,0,3
TN5jzDgORqQ,KUWTK | Kris Jenner Brings Her Personal Scribe to Lunch | E!,,E! Entertainment,24,2017-11-17 00:00:00,2017-11-15 15:00:05,325333,2750,307,383,0,16
4SANXNco_y4,Dashboard Confessional: We Fight (Official Audio),,Fueled By Ramen,10,2017-11-17 00:00:00,2017-11-15 17:05:36,82048,3539,144,347,0,4
UC34HrZhfPM,"Kyle Kuzma Full Highlights 2017.11.15 vs 76ers - 24 Pts, 7 Rebs!",,FreeDawkins,17,2017-11-17 00:00:00,2017-11-16 06:38:42,23429,365,10,188,0,26
IKuKZIISPE0,Behind The Curtain - OFFICIAL TRAILER,,todrickhall,24,2017-11-17 00:00:00,2017-11-15 17:00:16,69199,4237,15,220,0,4
KOUxLhYVgGw,Rosé Facial in New York City,,INSIDER,26,2017-11-17 00:00:00,2017-11-16 20:17:25,6582,174,8,22,0,13
dnA3Cd5xG5A,How Maybelline Mascara Is Made | How Stuff Is Made | Refinery29,,Refinery29,26,2017-11-17 00:00:00,2017-11-15 16:00:03,22383,921,26,78,0,13
yZGSIpcAfEo,Willie Reed and Joel Embiid Fight！Embiid saying HE CANT FUCKIN GUARD ME!,,DunkFest,17,2017-11-17 00:00:00,2017-11-14 04:26:46,80687,197,30,53,0,26
ijJPFowBsBc,HUGE BEAUTY FAVOURITES! AUTUMN LOVES!,,Estée Lalonde,22,2017-11-17 00:00:00,2017-11-12 17:00:02,141308,4455,169,327,0,13
dQvIbulWCM4,Celebrities on Thanksgiving 2017!,,Niki and Gabi,23,2017-11-17 00:00:00,2017-11-12 23:41:48,900779,47602,1876,3796,0,3
KLZl_sxSN_g,WWSB Channel 7:   Sarasota Police stepping up pedestrian and bicyclist safety enforcement,,Sarasota Police Department,25,2017-11-17 00:00:00,2017-11-08 19:23:52,1431,4,0,0,0,18
qooQd8AA7_M,"Camila Cabello, Daddy Yankee - Havana (Remix - Audio)",,CamilaCabelloVEVO,10,2017-11-17 00:00:00,2017-11-12 05:01:00,7095077,438470,6754,29178,0,4
0mlNzVSJrT0,Me-O Cats Commercial,,Nobrand,22,2017-11-17 00:00:00,2017-04-21 06:47:32,122634,2908,210,595,0,13
PABlVzeldaM,U.S. Navy Three Carrier Formation in Western Pacific Ocean,,U.S. Navy,25,2017-11-17 00:00:00,2017-11-12 13:13:33,256760,782,98,793,0,18
bqgVB6Vl-lI,All of Jim's Best Pranks  - The Office US,,The Office US,24,2017-11-17 00:00:00,2017-11-11 17:00:03,227162,4836,60,268,0,19
BWPrk9PUwQE,iPhone X vs Makeup Transformation (Face ID TEST),,dope2111,26,2017-11-17 00:00:00,2017-11-12 00:45:54,1856410,38114,2049,2768,0,18
STI2fI7sKMo,WE GOOGLED OURSELVES | Shawn and Andrew,,Shawn Johnson East,22,2017-11-17 00:00:00,2017-11-11 15:00:03,352770,4782,1838,741,0,13
ZhSk8mPSWCg,'Lord of the Rings' TV Series Gets Multi-Season Order At Amazon | News Flash | Entertainment Weekly,,Entertainment Weekly,24,2017-11-17 00:00:00,2017-11-13 20:51:31,3914,48,3,24,0,23
eijd-yjXY9E,Apple iPhone X - One Week Later,,Mark Linsangan,28,2017-11-17 00:00:00,2017-11-13 15:00:03,9747,447,14,81,0,18
