Id,Label,timeset,channel_title,category_id,trending_date,publish_time,views,likes,dislikes,comment_count,componentnumber,modularity_class
4AtOU0dDXv8,Shooting survivor confronts NRA spokesperson Dana Loesch,,CNN,25,2018-02-24 00:00:00,2018-02-22 04:50:21,2036792,29446,14379,38936,0,18
2Yz_kqxegrs,Troye Sivan & Ariana Grande working together!,,BBC Radio 1,10,2018-02-24 00:00:00,2018-02-23 08:30:00,41761,3149,38,251,0,4
kA66nAvEEII,Stephen A. shares theory on why Spurs' Kawhi Leonard isn't playing this season | First Take | ESPN,,ESPN,17,2018-02-24 00:00:00,2018-02-22 15:31:36,707341,4881,290,1569,0,26
Bxhew4TpiAg,"Black History: Awesome Facts, Part TWO! | Thomas Sanders",,Thomas Sanders,23,2018-02-24 00:00:00,2018-02-17 01:02:50,165099,16661,518,2451,0,26
M2xqMZ6b85w,I turned this car into a COMPUTER MOUSE,,William Osman,28,2018-02-24 00:00:00,2018-02-16 14:00:03,309971,11844,206,792,0,18
QAt8kU3TQfQ,The Most Mysterious Star in the Universe We Can't Explain,,RealLifeLore,27,2018-02-24 00:00:00,2018-02-16 15:53:23,435859,16174,547,1704,0,18
QQ_3S-IQm38,Muse - Thought Contagion [Official Music Video],,Muse,10,2018-02-24 00:00:00,2018-02-15 19:28:57,3430385,103188,5643,10594,0,16
D_eZxSYRhco,READY PLAYER ONE - Come With Me,,Warner Bros. Pictures,24,2018-02-24 00:00:00,2018-02-15 17:00:02,2953664,30865,1173,6821,0,18
_KBc4B5JFoQ,"Sean Paul, David Guetta - Mad Love (Lyric Video) ft. Becky G",,SeanPaulVEVO,10,2018-02-24 00:00:00,2018-02-16 00:01:01,3622209,117794,1851,2785,0,16
wfWIs2gFTAM,Eminem - River ft. Ed Sheeran,,EminemVEVO,10,2018-02-24 00:00:00,2018-02-14 15:00:06,32730338,1199986,26862,67809,0,16
5XUwdZkM6N8,MY FACE CHART RECREATION! | MILK1422,,LustreLux,26,2018-02-24 00:00:00,2018-02-16 00:00:00,215237,11154,334,1072,0,13
nCMGU846iTI,Brad Makes Chocolate: Part 2 | It's Alive | Bon Appétit,,Bon Appétit,26,2018-02-24 00:00:00,2018-02-15 17:00:46,448169,11239,156,1177,0,13
UgpL43chE-E,Red Gerard on His Gold Medal Snowboard Run,,LIVEKellyandRyan,24,2018-02-24 00:00:00,2018-02-15 18:09:51,336953,2272,87,117,0,18
52Y7NwbmOHY,'Black Panther' Review - The Women Were Clutch,,Tony Baker Comedy,24,2018-02-24 00:00:00,2018-02-16 15:47:56,72999,3859,109,729,0,17
d54e3kcTlHM,Diplo - Look Back (Feat. DRAM) (Official Music Video),,Diplo,10,2018-02-24 00:00:00,2018-02-16 15:03:11,565798,14884,653,608,0,17
-3nEHRN6IPg,Blackberry Motion Teardown - Do not trust around Water...,,JerryRigEverything,26,2018-02-24 00:00:00,2018-02-16 16:30:01,266142,10697,389,1035,0,13
gDPr8Na24QU,Black Panther Cast Answers the Web's Most Searched Questions | WIRED,,WIRED,24,2018-02-24 00:00:00,2018-02-14 17:00:28,3944791,106103,1709,6264,0,19
dVNZYskqdEc,Anna Wintour Breaks Down the Best Moments of New York Fashion Week | Vogue,,Vogue,26,2018-02-24 00:00:00,2018-02-16 23:28:46,107255,4092,74,165,0,13
hIcR65h2GDs,"No, Oprah's not running for president in 2020",,60 Minutes,25,2018-02-24 00:00:00,2018-02-15 13:51:01,167038,1180,135,673,0,18
KtlERZ5WnaU,I TRIED FOLLOWING A JAMES CHARLES MAKEUP TUTORIAL,,Ricky Dillon,23,2018-02-24 00:00:00,2018-02-15 22:11:10,460847,21236,733,1357,0,13
LvC8VzCcI88,LaurDIY and Alex Wassabi's Epic Two-Tone Room Makeover!,,Mr. Kate,26,2018-02-24 00:00:00,2018-02-15 23:00:00,2480760,135983,1468,7346,0,13
RNA516fNpuw,Alina Zagitova’s gold medal free skate in PyeongChang,,NBC Sports,17,2018-02-25 00:00:00,2018-02-23 12:21:44,529609,4330,206,864,0,18
yawznhmT8x8,People Try Tiny Baking,,BuzzFeedVideo,22,2018-02-25 00:00:00,2018-02-21 19:00:39,1146176,26211,702,1115,0,13
ChqXsD5L8Ac,How Krispy Kreme Doughnuts are Made,,INSIDER,19,2018-02-25 00:00:00,2018-02-21 16:00:01,376264,5087,405,1081,0,18
g2MyotPRcXE,How To Etch Anything Using The Sun,,BuzzFeed Nifty,26,2018-02-25 00:00:00,2018-02-21 22:00:04,79124,3300,64,160,0,13
dRtqFjYYUY0,The In-Glass Fingerprint Reader: Explained!,,Marques Brownlee,28,2018-02-25 00:00:00,2018-02-21 03:37:01,1745260,73628,1036,6138,0,18
htWO0--MbQg,What's inside a SQUARE BASKETBALL?,,What's Inside?,17,2018-02-25 00:00:00,2018-02-18 15:30:01,2300863,21014,7880,4213,0,26
4iyOED0DPZw,Host dad who took in accused Florida shooter: It's his right to have an AR-15,,CBS This Morning,25,2018-02-25 00:00:00,2018-02-20 12:27:48,40026,127,137,319,0,18
RmH15TCBvDk,"iPod SSD hack, weird toothbrush dongles, and iPad accessories",,The Verge,28,2018-02-25 00:00:00,2018-02-20 22:04:36,58811,837,161,103,0,18
uwfIr6flLXk,How to Control Your Boyfriend | Hannah Stocking,,Hannah Stocking,23,2018-02-25 00:00:00,2018-02-17 17:00:03,3691273,88902,20510,8060,0,4
k8IEepWOoAQ,Korean McDonald's PyeongChang Olympics Burger,,BenDeen,22,2018-02-25 00:00:00,2018-02-18 13:43:13,50066,1850,41,215,0,18
jMpXhLeiPsE,Lotto Powerball Imagine - Armoured Truck,,Lotto New Zealand,20,2018-02-25 00:00:00,2018-02-16 19:02:13,89049,157,5,33,0,26
VTVQUw1SJ2U,Weitsprung: Alyn Camara im T-Rex Kostüm | Teil 2 | Beginner gegen Gewinner | ProSieben,,Circus HalliGalli,24,2018-02-25 00:00:00,2018-02-15 15:00:04,220428,1549,154,189,0,18
YBpdL9hSac4,Incredibles 2 - Olympics Sneak Peek,,Disney•Pixar,1,2018-02-25 00:00:00,2018-02-15 03:34:44,34269048,440650,19239,48269,0,17
t50M1CM7E8s,Ew! HAIRY Hotdogs & EVERY food you can get at Shanghai Disneyland | China Vlog Tour,,Feast Of Fiction,26,2018-02-25 00:00:00,2018-02-16 23:00:06,127987,2170,280,409,0,13
QDSEpjjavhY,TURNING A CAR INTO A COMPUTER MOUSE,,Simone Giertz,28,2018-02-25 00:00:00,2018-02-16 14:00:03,275276,8788,288,748,0,18
T2LAd43JoP4,Why Black Panther’s box office success matters,,Vox,25,2018-02-25 00:00:00,2018-02-16 12:58:49,667005,15954,8846,5607,0,18
xLtYmhj-0Kg,Official Cobra Kai Teaser Trailer - The Karate Kid saga continues,,Cobra Kai,24,2018-02-25 00:00:00,2018-02-15 17:00:01,4266983,30762,3152,4534,0,4
m4-sL1r9i1I,Demi Lovato - Tell Me You Love Me (Acoustic),,DemiLovatoVEVO,10,2018-02-25 00:00:00,2018-02-16 05:00:03,1581379,109453,991,3772,0,16
jziRzx_rejw,"Meet Nathan Chen, the Figure Skater Who Brought Athleticism to Artistry | NYT - Winter Olympics",,The New York Times,25,2018-02-25 00:00:00,2018-02-16 01:00:05,951271,8067,677,739,0,18
xLvkFer6aOY,THOR RAGNAROK Short Film - Grandmaster Moves To Earth (2017) Jeff Goldblum Movie HD,,Comicbook.com,1,2018-02-25 00:00:00,2018-02-16 17:30:15,546200,11337,121,625,0,17
scI7dYdlzuY,Paterno (2018) Official Trailer ft. Al Pacino | HBO,,HBO,1,2018-02-26 00:00:00,2018-02-23 18:59:20,467669,3140,358,831,0,17
xfi2eRAokc8,How Nail Polish is Made and Tested,,INSIDER,19,2018-02-26 00:00:00,2018-02-23 20:00:04,445119,6832,214,484,0,18
ZQcaYYHqrUY,Parkland Shooting Survivors School Congress on Gun Violence: The Daily Show,,The Daily Show with Trevor Noah,23,2018-02-26 00:00:00,2018-02-21 04:30:00,1478788,41635,3736,7180,0,3
07JQ4WZJIbg,Marvel's VENOM (2018) - Full Trailer | Tom Hardy Movie (HD) Concept,,BillyCrammer,1,2018-02-26 00:00:00,2018-02-21 16:19:27,89872,431,90,93,0,17
uu99R0zAUEw,"Roman Reigns vs. Seth Rollins - Seven-Man Gauntlet Match Part 1: Raw, Feb. 19, 2018",,WWE,17,2018-02-26 00:00:00,2018-02-20 02:21:38,1696151,28043,1355,2580,0,19
f2MZnJlDJ4c,Kevin Hart Leads 2018 NBA All-Star Game Introductions | Team LeBron & Team Stephen,,NBA,17,2018-02-26 00:00:00,2018-02-19 01:46:21,2684509,23689,1798,2662,0,26
DSG-zxGRkJw,The European City Centre With No Street Names,,Tom Scott,27,2018-02-26 00:00:00,2018-02-19 16:00:04,334148,13772,140,901,0,19
QRq0pkr2TWM,Cheap Thrills - Sia / Tina Boo Choreography,,1MILLION Dance Studio,24,2018-02-26 00:00:00,2018-02-19 12:00:02,627933,28580,340,444,0,4
cik0lYDZa7c,LeBron James Dunks Reverse Alley Oop From Russell Westbrook! 2018 NBA All Star Game!,,Smequle,17,2018-02-26 00:00:00,2018-02-19 02:28:51,24186,124,7,20,0,26
xYtsL9znopI,Khalid & Normani - Love Lies (Official Video),,KhalidVEVO,10,2018-02-26 00:00:00,2018-02-16 14:00:09,6010383,242098,4514,11671,0,15
_0ovuLsnU1A,Descendants 3 Official Teaser 💚💜,,Disney Descendants,24,2018-02-26 00:00:00,2018-02-17 01:53:02,2507969,40658,4659,9763,0,17
AMiXme4bMUk,Peristaltic Pump || DIY or Buy,,GreatScott!,28,2018-02-26 00:00:00,2018-02-18 16:02:40,150908,7092,127,924,0,13
VwAnsAUYnw4,"Jay Rock, Kendrick Lamar, Future, James Blake - King's Dead",,JayRockVEVO,10,2018-02-26 00:00:00,2018-02-15 20:00:02,13882785,380406,13872,26945,0,16
j8rtMlDTJes,Allison Janney Demonstrates Meryl Streep's Secret Kissing Technique | The Graham Norton Show,,The Graham Norton Show,24,2018-02-26 00:00:00,2018-02-16 17:25:14,1042283,9260,195,583,0,17
cFeDbPWPyJM,"Elimination Chamber Kickoff: Feb. 25, 2018",,WWE,17,2018-02-27 00:00:00,2018-02-26 01:08:05,1734377,30367,1928,0,0,19
-WRcZ9xHMuE,Samsung Galaxy S9 hands-on,,The Verge,28,2018-02-27 00:00:00,2018-02-25 17:00:01,1241197,11315,842,2504,0,17
Z-0bYA5iZDo,The Voice 2018 Blind Audition - Kyla Jade: “See Saw”,,The Voice,24,2018-02-27 00:00:00,2018-02-25 15:00:00,506264,6006,218,600,0,18
NUMa0QkPzns,It’s not you. Phones are designed to be addicting.,,Vox,25,2018-02-27 00:00:00,2018-02-23 13:00:03,668826,40435,572,2146,0,18
KwBpwe-LqTc,A Reality Show 'Stole' A Crappy Scene From Constance Zimmer's 'UnREAL',,The Late Show with Stephen Colbert,24,2018-02-27 00:00:00,2018-02-23 08:35:00,252785,1684,293,290,0,23
133w0dT64A0,Jimmy Fallon Does Special Five-Minute Homemade Tonight Show on Cardboard Set,,The Tonight Show Starring Jimmy Fallon,23,2018-02-27 00:00:00,2018-02-23 05:48:03,176811,3640,154,200,0,8
GABCneYEE84,Honest Trailers - Justice League,,Screen Junkies,1,2018-02-27 00:00:00,2018-02-20 18:00:02,2693629,70629,2403,10757,0,17
BFWI0GQZA14,Rubber Wrecking Ball in 4k,,The Slow Mo Guys,22,2018-02-27 00:00:00,2018-02-20 17:00:03,1628628,44765,2565,2697,0,20
r4qSDOHeWjk,Binging With Babish Cooks In-N-Out and Shake Shack Clones | The Burger Show,,First We Feast,26,2018-02-27 00:00:00,2018-02-20 16:00:06,887547,26592,505,1910,0,13
fZwwcwfbmdo,Florida school shooting suspect appears in court,,CBS News,25,2018-02-27 00:00:00,2018-02-19 19:32:00,1349950,5601,1180,10265,0,18
qDDNcyOhqCI,Black Panther: 5th Largest Opening of All-Time - Movie Talk,,ColliderVideos,24,2018-02-27 00:00:00,2018-02-20 20:25:53,84173,2424,147,683,0,17
CW70dL5430c,3D Printed Nitro Engine Plastic Connecting Rod,,JohnnyQ90,28,2018-02-27 00:00:00,2018-02-20 21:57:53,111950,2268,103,268,0,13
Ga7thDlGbs8,President Trump on bump stocks (C-SPAN),,C-SPAN,25,2018-02-27 00:00:00,2018-02-20 21:38:24,41253,356,671,1349,0,18
CP6aYDssDSE,Eating BRUNCH at Taiwan 7-ELEVEN,,Strictly Dumpling,19,2018-02-27 00:00:00,2018-02-18 16:00:01,2093619,38187,1960,5490,0,13
w4C4aSHUtE0,KUWTK | Kourtney Kardashian Accidentally Snapchats From Friend's Phone! | E!,,E! Entertainment,24,2018-02-27 00:00:00,2018-02-19 06:00:03,1095505,7011,603,399,0,16
Hndpk6A4VcE,Is America Ready For A Gay President? | Hannah Hart,,MyHarto,23,2018-02-27 00:00:00,2018-02-19 21:36:06,90730,5983,2358,1855,0,3
r87aoVq4gZg,The C37 – 2018 Alfa Romeo Sauber F1 Team Launch,,Sauber F1 Team,17,2018-02-27 00:00:00,2018-02-20 11:31:07,184390,1840,30,132,0,18
Q6vfaPuftmE,Donald Trump Jr. Says India's Poorest Have Something Special | NBC News,,NBC News,25,2018-02-27 00:00:00,2018-02-20 16:55:34,34284,144,212,278,0,18
JDkHmQEOkYo,T & P Makeup Look,,Sailor J,23,2018-02-27 00:00:00,2018-02-19 01:31:01,348104,23899,486,1749,0,23
Oyq8Di01nN8,Can Sound Exist In a Vacuum Chamber?,,The King of Random,27,2018-02-27 00:00:00,2018-02-18 15:00:02,1133408,17097,1750,3286,0,13
pi2Ri9-K3_E,5 Reasons to Buy a $188 Laptop,,Austin Evans,28,2018-02-27 00:00:00,2018-02-18 15:20:53,720795,17477,1292,3454,0,18
dAfqL3Hts_U,How Much Will Black Panther Boost Avengers Infinity War Box Office,,John Campea,24,2018-02-27 00:00:00,2018-02-19 16:48:05,36457,1170,61,560,0,17
PLtyqLPx_8M,Top 5 most stunning moments in Olympic Short Track Speed Skating  | Highlights Listicles,,Olympic,17,2018-02-27 00:00:00,2018-02-18 22:00:01,97945,372,58,83,0,18
sScTRKljFUs,360° view of Renault R.S.18,,Renault Sport,2,2018-02-27 00:00:00,2018-02-20 14:55:27,58519,381,4,51,0,18
XUqRem0W8L8,Drake - God's Plan (Official Music Video),,OVO Sound,10,2018-02-27 00:00:00,2018-02-16 16:03:41,19586636,809476,18295,66540,0,8
ikZQLvKZYMA,How to use DeWalt Batteries on Ryobi Tools for $30 | Building a DeWalt to Ryobi Adapter - 42Fab #16,,42Fab - Metalworking and Multi-Medium Fabrication,26,2018-02-27 00:00:00,2018-02-18 17:17:43,59285,602,88,139,0,13
SNHc2PxY8lY,Black Panther's Director Ryan Coogler Breaks Down a Fight Scene | Notes on a Scene | Vanity Fair,,Vanity Fair,24,2018-02-27 00:00:00,2018-02-17 17:00:21,602853,27880,226,1551,0,17
sRbhD2unwBc,Rochdale vs. Tottenham Hotspur | 2017-18 FA Cup Highlights,,FOX Soccer,17,2018-02-27 00:00:00,2018-02-18 19:02:53,55614,470,43,87,0,26
I8Umj580ls0,Trump Claims He Would Have 'Run' Into The School,,The Late Show with Stephen Colbert,24,2018-02-28 00:00:00,2018-02-27 08:35:01,2311760,34425,6094,9453,0,23
yzJtC835sio,Google Translate Songs with Kelly Clarkson,,The Tonight Show Starring Jimmy Fallon,23,2018-02-28 00:00:00,2018-02-27 11:00:05,342260,7319,197,357,0,8
5YMtjjAzxWA,"Top 5 Plays of the Night: February 25, 2018",,NBA,17,2018-02-28 00:00:00,2018-02-26 06:15:41,276711,3297,132,196,0,26
Ob48twC1yf8,Parkland Shooting Survivors on the 'March for Our Lives',,TheEllenShow,24,2018-02-28 00:00:00,2018-02-23 14:01:11,1159873,28883,10433,0,0,0
9-2FS7XpTh4,Jimmy Butler sustains apparent non-contact injury | ESPN,,ESPN,17,2018-02-28 00:00:00,2018-02-24 03:01:18,107907,359,72,292,0,26
QNNcl2mEHzQ,The Outsider | Official Trailer [HD] | Netflix,,Netflix,24,2018-02-28 00:00:00,2018-02-22 14:30:05,872261,13850,856,1948,0,17
A9YcrloL3oE,Jack,,Unbox Therapy,1,2018-02-28 00:00:00,2018-02-21 22:29:33,3611833,277570,8522,37011,0,18
ByeyFfOHgQA,Film Theory: Black Panther's Economic CRISIS!,,The Film Theorists,1,2018-02-28 00:00:00,2018-02-20 20:06:48,2579421,91743,9507,20462,0,17
-HoAafTYR9w,Trump meets with students following Florida shooting,,Washington Post,25,2018-02-28 00:00:00,2018-02-21 22:41:17,50669,411,157,503,0,18
MYdqaxZndzE,Kendrick Lamar wins International Male Solo Artist | The BRIT Awards 2018,,BRITs,10,2018-02-28 00:00:00,2018-02-22 00:30:51,167110,2883,90,203,0,4
g_WBVi-bu9Q,The Ring brought to life in AR,,Abhishek Singh,28,2018-02-28 00:00:00,2018-02-21 17:06:16,318557,586,71,75,0,17
V5cOvyDpWfM,Fergie Performs The U.S. National Anthem / 2018 NBA All-Star Game,,MLG Highlights,17,2018-02-28 00:00:00,2018-02-19 01:37:11,21005589,59281,176903,65181,0,26
zuMkDVbThVw,Will Netflix Help or Hurt Natalie Portman's Annihilation? - SJU,,ScreenJunkies News,24,2018-02-28 00:00:00,2018-02-21 20:20:20,52513,1278,56,432,0,17
OpsHLG657lM,Fergie says her version of the national anthem 'didn't strike intended tone',,ABC News,25,2018-02-28 00:00:00,2018-02-20 02:31:18,689798,3377,1341,2044,0,18
1kEoS9WwpmA,Benedict Cumberbatch Performs I'm a Little Teapot // Omaze,,Omaze,24,2018-02-28 00:00:00,2018-02-20 15:01:28,414854,16969,205,1041,0,17
SJNdBNxNGno,ALL MY AQUARIUMS - LIVE WITH MY WIFE!!!,,The king of DIY,15,2018-02-28 00:00:00,2018-02-20 22:02:02,181521,6742,179,771,0,13
2B1sY4NecnI,Christian Evangelist Billy Graham Dies At 99 | Morning Joe | MSNBC,,MSNBC,25,2018-02-28 00:00:00,2018-02-21 14:12:19,102834,873,276,1569,0,18
Ecd4eA067P0,Star Wars: The Last Jedi In-Home Trailer (Official),,Star Wars,24,2018-02-28 00:00:00,2018-02-20 14:00:00,617155,19872,2712,3844,0,17
JQkjAhmvITI,"Making a Custom GLOWING iPhone Logo - in Shenzhen, China",,Strange Parts,28,2018-02-28 00:00:00,2018-02-20 15:28:32,335194,25007,250,2072,0,18
oWdLorlbhfU,Tia's Goodbye- Bachelor,,Bachelor Nation on ABC,24,2018-02-28 00:00:00,2018-02-20 06:00:01,118151,257,400,343,0,22
X2BfTXIwABo,MARVEL COMICS 2018: A Fresh Start,,Marvel Entertainment,2,2018-02-28 00:00:00,2018-02-20 15:00:05,400237,9618,732,2447,0,17
_s1M-rkDO8Q,Legion | Season 2: All In Your Head Preview | FX,,FX Networks,24,2018-02-28 00:00:00,2018-02-20 18:40:03,61665,1216,38,113,0,3
YbQ-NgaCntk,Kathy Bates Slides Into “That’s What I Like” by Bruno Mars | Lip Sync Battle Preview,,Lip Sync Battle,24,2018-02-28 00:00:00,2018-02-19 15:00:18,313852,3530,127,200,0,4
Ps7GzIV2KP0,Which Animal Is The Smartest?,,Life Noggin,27,2018-02-28 00:00:00,2018-02-19 14:00:01,536398,14139,599,3092,0,18
DmTcVy7Ng-g,TAKING A CAREER APTITUDE TEST NOW THAT WE'RE FULL-TIME VLOGGERS,,DamonAndJo,23,2018-02-28 00:00:00,2018-02-20 18:26:48,79591,5147,115,402,0,13
JeRtUXTQ_aQ,James Bay - Wild Love,,JamesBayVEVO,10,2018-02-28 00:00:00,2018-02-19 13:30:01,1680396,47507,1434,2289,0,16
T3hXC5yNZOc,Iggy Azalea - Savior ft. Quavo,,iggyazaleamusicVEVO,10,2018-03-01 00:00:00,2018-03-01 05:00:01,285984,34129,1625,4219,0,16
Rzuts_VwAL4,Joan Smalls Performs Luis Fonsi’s “Despacito” | Lip Sync Battle Preview,,Lip Sync Battle,24,2018-03-01 00:00:00,2018-02-28 15:00:51,47147,542,113,62,0,4
r8vFZ0HAaz0,This New Smartphone Is NOT What It Looks Like...,,Unbox Therapy,28,2018-03-01 00:00:00,2018-02-27 23:02:01,1912972,61649,2513,5858,0,18
1eKa8ju_b2A,Guess Who: #MeToo Edition,,Funny Or Die,23,2018-03-01 00:00:00,2018-02-27 15:00:01,130817,3464,2442,973,0,3
Nr42pNrK5iU,"Sean Evans, Matty Matheson, and Miss Info Judge a Stunt Burger Showdown | The Burger Show",,First We Feast,26,2018-03-01 00:00:00,2018-02-27 16:00:03,330477,9661,221,885,0,13
AFC5RaH4xMg,Top 10 NBA Celebrity Reactions - The Starters,,NBA,17,2018-03-01 00:00:00,2018-02-28 00:58:13,455015,7556,136,252,0,26
hsYCNQ9DA-w,The Surprising Stories of Sesame Street - Mental Floss Scatterbrained,,Mental Floss,27,2018-03-01 00:00:00,2018-02-28 16:00:03,21107,861,30,130,0,18
BQ31l1gPGKM,J. Balvin - Ahora,,jbalvinVEVO,10,2018-03-01 00:00:00,2018-02-26 05:00:01,19177871,356298,12457,19735,0,4
aLiZSrsNfK4,Kathie Lee And Hoda Audition For ‘The Voice’ And Nail It Sort Of | TODAY,,TODAY,25,2018-03-01 00:00:00,2018-02-26 18:45:07,194902,2007,275,226,0,18
vc0fb3xhFHY,The Week Of | Official Trailer [HD] | Netflix,,Netflix,24,2018-03-01 00:00:00,2018-02-27 15:00:06,67954,780,169,118,0,17
yZC5DH7VScY,"Anthony Davis 53 Pts, 17 Rebs, 5 Blks! 2018.02.26 New Orleans Pelicans vs Phoenix Suns | FreeDawkins",,FreeDawkins,17,2018-03-01 00:00:00,2018-02-27 03:41:25,96399,1363,31,612,0,26
0mAS2Gxs08w,First Take reacts to Zaza Pachulia falling on Russell Westbrook | First Take | ESPN,,ESPN,17,2018-03-01 00:00:00,2018-02-26 15:37:37,1034272,9606,512,4254,0,26
J83sZrz9XTc,Samsung Galaxy S9 Impressions!,,Marques Brownlee,28,2018-03-01 00:00:00,2018-02-25 17:00:39,3103982,105649,2466,14643,0,17
Vm4Xn5vjqRA,"CRISTIANO RONALDO E FRED, O GRANDE ENCONTRO",,Desimpedidos,17,2018-03-01 00:00:00,2018-02-25 21:59:30,5938439,1121217,4360,83660,0,18
sLFaa6RPJIU,Making YBCO superconductor,,Applied Science,28,2018-03-01 00:00:00,2018-02-26 07:24:14,64566,4442,27,282,0,13
EUPlbO3Ub2I,Is Tokyo Fried Chicken The Best In The World?,,BuzzFeedVideo,22,2018-03-01 00:00:00,2018-02-24 16:00:14,1339289,29265,4954,2824,0,3
-KB5QbOS4s4,Lupita Nyong'o - Why Black Panther Is a Different Kind of Superhero Movie: The Daily Show,,The Daily Show with Trevor Noah,23,2018-03-01 00:00:00,2018-02-24 15:00:00,1029141,26448,990,3284,0,3
Srl96IoeWJs,Preview of the Peopoly Moai SLA Resin 3D Printer at Matterhackers,,3D Printing Nerd,28,2018-03-01 00:00:00,2018-02-25 14:00:03,64107,1617,100,365,0,13
JpvC3j9Qxus,Mo'Nique Speaks On Racial And Gender Inequality In Hollywood + More,,Breakfast Club Power 105.1 FM,24,2018-03-01 00:00:00,2018-02-23 13:19:56,2723593,39403,11924,58763,0,8
AP14dJZzKkA,Woman Tries to Get a Free Ride,,Ryan Is Driving,24,2018-03-01 00:00:00,2018-02-22 21:10:45,3845553,133530,3363,20114,0,13
d3PMBPw74cc,Tamar Braxton Clears Up Rumors About Her Marriage | The View,,The View,24,2018-03-01 00:00:00,2018-02-23 16:13:43,711676,4667,1376,1845,0,13
Kz7R1i2zFpk,Oprah Winfrey on Running for President & Trump,,Jimmy Kimmel Live,24,2018-03-01 00:00:00,2018-02-23 10:00:02,1129249,11614,5010,4159,0,3
LbW-bMToXqo,Kylie Minogue - Dancing (Live Ant & Dec's Saturday Night Takeaway) HD,,rock on,10,2018-03-01 00:00:00,2018-02-24 20:00:39,147383,2678,155,257,0,4
-nbm90xAhWY,*SPOILER* 5th Eliminated Queen RuPaul's All Stars 3: Behind the Scenes,,WOWPresents,24,2018-03-01 00:00:00,2018-02-23 13:00:00,249572,7944,301,1431,0,4
tGRzz0oqgUE,Janelle Monáe – Make Me Feel [Official Music Video],,Janelle Monáe,10,2018-03-01 00:00:00,2018-02-22 17:00:06,4121390,105303,7323,8359,0,17
OTLw9G1WpC4,THE TRIXIE & KATYA SHOW - Introducing Bob,,VICELAND,24,2018-03-01 00:00:00,2018-02-23 15:01:55,25512,474,64,96,0,17
aDl6SGTkomk,Strobe Guitar Solo by Sparkee,,Sparkee Music,10,2018-03-01 00:00:00,2018-02-23 19:53:49,121390,1685,161,197,0,4
UaAHl_m_ybk,5 Seconds Of Summer - Want You Back (Audio),,5SOSVEVO,10,2018-03-01 00:00:00,2018-02-23 00:00:01,3738646,262753,2490,31844,0,16
ZO4CMPCmFDE,I Followed My Dad Around With a Confetti Cannon.... // Tank Top Moy,,Kylie Moy,24,2018-03-01 00:00:00,2018-02-22 00:50:24,1642462,41986,1357,3079,0,3
cytyAgu9-bA,DEADMAU5 said this Bassline is IMPOSSIBLE...,,Davie504,24,2018-03-01 00:00:00,2018-02-22 15:00:03,3052072,132775,1111,9571,0,4
RWzZeA2GMsk,Bishop Briggs - White Flag (Audio),,BishopBriggsVEVO,10,2018-03-01 00:00:00,2018-02-23 05:00:01,175842,10411,133,505,0,16
eqVHah0f-1c,"Margot Robbie HEART RATE MONITOR ft. Cara Delevingne, Alexander Skarsgård & Bullet For My Valentine",,BBC Radio 1,24,2018-03-01 00:00:00,2018-02-22 14:59:04,898717,21788,311,718,0,4
foImxGyOuQE,"On Set, Greta Gerwig Has a Snack Combo Named After Her",,The Late Late Show with James Corden,24,2018-03-01 00:00:00,2018-02-23 09:35:00,89365,967,80,80,0,23
-C_rvt0SwLE,Imagine Dragons - Next To Me (Audio),,ImagineDragonsVEVO,10,2018-03-01 00:00:00,2018-02-21 17:00:00,11773962,397715,6677,20481,0,16
dvJWgErHi7A,NASHVILLE on CMT | Final Episodes Coming June 7,,CMT,24,2018-03-01 00:00:00,2018-02-23 03:03:01,79205,133,60,41,0,4
mdaElUyT1Zo,Bird Lands On News Anchor's Head (News Blooper),,NewsFunnies,23,2018-03-01 00:00:00,2018-02-24 00:28:27,8659,72,4,8,0,3
N54fzGwMybk,SCREW DRIVE RC TANK #6 IT WORKS!!!,,Ivan Miranda,28,2018-03-01 00:00:00,2018-02-23 21:00:02,56032,2883,34,697,0,26
-QR-TB_k20M,Jesus Christ Superstar Live - John Legend Rehearses (Promo),,NBC,24,2018-03-01 00:00:00,2018-02-23 23:54:39,23877,93,30,20,0,3
e-XM8pek6Kg,Ricky Martin - Fiebre (Audio),,RickyMartinVEVO,10,2018-03-01 00:00:00,2018-02-23 05:00:00,514150,14269,488,817,0,4
T9KTTP7jrBo,Kesha - We R Who We R (Live from Honda Stage at Hollywood Palladium),,keshaVEVO,10,2018-03-01 00:00:00,2018-02-22 08:00:00,152796,8154,392,612,0,16
Su9Mns6fWV8,If The Walking Dead Theme Had Lyrics (Parody),,The Warp Zone,23,2018-03-01 00:00:00,2018-02-22 18:00:02,89799,4742,91,366,0,3
G2JLc63P7pw,SNEAK PEEK: 2018 Mercedes F1 Livery Revealed!,,Mercedes-AMG Petronas Motorsport,17,2018-03-01 00:00:00,2018-02-22 09:35:04,194964,2062,155,221,0,18
dg2ROPhbHg4,SpaceX Launches Falcon 9 To Deliver Satellites | CNBC,,CNBC,25,2018-03-01 00:00:00,2018-02-22 16:02:30,20631,150,36,116,0,18
X8XHLakfV5U,The Early Animated Films,,The Royal Ocean Film Society,1,2018-03-01 00:00:00,2018-02-22 17:57:39,25961,2180,26,120,0,17
expKmfdoo28,Chadwick Boseman Surprises Black Panther Fans While They Thank Him,,The Tonight Show Starring Jimmy Fallon,23,2018-03-02 00:00:00,2018-03-01 04:46:38,688306,27672,701,2386,0,8
6VJYkH1WfKc,All the best reactions to James Harden's nasty cross of Wesley Johnson | SportsCenter | ESPN,,ESPN,17,2018-03-02 00:00:00,2018-03-01 07:26:37,390622,3322,367,755,0,26
gx3S73InQ04,"James Harden's NASTY Crossover Caps Off His Monster 1st Quarter | February 28, 2018",,NBA,17,2018-03-02 00:00:00,2018-03-01 05:00:41,376877,4524,163,833,0,26
ZzefeQ0v5wg,Samsung Galaxy S9 Camera: What's New!,,Marques Brownlee,28,2018-03-02 00:00:00,2018-02-28 22:27:59,1072782,40791,984,3821,0,17
ZzO8VAOJs4U,Kiefer Sutherland's Mom Has An Impersonation Of Stephen,,The Late Show with Stephen Colbert,24,2018-03-02 00:00:00,2018-02-28 08:35:00,345372,2893,122,410,0,23
YskVs5VyqHk,Splitting Bullets in 4K,,The Slow Mo Guys,22,2018-03-02 00:00:00,2018-02-27 17:00:06,2956442,94910,1284,4317,0,20
MHEYapANYk4,Even the 'Scandal' Cast Doesn't Know How the Show Will End,,TheEllenShow,24,2018-03-02 00:00:00,2018-02-28 14:00:31,315148,3798,93,167,0,0
zDbq7y20wpw,Why ships used this camouflage in World War I,,Vox,25,2018-03-02 00:00:00,2018-02-27 13:00:09,640405,19874,275,814,0,18
Vn-l53PbEIQ,President Donald Trump Honors Billy Graham As Body Lies In State At U.S. Capitol | NBC News,,NBC News,25,2018-03-02 00:00:00,2018-02-28 17:22:47,24332,320,71,0,0,18
IhhemrLxeeM,Envelope containing unknown substance opened at Joint Base Myer: Marine official,,ABC News,25,2018-03-02 00:00:00,2018-02-28 02:07:40,21180,191,25,157,0,18
AIrxDop0GCQ,8 Potters Who are Shaping the Pottery Game,,INSIDER,19,2018-03-02 00:00:00,2018-02-25 14:00:01,356075,5627,184,361,0,13
OgcqNuWfFFA,Goodbye Beme,,Jake Roper,22,2018-03-02 00:00:00,2018-02-18 19:46:03,207648,7048,265,521,0,18
Mmn0zFalrD4,Punching Huge Holes Through Everything with Hydraulic Press | in 4K!,,Hydraulic Press Channel,28,2018-03-02 00:00:00,2018-02-17 14:52:06,345371,6015,325,988,0,20
h_cfN1t3flE,Hmmm...Too Faced Life's a Festival Collection Review | Jackie Aina,,Jackie Aina,26,2018-03-02 00:00:00,2018-02-16 23:32:15,839813,48283,1145,3746,0,13
BJDGBNFxO7o,We Lost Him... | Will Smith Vlogs,,Will Smith,24,2018-03-02 00:00:00,2018-02-16 17:00:01,847523,44077,650,3951,0,13
Nl0iGMkxwcc,The Sibling Rivalry Behind Adidas Versus Puma,,Great Big Story,22,2018-03-02 00:00:00,2018-02-20 20:21:13,186912,5463,84,321,0,18
hN8mNXa3ICo,Homemade Vs. Store-Bought: Doughnuts,,Tasty,26,2018-03-02 00:00:00,2018-02-16 17:00:34,1220106,27221,684,1202,0,13
kl_jxVID3PE,Kali Uchis After The Storm Official Lyrics & Meaning | Verified,,Genius,10,2018-03-02 00:00:00,2018-02-16 18:22:38,369260,26493,110,1179,0,4
PdWe5ULGy_s,Singing Whisper Challenge with Alicia Keys,,The Tonight Show Starring Jimmy Fallon,23,2018-03-03 00:00:00,2018-03-02 05:10:46,312740,6155,131,341,0,8
