Id,Label,timeset,channel_title,category_id,trending_date,publish_time,views,likes,dislikes,comment_count,componentnumber,modularity_class
AumaWl0TNBo,How My Relationship Started!,,PointlessBlogVlogs,24,2017-11-14 00:00:00,2017-11-11 17:00:00,1182775,52708,1431,2333,0,13
-N5eucPMTTc,CHRISTMAS HAS GONE TO MY HEAD,,MoreZoella,22,2017-11-14 00:00:00,2017-11-10 19:19:43,1164201,57309,749,624,0,13
fiusxyygqGk,Marshmello - You & Me (Official Music Video),,marshmello,10,2017-11-14 00:00:00,2017-11-10 15:00:03,3407008,207262,3167,13279,0,13
sLJdBmAeB_U,COME SHOPPING WITH ME AND TRY ON NEW CLOTHING FOR AUTUMN | VLOG 49,,Inthefrow,26,2017-11-14 00:00:00,2017-11-07 19:00:50,87772,2617,86,192,0,13
mCx26FLXWuI,"Seth Rollins & Dean Ambrose vs. Cesaro & Sheamus - Raw Tag Team Title Match: Raw, Nov. 6, 2017",,WWE,17,2017-11-14 00:00:00,2017-11-07 04:52:25,1689382,24186,3330,3414,0,19
iDXlWTRyxgE,"Gun Violence Makes Us Feel Powerless, But We're Not",,The Late Show with Stephen Colbert,24,2017-11-14 00:00:00,2017-11-07 04:58:21,1189325,21859,7016,11869,0,23
FmYMq9EHhdE,HER FIRST STEPS! INDIE THE EWOK & THE BEST FACIAL | VLOG,,SamanthaMariaVlogs,26,2017-11-14 00:00:00,2017-11-07 17:00:01,192138,6909,158,523,0,13
hIwRdDcQBEU,My Coat Collection | Amelia Liana,,Amelia Liana,26,2017-11-14 00:00:00,2017-11-06 16:33:36,51301,1654,87,166,0,13
tSjvx_c4meE,I'M BACK! 31 DAYS OFFLINE | Lily Pebbles,,Lily Pebbles,26,2017-11-14 00:00:00,2017-11-05 09:30:00,165847,6850,378,836,0,13
CCPX4EYrskw,It's a Family Affair! | MUMDAYS,,Giovannasworld,24,2017-11-14 00:00:00,2017-11-06 09:00:02,52250,1550,26,40,0,0
IVRVXYCrr14,THE SWEATIEST I'VE EVER BEEN!,,Estée Lalonde,22,2017-11-14 00:00:00,2017-11-05 18:00:01,95090,3776,91,320,0,13
1eS_17CG9sk,ADULTING QUIZ (with Daniel J Layton),,Hazel Hayes,22,2017-11-14 00:00:00,2017-11-05 12:03:04,64691,5540,42,954,0,17
NWdc7PyZNLA,Guest Host Jennifer Lawrence Interviews Kim Kardashian West,,Jimmy Kimmel Live,23,2017-11-14 00:00:00,2017-11-03 09:00:01,12924004,190116,16758,11083,0,3
BsjQqm60ZEI,Dance Battle with the Stranger Things Kids,,The Tonight Show Starring Jimmy Fallon,23,2017-11-14 00:00:00,2017-11-03 04:19:01,4210732,129667,856,4299,0,8
kqbJCW-jxYM,"Lil Kim Keeps It Real On Nicki Minaj, Biggie Relationship, Female MC's & New Music",,HOT 97,10,2017-11-14 00:00:00,2017-11-03 13:48:20,407075,5819,598,2815,0,4
uT3wso5Zp7k,Sexy Darth Vader | Lex Croucher,,Lex Croucher,23,2017-11-14 00:00:00,2017-11-04 10:00:03,20387,1322,68,68,0,17
676hNIhKO2M,Madison Beer - Say It To My Face (Official Audio),,MadisonBeerMusicVEVO,10,2017-11-14 00:00:00,2017-11-03 13:59:25,1053402,47309,1408,2407,0,16
MnK9_fWPT3Y,Tee Grizzley Win (WSHH Exclusive - Official Music Video),,WORLDSTARHIPHOP,10,2017-11-14 00:00:00,2017-11-02 19:33:54,2030890,45008,910,3533,0,4
Tl_Qfj8780M,Milck - Quiet [Official Video],,MILCK,10,2017-11-14 00:00:00,2017-11-03 13:01:57,213094,2951,339,193,0,4
7DLKv39MLbg,YOU DOUBT ME // Grace Helbig,,Grace Helbig,22,2017-11-14 00:00:00,2017-11-03 14:56:32,163048,8921,193,809,0,3
OXZQ5DfSAAc,"I, Tonya Trailer #1 (2017) | Movieclips Trailers",,Movieclips Trailers,1,2017-11-14 00:00:00,2017-11-01 16:40:51,750287,8010,149,320,0,26
Bu2Djx2ejlA,The Making of a Song – “Gorgeous”,,AT&T,10,2017-11-14 00:00:00,2017-11-01 15:01:19,1961295,61000,1281,0,0,3
-XjayddbksQ,Wendy Williams Faints On Live TV,,Pop Blast,24,2017-11-14 00:00:00,2017-10-31 15:59:58,3534066,17362,2322,9793,0,0
xq9FgX_mXiE,Drop the Mic: Rob Gronkowski vs Gina Rodriguez - FULL BATTLE | TBS,,TBS,24,2017-11-14 00:00:00,2017-11-01 05:59:58,671425,8050,125,405,0,4
8gFGhT5GpAs,"WWE fan interrupts Paul Heyman and Brock Lesnar to propose to his girlfriend: Raw, Nov. 13, 2017",,WWE,17,2017-11-15 00:00:00,2017-11-14 03:16:51,1086201,24341,546,1693,0,19
6p-QzY5bxJ0,The 'Stranger Things' Kids Were Nearly a Motown Super Group,,The Late Late Show with James Corden,24,2017-11-15 00:00:00,2017-11-09 06:45:55,5905916,274103,1573,11193,0,23
vht9VHo8r5c,Ellen in Adam Levine’s Ear,,TheEllenShow,24,2017-11-15 00:00:00,2017-11-07 18:30:55,1153057,26074,479,942,0,0
dgW5kpeSB1A,Jhené Aiko: While We're Young,,Late Night with Seth Meyers,23,2017-11-15 00:00:00,2017-11-07 12:00:02,29724,806,30,66,0,3
zN_DJ3c2N28,Hank Reviews Everything,,vlogbrothers,22,2017-11-15 00:00:00,2017-11-02 19:04:57,259931,14846,251,938,0,18
Plh2sfrbdlc,HALLOWEEN AFTERMATH AND Q&A 👻🎃,,SUPERFRUIT,24,2017-11-15 00:00:00,2017-11-03 16:16:41,205177,14099,95,1125,0,4
tpyQLIpv4Yk,POP SONGS TURNED OPERA,,PsychoSoprano,23,2017-11-15 00:00:00,2017-11-03 17:47:48,436114,49129,411,5652,0,3
twjTkBN3Q9A,Gabrielle Union Impersonates DMX While Eating Spicy Wings | Hot Ones,,First We Feast,26,2017-11-15 00:00:00,2017-11-02 15:00:03,1192068,27508,943,4935,0,13
VsRot0p7ObY,The Washing Machine that would not Die,,colinfurze,2,2017-11-15 00:00:00,2017-11-02 16:00:04,1546831,54261,1450,2973,0,17
ZDMgHk2DjoQ,CAKE BOSS COUPLES FACE OFF | Shawn Johnson,,Shawn Johnson East,22,2017-11-15 00:00:00,2017-11-04 15:00:02,134067,3805,118,514,0,13
bCznvAkpwWs,Warner Bros - Justice League B-Roll Footage,,DaLordz Prince,1,2017-11-15 00:00:00,2017-11-03 13:16:47,45036,689,19,0,0,17
om0h_r2TAmw,The SECRET Prestige AREA...! (COD WW2 Headquarters Tour),,Ali-A,20,2017-11-15 00:00:00,2017-11-02 18:00:05,357460,10563,1069,1539,0,26
Q-KsToawMJE,Luke Bryan - Most People Are Good (Audio),,LukeBryanVEVO,10,2017-11-15 00:00:00,2017-11-03 04:00:01,301974,7740,232,468,0,16
jgshHi6XjJ0,"Ric Flair surprises Charlotte to celebrate her championship win: SmackDown LIVE, Nov. 14, 2017",,WWE,17,2017-11-16 00:00:00,2017-11-15 03:29:27,726260,17310,381,1823,0,19
XymR5UCxSfA,ZOE THINKS IT'S CHRISTMAS ALREADY...,,PointlessBlogVlogs,24,2017-11-16 00:00:00,2017-11-13 17:01:46,665951,34806,565,1766,0,13
acIRvVxB4go,DRESSED UP IN ALL DOLCE AND GABBANA | VLOG 51,,Inthefrow,26,2017-11-16 00:00:00,2017-11-14 19:03:11,50614,1596,75,178,0,13
OWvCCu2t6Ts,SO Much To Tell You | 32 Weeks Pregnant | MOTHERHOOD,,Sprinkleofglitter,26,2017-11-16 00:00:00,2017-11-10 16:59:50,255394,10422,272,641,0,0
ZcTZJiBTCXA,러블리즈 (Lovelyz) - 종소리 (Twinkle) MV,,CJENMMUSIC Official,10,2017-11-16 00:00:00,2017-11-14 09:00:02,179186,11836,353,939,0,4
_6ViZ13mN9I,GSP and Tyron Woodley Talk About Their Potential Super Fight | The Hollywood Beatdown,,TMZSports,17,2017-11-16 00:00:00,2017-11-10 21:52:31,102688,692,82,717,0,1
L99Bi097wak,My High-Street Style Favourites | The Anna Edit,,The Anna Edit,26,2017-11-16 00:00:00,2017-11-05 09:33:44,81157,2494,97,120,0,13
b-ufhlIlfmA,Manchester United LIED To Get Alex Ferguson | Martin Edwards Reveals All! | The Warm Down,,Stephen Howson FC,17,2017-11-16 00:00:00,2017-11-06 12:29:37,17227,817,14,153,0,26
kROW5iooUKE,Keeping it in the Family,,Tom Fletcher,24,2017-11-16 00:00:00,2017-11-05 09:00:02,91182,3421,32,143,0,4
jSJr3dXZfcg,World of Warcraft: Battle for Azeroth Cinematic Trailer,,World of Warcraft,20,2017-11-16 00:00:00,2017-11-03 19:10:41,7590874,138279,3461,26438,0,13
CFMRJSPDr2k,Weird How Everyone President Donald Trump Knows Does Crimes - Some News,,Cracked,23,2017-11-16 00:00:00,2017-11-04 15:30:01,369367,15007,1365,2955,0,18
wGxT2tg4It0,This is iPhone X,,iJustine,28,2017-11-16 00:00:00,2017-11-03 19:58:36,1717319,52216,8436,9425,0,18
s2zlBSsumeI,An All-New Take on a Classic Song for Pokémon the Movie: I Choose You!,,The Official Pokémon YouTube Channel,20,2017-11-16 00:00:00,2017-11-03 15:09:41,745860,26520,622,2539,0,26
kNOTqGpcDw0,KANYE WEST COMEBACK AT KID CUDI TOUR 2017,,09W HYPE,22,2017-11-16 00:00:00,2017-11-05 05:34:38,164498,2472,57,410,0,1
V54CEElTF_U,Taylor Swift - Call It What You Want (Lyric Video),,TaylorSwiftVEVO,10,2017-11-16 00:00:00,2017-11-03 04:00:01,21893347,706163,20875,50812,0,4
NLCfRHdi6Ig,"#21 How to go FAST!!! Coaching famous youtuber MIKE BOYD",,Ben Cathro,17,2017-11-16 00:00:00,2017-11-05 20:10:16,16074,689,8,142,0,26
o3CaFMmKA7A,Reacting to Sanders Sides COSPLAY! | Thomas Sanders,,Thomas Sanders,23,2017-11-16 00:00:00,2017-11-04 18:45:35,395808,36053,512,4275,0,3
jDvKFN6aYsE,Kim Possible Theme Song Dance,,MeganBatoon,24,2017-11-16 00:00:00,2017-11-03 20:00:02,474692,19607,1671,955,0,3
M_wZMgZNpaM,Stranger Things' Noah Schnapp Play's RAW's Word Play,,RAW,22,2017-11-16 00:00:00,2017-11-04 00:03:56,405412,18880,216,855,0,17
xxWXD073Ql0,The Questions I've Never Answered | Tanya Burr,,Tanya Burr,26,2017-11-16 00:00:00,2017-11-03 17:30:02,318635,11427,431,248,0,13
TbfxmTQkLAE,"Migos, Nicki Minaj, Cardi B - MotorSport (Audio)",,MigosVEVO,10,2017-11-16 00:00:00,2017-11-01 19:46:47,17957402,238446,10802,13480,0,4
MjdpR-TY6QU,How to Cure Aging – During Your Lifetime?,,Kurzgesagt – In a Nutshell,27,2017-11-16 00:00:00,2017-11-03 13:33:42,2120634,120500,1025,8840,0,13
T8jBIVi6rrM,Terrible Soccer Players | Lele Pons,,Lele Pons,23,2017-11-16 00:00:00,2017-11-03 17:30:00,3781831,110267,8336,6402,0,4
90IJanuV_0M,A Michelin-Starred Meal for $1.50,,Great Big Story,22,2017-11-16 00:00:00,2017-11-03 06:00:01,949695,18316,267,889,0,18
W4CB5SeBGkI,Star Wars: The Last Jedi Awake (:45),,Star Wars,24,2017-11-16 00:00:00,2017-11-02 01:59:40,6044998,87957,2208,8407,0,17
WhLvS5GTK3E,BlizzCon 2017 Opening Ceremony,,Blizzard Entertainment,20,2017-11-16 00:00:00,2017-11-03 20:14:28,694643,9343,654,523,0,13
7JMV6iBlXFo,ZHU - Exhale/Stardust (Music Video),,ZHUVEVO,10,2017-11-16 00:00:00,2017-11-03 09:59:25,445417,11163,347,320,0,4
fMbuWa-OdN8,WWE Superstar Triple H Addresses Conor McGregor and Ronda Rousey Rumours | Good Morning Britain,,Good Morning Britain,17,2017-11-16 00:00:00,2017-11-03 11:02:32,995222,7317,457,0,0,19
PFDElc5sfSM,Steak | Basics with Babish,,Binging with Babish,24,2017-11-16 00:00:00,2017-11-02 18:52:20,1250558,41463,639,2731,0,13
Xc4xYacTu-E,Which Way Is Down?,,Vsauce,24,2017-11-16 00:00:00,2017-11-02 09:30:54,4292852,228735,3421,28899,0,18
MXzEbAv0QN0,ELDERS REACT TO MARSHMELLO,,FBE,24,2017-11-16 00:00:00,2017-11-02 21:00:01,1284910,35976,736,7919,0,17
lYN26wt1lJQ,"Maroon 5, A-Trak - What Lovers Do (A-Trak Remix/Audio) ft. SZA",,Maroon5VEVO,10,2017-11-16 00:00:00,2017-11-03 04:00:02,1091470,24725,593,933,0,16
Hw2e2XS9Wmc,Chris Stapleton - Scarecrow In The Garden (Audio),,ChrisStapletonVEVO,10,2017-11-16 00:00:00,2017-11-03 04:00:00,769047,10512,531,642,0,16
nVzA1uWTydQ,"Selena Gomez, Marshmello - Wolves (Vertical Video)",,SelenaGomezVEVO,10,2017-11-16 00:00:00,2017-11-02 15:27:45,8432344,422697,8366,20291,0,16
-crLmRLgeNE,Don Diablo ft. A R I Z O N A - Take Her Place (Official Lyric Video),,DonDiablo,10,2017-11-16 00:00:00,2017-11-02 16:34:20,1009304,31775,550,960,0,4
kRDb2X3gFmo,5 Days Of Activated Charcoal | Try Living With Lucie | Refinery29,,Refinery29,26,2017-11-16 00:00:00,2017-11-03 14:55:52,141556,2840,276,452,0,13
cJ1zhq3yNBM,Stranger Things’ Dacre Montgomery’s Insane 'Billy' Audition Tape | GQ,,GQ,24,2017-11-16 00:00:00,2017-11-02 19:00:44,2082499,47510,317,2215,0,23
25ibuwW4Dm4,Star Wars: Vader Wasn't Always Luke's Father?,,SuperCarlinBrothers,22,2017-11-16 00:00:00,2017-11-02 19:00:55,214201,8144,380,2650,0,17
SCnVbXlC1Ds,Stephen Takes Issue With The 'Sexiest Man Alive' Issue,,The Late Show with Stephen Colbert,24,2017-11-17 00:00:00,2017-11-16 08:35:00,490925,8040,320,1001,0,23
aRz_XfwcVtU,Demi Lovato - Skyscraper in the Live Lounge,,BBCRadio1VEVO,10,2017-11-17 00:00:00,2017-11-13 20:24:20,391156,18623,246,777,0,4
3s1rvMFUweQ,Taylor Swift: …Ready for It? (Live) - SNL,,Saturday Night Live,24,2017-11-17 00:00:00,2017-11-12 06:24:44,1776127,35741,3214,3585,0,3
TQ2uDO5CbYg,Red Velvet 레드벨벳 '피카부 (Peek-A-Boo)' Teaser Part.1,,SMTOWN,10,2017-11-17 00:00:00,2017-11-07 15:00:01,2255227,144085,2347,12074,0,4
I1uCGgc-Jag,Justice League Press Conference,,Superhero News,24,2017-11-17 00:00:00,2017-11-08 20:00:03,12858,463,7,97,0,17
X9VlCV1ZflQ,[MV] SONAMOO(소나무) _ I (knew it),,1theK (원더케이),10,2017-11-17 00:00:00,2017-11-06 09:00:01,720322,22986,314,2134,0,4
nshmwFK3yd8,[Mnet Present Special] SEVENTEEN - CHANGE UP,,M2,24,2017-11-17 00:00:00,2017-11-07 11:12:56,138991,10009,17,306,0,4
8HON4AswPVk,Arvo Pärt - Tabula Rasa,,JSaxofone,10,2017-11-17 00:00:00,2012-09-13 12:35:46,731007,4022,72,240,0,4
au3S8F08v54,New album Open Here out 2nd February,,Field Music,10,2017-11-17 00:00:00,2017-11-07 10:04:31,2254,45,0,9,0,4
4GFAZBKZVJY,Post Malone - rockstar ft. 21 Savage (Official Audio),,Republic Records,10,2017-11-17 00:00:00,2017-11-03 12:07:57,35463645,316384,12902,0,0,16
KgBWLAKxi-c,Half in the Bag Episode 134: Thor: Ragnarok,,RedLetterMedia,24,2017-11-17 00:00:00,2017-11-05 23:12:16,433518,14615,537,3640,0,17
UWl2fVxb-Mc,UFC 217: Rose Namajunas Octagon Interview,,UFC - Ultimate Fighting Championship,17,2017-11-17 00:00:00,2017-11-05 03:48:55,1219133,12246,347,4346,0,1
JD40Q9esDws,"JUSTICE LEAGUE interviews - Gal Gadot, Ben Affleck, Henry Cavill, Ezra Miller, Momoa, Fisher",,FOX 5 DC,25,2017-11-17 00:00:00,2017-11-05 18:57:02,185923,2727,122,664,0,17
TUv06BScsp0,Triple H in ICW!,,Insane Championship Wrestling - ICW,24,2017-11-17 00:00:00,2017-11-05 18:17:18,178431,4008,54,450,0,19
ROzC9ZySGos,MAKEUP vs iPHONE X FACE ID,,James Charles,24,2017-11-17 00:00:00,2017-11-04 18:00:03,3078660,117658,13802,11933,0,13
NNSO_4yKM0M,Tyron Woodley Accepts Nate Diaz Fight (Exclusive) | The Hollywood Beatdown,,TMZSports,17,2017-11-18 00:00:00,2017-11-16 19:30:11,57610,440,63,357,0,1
7d9cu_dmQ0c,Far Cry 5: Recreating Montana | Ubiblog | Ubisoft [US],,Ubisoft US,20,2017-11-18 00:00:00,2017-11-14 17:00:42,78506,1216,42,266,0,26
j7WlcSwe8Ws,Weekend Update on Donald Trump's Asia Trip - SNL,,Saturday Night Live,24,2017-11-18 00:00:00,2017-11-12 06:48:17,1907912,18641,1741,1771,0,3
lo5ERI5nPbM,Sharon Needles - Andy Warhol Is Dead [Official],,Sharon Needles,10,2017-11-18 00:00:00,2017-11-10 18:52:40,105704,5475,365,483,0,4
28_tNFnMrTk,Last Week I Got Burgled,,DarkSquidge,22,2017-11-18 00:00:00,2017-11-06 16:03:17,84369,5854,30,929,0,13
l9nGCJlDclQ,After Show: Did Kate Hudson Date Brad Pitt? | WWHL,,Watch What Happens Live with Andy Cohen,24,2017-11-18 00:00:00,2017-11-08 17:00:01,55572,191,191,83,0,8
Y9PYlF43i3g,A DIFFERENT WAY - DJ Snake feat. Lauv Dance | Matt Steffanina X Erica Klein,,Matt Steffanina,24,2017-11-18 00:00:00,2017-11-08 19:37:41,396262,18974,173,509,0,13
bRlXatOvsZU,Yxng Bane - Rihanna (Live) - dscvr ARTISTS TO WATCH 2018,,Vevo dscvr,10,2017-11-18 00:00:00,2017-11-06 14:00:04,108081,2352,419,92,0,3
SMBXARpIqME,Lord Ashcroft hides in toilets to avoid questions on tax,,Guardian News,25,2017-11-18 00:00:00,2017-11-06 07:14:58,232406,2949,211,594,0,18
0Yp9WS6cJFA,This Week I Learned Downhill Mountain Biking,,Mike Boyd,24,2017-11-18 00:00:00,2017-11-06 14:43:29,369291,15019,197,1698,0,26
CyzEtbG-sxY,[M/V] SEVENTEEN(세븐틴) - 박수(CLAP),,SEVENTEEN,10,2017-11-18 00:00:00,2017-11-06 09:00:00,7434919,434255,4734,38460,0,4
hSXf6ozQEwo,Leslie Jones Had a Dream Just Like This - SNL,,Saturday Night Live,24,2017-11-19 00:00:00,2017-11-17 16:35:09,281064,5230,145,561,0,3
8WZuk8KXC5M,Rainbow Six Siege: Operation White Noise - Free Weekend November 16-19 | Trailer | Ubisoft [US],,Ubisoft US,20,2017-11-19 00:00:00,2017-11-14 17:00:01,57701,1061,33,230,0,26
GdR-iTH_f-I,"Miko Grimes Speaks Up For NFL Husband, Talks 'Baller Wives' Drama + More",,Breakfast Club Power 105.1 FM,24,2017-11-19 00:00:00,2017-11-07 13:50:33,296922,3764,328,1622,0,8
r1afdZk0qcI,[MV] 몬스타엑스(MONSTA X) - DRAMARAMA,,starshipTV,10,2017-11-19 00:00:00,2017-11-07 09:00:05,5322710,374892,2184,36004,0,4
1cUUfMeOijg,The Lava Lamps That Help Keep The Internet Secure,,Tom Scott,27,2017-11-19 00:00:00,2017-11-06 16:00:00,811112,28095,329,1214,0,19
n1rblnOWhmM,20 Questions,,Carrie Hope Fletcher,24,2017-11-19 00:00:00,2017-11-07 18:43:32,138064,9521,88,678,0,13
3iXwXYflCSI,If only every weekend could be like this | EmilyHart,,Emily Hart,23,2017-11-19 00:00:00,2017-11-09 09:15:40,11619,856,17,198,0,3
icqp_XDH_BI,£99 Baby Charity Haul! | MOTHERHOOD,,Sprinkleofglitter,26,2017-11-20 00:00:00,2017-11-16 19:14:27,159593,6309,204,549,0,0
6epjkX1sr2M,What To Buy HER: Christmas 2017 | FleurDeForce,,Fleur DeForce,26,2017-11-20 00:00:00,2017-11-15 17:00:00,179201,5586,192,383,0,13
IY-M93e2lok,LAST MINUTE SHOPPING FOR OUR TRIP TO VEGAS | VLOG 52,,Inthefrow,26,2017-11-20 00:00:00,2017-11-16 19:00:14,76222,2088,85,147,0,13
ph2RlcltYdM,WHAT I BOUGHT LAST MONTH: AUTUMN HAUL | Lily Pebbles,,Lily Pebbles,26,2017-11-20 00:00:00,2017-11-12 09:30:01,106126,2897,138,239,0,13
sAWeoDHzBgE,TALKING PICTURES with SAMMY PAUL,,Hazel Hayes,22,2017-11-20 00:00:00,2017-11-13 17:27:15,33479,2679,18,136,0,17
sF1l7v3XY6I,MY WARDROBE TOUR | Samantha Maria,,Samantha Maria,26,2017-11-20 00:00:00,2017-11-08 19:09:56,111971,5303,109,274,0,13
cpvoCLX8agc,Brazil 0-2 England (1984),,cestrian81,17,2017-11-20 00:00:00,2013-03-31 20:09:25,34347,55,1,37,0,26
E7q_wbbwGyU,Liam Payne - Bedroom Floor (Official Video),,LiamPayneVEVO,10,2017-11-20 00:00:00,2017-11-06 16:00:02,9448387,357993,10836,17837,0,16
KdFRkillEfM,*INSANE* I SPENT THE NIGHT IN A SKI CENTRE!,,Ryan Taylor,17,2017-11-20 00:00:00,2017-11-07 20:41:29,109748,4657,69,613,0,26
F6rBIWN8SsM,'I Asked God to Send Me a White Girl with a Big Booty',,Divorce Court,23,2017-11-20 00:00:00,2015-03-10 20:50:23,193184,887,66,438,0,0
R59TevgzN3k,Samsung Galaxy: Growing Up,,Samsung Mobile USA,24,2017-11-20 00:00:00,2017-11-05 19:00:44,18189982,273666,36339,37586,0,18
vLVSf_yI_r8,gugudan(구구단) - 'Chococo' Official M/V,,gugudan,24,2017-11-20 00:00:00,2017-11-08 08:59:54,1322154,51255,3677,7258,0,4
axVvZrDz60k,[EXID(이엑스아이디)] 덜덜덜(DDD) 뮤직 비디오 (Official Music Video),,EXID_OFFICIAL,24,2017-11-20 00:00:00,2017-11-07 08:30:02,9020432,354960,5653,25571,0,4
Wjq7x2d_s1w,Kelela - Blue Light,,KelelaVEVO,10,2017-11-20 00:00:00,2017-11-07 13:00:06,334492,10199,294,587,0,16
NHglTopVlKQ,블락비 (Block B) - Shall We Dance MV,,CJENMMUSIC Official,10,2017-11-20 00:00:00,2017-11-07 09:00:01,4000448,176017,2044,10960,0,4
aaOB-ErYq6Y,Waymo's fully self-driving cars are here,,Waymo,28,2017-11-20 00:00:00,2017-11-07 16:03:12,701322,6649,734,2538,0,18
oSS6kGWNEeA,Ben Affleck: 'I'm Not A Superhero',,The Late Show with Stephen Colbert,24,2017-11-21 00:00:00,2017-11-17 08:35:00,906417,5864,1315,1818,0,23
d8RW-WSpAhQ,Weed Killer Challenge: Vinegar 'Weed B Gone' vs HDX,,markthomasbuilder,22,2017-11-21 00:00:00,2014-06-28 13:12:35,411310,1863,132,275,0,13
G1Ky9-OoWyo,EA's Responds to Star Wars Loot Box Rant! - [Angry Interview],,AngryJoeShow,20,2017-11-21 00:00:00,2017-11-08 06:45:00,988435,37980,2376,14652,0,17
wjy9Jgnjv6U,Neil and Blake Push A Fat Bike To Its Limits,,Global Mountain Bike Network,17,2017-11-21 00:00:00,2017-11-08 16:59:44,163639,5967,44,557,0,26
IOd0HGH6xKI,Alison Wonderland - Happy Place (Lyrics),,Trap City,10,2017-11-21 00:00:00,2017-11-09 05:00:01,301204,7052,418,316,0,4
Fkwkn7vXpWI,How Are Waves Formed? - Earth Lab,,BBC Earth Lab,24,2017-11-21 00:00:00,2017-11-09 10:00:00,32198,1184,37,115,0,18
z4bLKt9k5dk,Things Not To Say To Someone With Vitiligo,,BBC Three,24,2017-11-21 00:00:00,2017-11-07 12:00:04,1152016,25612,678,3920,0,3
0oXu0XfXYYE,Youtube Show & Tell | Tag | Zoella,,Zoella,26,2017-11-22 00:00:00,2017-11-19 19:04:13,1020294,59974,3081,472,0,13
FVwR2zK_Ahs,DAILY ROUTINE | Mum & Baby,,Samantha Maria,26,2017-11-22 00:00:00,2017-11-19 09:00:01,152807,13679,69,849,0,13
Er5jqmjaoo0,Afraid of Heights - Official Music Video,,Tom Fletcher,24,2017-11-22 00:00:00,2017-11-17 09:27:54,117316,9669,23,890,0,16
cUtYh_ZUjqc,You Know You’re British When… | The December Issue | British Vogue,,British Vogue,24,2017-11-22 00:00:00,2017-11-10 00:00:02,82582,2068,217,348,0,23
z7VBtM7clT4,Justice League Movie Cast Reveal Funniest Moments Together | MTV Movies,,MTV International,24,2017-11-22 00:00:00,2017-11-09 15:05:03,178045,2169,49,232,0,17
dwkNG9qeYIY,UK Bike Skills Autumn Ladder Riding,,UK Bike Skills,22,2017-11-22 00:00:00,2017-11-11 12:50:38,5279,51,11,16,0,26
iNsTzqwwioY,How Accurate Are Personality Tests and Horoscopes?,,Life Noggin,27,2017-11-22 00:00:00,2017-11-09 14:00:03,300006,11793,223,1647,0,18
P4ohTV_28Oc,Taylor Swift Saturday Night Live Behind The Scenes,,Tu Fan,24,2017-11-22 00:00:00,2017-11-10 19:43:21,62248,981,14,64,0,13
nrXlY6gzTTM,The Post | Official Trailer [HD] | 20th Century FOX,,20th Century Fox,1,2017-11-22 00:00:00,2017-11-08 05:31:00,2931630,9407,1015,1425,0,17
N8U2EPiEbZo,A PRE WEDDING PAMPER | Lydia Elise Millen,,Lydia Elise Millen,22,2017-11-22 00:00:00,2017-11-09 21:18:34,199723,4221,312,349,0,13
OGKchfcd-5w,Big Krit Freestyle With The L.A. Leakers - Freestyle #030,,Power 106 Los Angeles,10,2017-11-22 00:00:00,2017-11-11 03:53:25,145633,5824,44,891,0,4
ssbOzbL1SJQ,JUSTICE LEAGUE Movie Clip Aquaman Island + Trailer NEW (2017) Batman Superman Superhero Movie HD,,MovieAccessTrailers,24,2017-11-22 00:00:00,2017-11-10 23:13:33,246054,1974,100,440,0,17
gSW2l1z1lKw,THIS WASN'T SUPPOSED TO HAPPEN!! DIY FIREWORKS SHOW,,SACCONEJOLYs,22,2017-11-22 00:00:00,2017-11-09 18:00:02,120982,6381,248,357,0,13
nnrkPRApQg8,KUWTK | Khloe Tries to Help Kourtney & Scott Hash Out Their Drama | E!,,E! Entertainment,24,2017-11-22 00:00:00,2017-11-09 14:30:53,699217,5729,213,470,0,16
A8ScwhLh7uo,Honest Trailers - Stranger Things,,Screen Junkies,1,2017-11-22 00:00:00,2017-11-07 18:00:01,3515606,100707,2958,7746,0,17
FUzs2oMEs8w,Virtual Self - Ghost Voices [Audio],,Porter Robinson,10,2017-11-22 00:00:00,2017-11-08 19:57:09,328651,11856,177,1271,0,4
bxeHBBf21UY,Game Of Stairs (Enduro Edition) |SickSeries#31,,Fabio Wibmer,17,2017-11-22 00:00:00,2017-11-10 16:01:06,357668,18102,163,976,0,26
YInRqgNMLBc,Craziest sitter miss ever Gintra Šiauliai - Barcelona with commentary | Champions League,,Lietuvos Futbolo Rinktinės Archyvas,17,2017-11-22 00:00:00,2017-11-08 18:56:43,195527,303,10,61,0,3
sECcOTO8Ij4,Sonic Forces: The New Chick - PART 1 - Game Grumps,,GameGrumps,20,2017-11-22 00:00:00,2017-11-07 22:00:01,1155926,39079,624,6827,0,26
949vJMp0v40,Thunder Christmas Day Official Music Video - Single out December 1st,,earMUSIC,10,2017-11-22 00:00:00,2017-11-10 14:57:32,45694,425,66,35,0,4
E7ykb1geOoU,A Veteran speaks on Remembrance Day,,Novara Media,25,2017-11-23 00:00:00,2017-11-11 13:39:47,6006,333,27,85,0,18
F62QpaPWXDI,THE CHEAPEST & BEST EYESHADOWS?,,Jamie Genevieve,22,2017-11-23 00:00:00,2017-11-09 18:18:59,133161,5656,93,327,0,13
Y5MqpKlKiSM,Decluttering My Life ✨,,Gabriella Lindley,24,2017-11-23 00:00:00,2017-11-10 15:42:33,121541,5908,168,291,0,13
pHE8nIB6j2U,Chayanne - Choka Choka (Official Video) ft. Ozuna,,chayanneVEVO,10,2017-11-24 00:00:00,2017-11-10 14:00:04,18804942,218197,20368,8918,0,4
ONQ-fAp5X64,CAN BABIES DO GYMNASTICS?  **World Record**,,Nile Wilson,17,2017-11-24 00:00:00,2017-11-11 10:30:00,469080,11530,374,598,0,13
hbmdI8A7SSo,"What the heck, October? | Lex Croucher",,Lex Croucher,23,2017-11-24 00:00:00,2017-11-12 19:53:50,19499,1216,16,160,0,13
Dlwf5u2BLAg,"TV Reporter Interviews Alleged Bank Robber, Then Helps Police Catch Him",,Inside Edition,25,2017-11-24 00:00:00,2017-11-10 01:40:07,289992,1883,146,346,0,18
BsfhHKx6ajA,Attracting An Alpaca With An Accordion | Nowhere Else,,Good Mythical Morning,24,2017-11-24 00:00:00,2017-11-10 11:00:00,861532,13757,2329,1168,0,24
NVCqz2BDfcQ,Gucci Mane  - Curve (ft. The Weeknd),,OfficialGucciMane,10,2017-11-25 00:00:00,2017-11-10 17:18:13,3043598,65509,1885,2492,0,4
tEA_n4mmBok,"Paige returns to WWE alongside Raw newcomers Mandy Rose and Sonya Deville: Raw, Nov. 20, 2017",,WWE,17,2017-11-26 00:00:00,2017-11-21 04:28:43,2732822,50791,2059,7086,0,19
tjVJgR4OrgM,"President Trump ASEAN Summit SPEECH With Duterte in Manila, Philippines 11/13/2017",,President Trump,25,2017-11-26 00:00:00,2017-11-13 07:05:37,153742,1436,60,273,0,18
3qYt_fXdaXY,Sweetie destroys Flav (Sweetie vs. Flavor Flav),,Foolmarkt,24,2017-11-26 00:00:00,2016-08-06 12:25:20,62794,769,46,229,0,17
cm1_NPyNRvw,"Addams In Singapore | Watch Me, Wednesday!",,Carrie Hope Fletcher,24,2017-11-27 00:00:00,2017-11-21 11:55:27,119504,5203,70,409,0,13
MiqL5nR5Cyc,President Trump’s Successful Year of Rebranding The Swamp - Some News,,Cracked,23,2017-11-27 00:00:00,2017-11-18 17:00:01,333525,11704,794,1782,0,18
Mv-CJ44KbW4,SURPRISING MY FRIENDS WITH A HOLIDAY!!,,PointlessBlogVlogs,24,2017-11-27 00:00:00,2017-11-16 19:11:57,618336,38349,977,174,0,13
xVp2opnGrEA,Gal Gadot Talks About New Movie 'Justice League' And Sexual Harassment In Hollywood | TODAY,,TODAY,25,2017-11-27 00:00:00,2017-11-15 14:36:02,198684,2138,139,397,0,18
9CO6M2HsoIA,Slaughterbots,,Stop Autonomous Weapons,22,2017-11-27 00:00:00,2017-11-12 23:55:06,1780493,8949,639,1861,0,18
RDP8Oh-br4Y,BRUNCH WITH GIGI & GETTING A BETTER BUM,,SamanthaMariaVlogs,26,2017-11-27 00:00:00,2017-11-14 17:00:05,130064,4139,160,344,0,13
JDDP9fY6dmI,A Group Of Democrats Just Officially Moved To Impeach Donald Trump As President | TIME,,TIME,25,2017-11-27 00:00:00,2017-11-15 20:18:55,94580,1510,597,1539,0,18
rIh1NW7afo4,"The MMA Hour: Episode 409 (w/ Swagger, Bisping, Rampage, Swanson, Bang)",,MMAFightingonSBN,17,2017-11-27 00:00:00,2017-11-13 23:35:14,148531,1427,163,478,0,1
zpgn8U5Ug8M,Sky: 6 Minutes of Journey Creator's New Game - IGN First,,IGN,20,2017-11-27 00:00:00,2017-11-15 00:00:19,96228,1337,104,272,0,26
aRXgvkpMZrI,September 2017 - Pretentious Monthly Scrapbook 2017,,Daniel J. Layton,22,2017-11-27 00:00:00,2017-11-13 18:33:12,31023,2832,11,164,0,13
EvWPqF_AQHI,DESIGNER AUTUMN HAUL! | Amelia Liana,,Amelia Liana,26,2017-11-27 00:00:00,2017-11-13 16:37:04,105390,2662,212,371,0,13
uXNIeQjav80,John Lewis Christmas Advert 2017 | Reaction with Tom,,Giovannasworld,24,2017-11-27 00:00:00,2017-11-13 09:00:04,58605,1782,79,148,0,13
FCdvOAcbK4s,Danny MacAskill vs The Munros,,EnduraOfficial,17,2017-11-27 00:00:00,2017-11-08 15:15:51,138240,2037,41,50,0,26
W187SzNVGvc,IMAN FREESTYLES ON FLEX | #FREESTYLE085,,HOT 97,10,2017-11-27 00:00:00,2017-11-13 16:18:54,240545,5471,182,846,0,4
