Id,Label,timeset,channel_title,category_id,trending_date,publish_time,views,likes,dislikes,comment_count,componentnumber,modularity_class
HHOyg1oDeis,FULL FACE OF YOUTUBER CHRISTMAS PRESENTS,,James Charles,24,2017-12-30 00:00:00,2017-12-22 21:00:20,1836620,139237,5668,11651,0,13
KNEVjhCXZB4,New Year Resolutions - Simon's Cat | GUIDE TO,,Simon's Cat,15,2017-12-30 00:00:00,2017-12-22 13:00:03,324996,13078,204,338,0,13
RbNaEwp7hMw,Fenty Beauty MATTEMOISELLE Lipstick Swatches! | Alissa Ashley,,Alissa Ashley,26,2017-12-30 00:00:00,2017-12-23 00:19:00,328740,33663,288,2665,0,13
dBTKW8NKAt4,Koala Brawl : Koalas Fight on Australian Road - Near Adelaide,,Ryan Northover,24,2017-12-30 00:00:00,2017-12-22 02:27:33,48112,94,10,9,0,18
ccgIXa7TIkc,The Voice 2017 - The Season 13 Voice Champion Is...,,The Voice,24,2017-12-30 00:00:00,2017-12-20 04:39:25,1262601,10121,1738,2477,0,18
i9-0BJ4CJvM,Papa John's Founder Out As CEO | Los Angeles Times,,Los Angeles Times,25,2017-12-30 00:00:00,2017-12-22 01:19:18,1949,20,5,25,0,17
MnKbM9Zxtn8,Gringo - Official Redband Trailer [HD] | Amazon Studios,,Amazon Studios,1,2017-12-30 00:00:00,2017-12-20 15:52:04,107735,586,219,130,0,17
Q3pUXLQ5G5U,DOOR TO SPACE - 29 Rooms Vlog,,TiffyQuake,26,2017-12-30 00:00:00,2017-12-22 00:30:00,34032,1930,14,182,0,13
2ktuvx9hrMw,Disney's The Nutcracker and the Four Realms - Teaser Trailer,,Disney Movie Trailers,1,2017-12-30 00:00:00,2017-12-19 13:16:10,3065887,47974,2445,5101,0,17
alRtHXnZMOI,The Ginger Ed Man,,Spotify,10,2017-12-30 00:00:00,2017-12-20 17:02:12,720749,4069,186,271,0,3
jjEmFB7zY4o,Romain Febvre: Shipwrecked,,Monster Energy,17,2017-12-30 00:00:00,2017-12-21 15:04:49,108591,1758,43,69,0,26
cntsqw7XOF0,Dashboard Confessional: We Fight [OFFICIAL VIDEO],,Fueled By Ramen,10,2017-12-30 00:00:00,2017-12-20 15:00:35,157137,6968,349,486,0,4
RlSzahonkTk,Little Mix - Nothing Else Matters (Glory Days Tour),,littlemixVEVO,10,2017-12-30 00:00:00,2017-12-20 16:00:03,2012372,148893,1573,7405,0,4
3RlbqOl_4NA,"UFO spotted by US fighter jet pilots, new footage reveals - BBC News",,BBC News,25,2017-12-30 00:00:00,2017-12-19 09:50:02,1140097,11389,1590,4974,0,18
_lUiJsnGXh8,Honest Trailers - Jumanji,,Screen Junkies,1,2017-12-30 00:00:00,2017-12-19 18:00:04,1823566,42678,1234,4908,0,17
yh1NAMi2oLg,"Thank you, Paloma",,Lyft,19,2017-12-30 00:00:00,2017-12-20 14:00:57,2160639,1218,63,118,0,26
6CPUUjAlXrs,K-pop stars carry Jonghyun’s coffin after suicide,,INQUIRER.net,24,2017-12-30 00:00:00,2017-12-21 05:25:52,121344,989,27,118,0,18
_mHSkHjInS4,Dwayne Johnson and Kevin Hart Insult Each Other | CONTAINS STRONG LANGUAGE!,,BBC Radio 1,1,2017-12-30 00:00:00,2017-12-19 15:00:07,2776665,54243,866,1801,0,4
aMQbRpxgFvs,Smartphone Awards 2017!,,Marques Brownlee,28,2017-12-30 00:00:00,2017-12-20 00:42:05,2309633,115443,3940,17047,0,18
iZpxzfMkVzM,The Most Beautiful Restaurant in Japan - Kyoto Kitcho,,Simon and Martina,19,2017-12-30 00:00:00,2017-12-20 00:53:14,458830,15920,357,1769,0,26
a2bjPDkFR40,CHRISTMAS BOOTY SONG,,Good Mythical Morning,24,2017-12-30 00:00:00,2017-12-19 11:00:01,812300,17486,3339,2041,0,24
PluaPvhkIMU,The Greatest Showman | From Now On with Hugh Jackman | 20th Century FOX,,20th Century Fox,1,2017-12-30 00:00:00,2017-12-19 13:59:38,910966,17406,147,930,0,17
fEhgT7G6ouQ,Dating a College Girl Isn't as Sexy as It Seems,,CollegeHumor,23,2017-12-31 00:00:00,2017-12-27 18:00:06,1044836,26856,1230,1743,0,3
ZpMNJbt3QDE,‘Shape of You’: How Ed Sheeran Made 2017’s Biggest Track,,The New York Times,25,2017-12-31 00:00:00,2017-12-20 22:06:00,733180,36237,410,1006,0,18
KFm7fKqg13E,House Speaker Paul Ryan: ‘Don’t Forget This Is A Big Tax Cut For Families As Well’ | TODAY,,TODAY,25,2017-12-31 00:00:00,2017-12-20 13:19:14,290706,1882,7859,3141,0,18
2PQCLZbzxq8,Jonathan Groff's Festive Christmas Sweater,,LIVEKellyandRyan,24,2017-12-31 00:00:00,2017-12-21 18:10:05,4318,32,0,0,0,18
y0BlGqwLLGQ,Foot Locker x Jordan - “#BoldLikeKawhi” feat. Kawhi Leonard,,Foot Locker,24,2017-12-31 00:00:00,2017-12-20 16:54:03,2109732,1311,49,211,0,26
tMSu3Gyz1jU,The Open House | Official Trailer [HD] | Netflix,,Netflix,24,2018-01-01 00:00:00,2017-12-28 17:00:05,617606,9669,397,927,0,17
VHXPFrOfndg,What's In The Box Challenge With Amber Scholl | YouTube Challenges | Refinery29,,Refinery29,22,2018-01-01 00:00:00,2017-12-26 16:00:03,72022,941,827,248,0,13
LotoBix4UDM,Will Smith & Joel Edgerton Answer the Web's Most Searched Questions | WIRED,,WIRED,24,2018-01-01 00:00:00,2017-12-20 20:01:07,641055,14068,233,642,0,19
lWHZKP6xXHU,4 Lies That Ruined Christmas,,itsAlexClark,1,2018-01-01 00:00:00,2017-12-20 19:13:07,1536968,63353,1489,4738,0,17
lcpxLXjYAa8,Americans could see tax bill impact in early 2018,,ABC News,25,2018-01-01 00:00:00,2017-12-20 14:30:30,285483,1754,1087,2703,0,18
E60w-0q8Y0Y,"It's true, wife and I are getting a divorce.  Here's whats next for us.",,boogie2988,24,2018-01-01 00:00:00,2017-12-20 01:25:59,2910609,173772,9109,60,0,0
OziQ_a3Rpqw,Khloe Kardashian Confirms Pregnancy & Reveals Baby Bump | Hollywoodlife,,HollywoodLife,24,2018-01-01 00:00:00,2017-12-21 00:33:36,756379,5599,650,779,0,0
ydPYNo8o-lI,"Imagine Dragons, Khalid - Thunder / Young Dumb & Broke (Medley/Audio)",,ImagineDragonsVEVO,10,2018-01-01 00:00:00,2017-12-20 05:00:02,3266179,108422,2843,4768,0,16
SFxZb-GHbrQ,Star Wars: The Last Jedi | Becoming Rose,,Star Wars,24,2018-01-01 00:00:00,2017-12-20 18:00:06,398127,9204,5176,2758,0,17
feh8CkaPkr4,"What $1,675 Will Get You In NYC | Sweet Digs Home Tour | Refinery29",,Refinery29,26,2018-01-02 00:00:00,2017-12-31 16:00:04,100264,2040,237,452,0,13
OSBl32lNGBg,5 Socks Gadgets put to the Test!,,CrazyRussianHacker,28,2018-01-02 00:00:00,2017-12-27 23:16:58,1063356,20974,3382,2775,0,18
Q-v4LsbFc5c,This Video Is 2D And 3D Simultaneously: the Pulfrich Effect,,Tom Scott,27,2018-01-02 00:00:00,2017-12-26 16:00:02,1709373,50835,2646,2937,0,19
RsIIT6rXnSM,In-N-Out Vs. Shake Shack Taste Test with Tom Segura | Sean in the Wild,,First We Feast,26,2018-01-02 00:00:00,2017-12-26 16:00:02,725421,17659,618,3275,0,13
O3ttybJghsc,Raiders vs. Eagles | NFL Week 16 Game Highlights,,NFL,17,2018-01-02 00:00:00,2017-12-26 05:26:03,1145202,8821,619,2661,0,26
rQ7yPtJ5Y7I,Michelle Williams Recalls Being Mistaken for the Destiny's Child Singer at a Concert (Exclusive),,Entertainment Tonight,24,2018-01-02 00:00:00,2017-12-26 15:07:02,12544,67,24,18,0,23
fFSmOE0Uxms,MAKING A GINGERBREAD TRAIN,,Marzia,22,2018-01-02 00:00:00,2017-12-23 18:00:11,889056,62089,1061,4391,0,13
zeO4C8e4pjw,How Miz’s disastrous TV debut led him to Maryse: WWE Photo Shoot!,,WWE,17,2018-01-02 00:00:00,2017-12-23 16:30:01,466388,13783,422,1345,0,19
VqcHUdHQ1u8,IT'S CHRISTMAS! - Topi the Corgi,,Topi The Corgi,15,2018-01-02 00:00:00,2017-12-23 22:35:07,75273,4408,81,558,0,13
v2OTO6UEVAo,Another North Korean soldier escapes to South Korea,,CNN,25,2018-01-02 00:00:00,2017-12-22 14:38:13,1015745,10000,1034,3127,0,18
qOvMazijKMA,Turning Sugarcane Into Candy Canes | HTME,,How To Make Everything,27,2018-01-02 00:00:00,2017-12-22 16:04:49,474698,11434,336,1537,0,13
07S_Glj3uYs,Noah Cyrus - Again (Alan Walker Remix),,Alan Walker,10,2018-01-02 00:00:00,2017-12-22 17:00:44,1509716,77243,1665,4279,0,4
mMzKvVtrC6U,"I'm Not A Child, I'm 20 | Living Differently",,BBC Three,24,2018-01-02 00:00:00,2017-12-21 12:00:03,1294681,19580,965,6619,0,18
MUWUHf-rzks,How to Make an Elephant Explode with Science – The Size of Life 2,,Kurzgesagt – In a Nutshell,27,2018-01-02 00:00:00,2017-12-21 13:38:50,1984239,109450,1419,6875,0,13
WS7f5xpGYn8,Katy Perry - Hey Hey Hey (Official),,KatyPerryVEVO,10,2018-01-02 00:00:00,2017-12-20 20:00:02,33420138,821971,165109,81388,0,4
WhJIUtMK1tU,The Rock’s Make a Wish Surprise,,The Rock,24,2018-01-02 00:00:00,2017-12-22 11:30:01,133049,6173,86,571,0,4
ZB7_1CoKntI,Giving Myself Tape In Hair Extensions,,JennaMarbles,23,2018-01-02 00:00:00,2017-12-21 14:14:16,2910915,195530,1278,12583,0,13
8eo-L_3OWAQ,Lucky the iPhone singing cockatiel is OVER it!,,Ben Pluimer,1,2018-01-02 00:00:00,2017-12-20 15:43:22,4376750,52381,3744,2881,0,18
5EF5Curjr8k,Talking to Myself (Official Lyric Video) - Linkin Park,,Linkin Park,10,2018-01-02 00:00:00,2017-12-21 23:09:28,519197,39056,359,1968,0,4
zT4DJKkN_Do,Teeny Weeny Challenge #3 How Small Can I Bake a Gingerbread House? How To Cook That Ann Reardon,,How To Cook That,26,2018-01-02 00:00:00,2017-12-22 08:30:39,262018,7749,189,1816,0,13
nZM9Ko806Bg,How I Skinned My Face,,William Osman,28,2018-01-02 00:00:00,2017-12-21 14:00:04,448413,19857,448,2255,0,18
l_lblj8Cq0o,"G-Eazy - No Limit REMIX ft. A$AP Rocky, Cardi B, French Montana, Juicy J, Belly",,GEazyMusicVEVO,10,2018-01-02 00:00:00,2017-12-19 20:00:05,45938392,728696,43049,43541,0,4
cIQKKzZtWwQ,Sugarland - Still The Same,,SugarlandVEVO,10,2018-01-02 00:00:00,2017-12-21 05:00:00,624894,7103,677,410,0,16
dwEKqAwoz0Y,"Take Sam to Church | December 20, 2017 Act 3 | Full Frontal on TBS",,Full Frontal with Samantha Bee,22,2018-01-02 00:00:00,2017-12-21 07:00:03,521883,7267,1900,996,0,10
teA0Z7ltRSY,Apple Sued Over Slowing Down iPhones,,CBS New York,25,2018-01-02 00:00:00,2017-12-22 04:31:29,470348,7972,295,3413,0,18
OWYKrIKMO1M,WE HAVE BECOME CHARACTERS IN A GAME!!!!,,JOLLY,23,2018-01-02 00:00:00,2017-12-22 11:40:25,207749,5660,131,502,0,13
WQd6x4KmVhA,Where Were You When You Found Out You Hit No. 1? | Cardi B,,Billboard,10,2018-01-02 00:00:00,2017-12-22 15:58:16,16425,720,29,53,0,4
t0Ro2Yqs6mA,See Meghan Markle and Prince Harry's First Official Engagement Photos,,Inside Edition,25,2018-01-02 00:00:00,2017-12-21 15:38:24,68886,752,272,260,0,13
UK2OQ67Xr4o,Real Madrid players warm up before the Clásico!,,Real Madrid C.F.,24,2018-01-02 00:00:00,2017-12-23 12:41:48,97192,1924,119,206,0,18
3mRjN1Focog,The Harvard of Santa Schools,,Great Big Story,22,2018-01-02 00:00:00,2017-12-22 07:00:00,130546,4736,64,553,0,18
WvV5TbJc9tQ,Lil Peep - Save That Shit (Official Video),,Lil Peep,10,2018-01-02 00:00:00,2017-12-20 15:01:12,4795193,248867,2097,21392,0,4
bJje-B9YLIU,The 75th Annual Golden Globes - There’s a Lot to Talk About! (Promo),,NBC,24,2018-01-02 00:00:00,2017-12-22 14:00:02,6688,26,11,8,0,3
6-xB3ij-5xM,70 People from 70 Countries Imitate Americans | Condé Nast Traveler,,Condé Nast Traveler,19,2018-01-02 00:00:00,2017-12-19 17:01:17,81011,443,133,116,0,13
PLAFNvxDPMw,Impossible Rubik's Cubes,,standupmaths,24,2018-01-02 00:00:00,2017-12-21 15:09:12,241678,6950,259,846,0,3
fEMxFSjmo5Q,Pastry Chef Attempts To Make Gourmet Gushers,,Bon Appétit,26,2018-01-02 00:00:00,2017-12-20 17:01:03,1370158,33462,934,1946,0,13
lM0yu7c6lQk,You're not crazy. Apple is slowing down older iPhones. (Apple Byte),,CNET,43,2018-01-02 00:00:00,2017-12-22 01:16:16,179723,4763,247,1998,0,18
RHUxyXZBXY8,Migos - Stir Fry (Audio),,MigosVEVO,10,2018-01-02 00:00:00,2017-12-20 11:00:01,2866699,74831,2734,5936,0,4
5czA_L_eOp4,Why should you read Charles Dickens? - Iseult Gillespie,,TED-Ed,27,2018-01-02 00:00:00,2017-12-21 16:00:01,241476,9401,114,357,0,18
9yWnVxe1qp8,Polar Bear destroys spy cam - Polar Bear Spy On The Ice - BBC Earth,,BBC Earth,15,2018-01-02 00:00:00,2017-12-22 10:00:00,31228,1159,19,104,0,18
K62oeVyaC-U,When did you stop believing in Santa? (YIAY #386),,jacksfilms,23,2018-01-02 00:00:00,2017-12-21 01:17:37,1292782,68925,680,27398,0,13
zLJsJR0O6VI,2016 vs 2017,,Smosh,23,2018-01-02 00:00:00,2017-12-20 17:00:07,1782889,66165,5100,5414,0,13
IU-Fo-QEpOI,Dude Perfect Face Off | What's In The Box,,Whistle Sports,17,2018-01-02 00:00:00,2017-12-20 23:00:00,3095325,40946,1082,2472,0,18
YEGhKwpEKEw,TITANIC TRANSFORMATION! THE ROSE LOOK FEAT. GUEST MAKEUP ARTIST TINA EARNSHAW,,Lisa Eldridge,26,2018-01-02 00:00:00,2017-12-21 17:03:31,476030,20712,254,1130,0,13
AaALLWQmCdI,Making new sounds using artificial intelligence,,ANDREW HUANG,10,2018-01-02 00:00:00,2017-12-21 15:30:00,129318,9577,103,1498,0,4
vbiiik_T3Bo,The End of the F**king World | Official Trailer [HD] | Netflix,,Netflix,24,2018-01-03 00:00:00,2018-01-01 15:30:03,2824423,65815,5212,6688,0,17
3GUYMZXyf9Y,Ellen Cooks Up a Huge Surprise for Food Critic Kalen Allen!,,TheEllenShow,24,2018-01-03 00:00:00,2018-01-02 14:12:44,276170,9504,291,698,0,0
eOcJ27xT99w,Every NFL Team's Best Play from the 2017 Season! | NFL Highlights,,NFL,17,2018-01-03 00:00:00,2018-01-01 19:52:05,161543,2765,113,658,0,26
deJCEUFeehI,Rainbow Oil Slick Hair Transformation That We Love | Short Cuts | Refinery29,,Refinery29,26,2018-01-03 00:00:00,2018-01-02 16:00:06,35862,964,137,75,0,13
O6BODAJVYc8,"2017, in 7 minutes",,Vox,25,2018-01-03 00:00:00,2017-12-30 13:00:04,2398601,89696,18778,20315,0,18
8FqgrgVPvio,Can You Ever Really Change?,,vlogbrothers,22,2018-01-03 00:00:00,2017-12-29 17:20:10,220181,12096,263,4746,0,18
K5BoE8eBzoI,Unbelievable Myths From The 1950s DEBUNKED!,,Life Noggin,27,2018-01-03 00:00:00,2017-12-28 14:00:03,1025006,20522,2674,4322,0,18
An6cskMsG7c,Most expensive house in the world shrouded in mystery,,CNN,25,2018-01-03 00:00:00,2017-12-28 13:27:01,144967,987,120,521,0,18
inFGj1IyIwk,"Top 10 Plays of the Night | December 27, 2017",,NBA,17,2018-01-03 00:00:00,2017-12-28 07:51:13,376858,3979,1801,438,0,26
moc_dHHp4LQ,Best Animal Videos of 2017!,,Brave Wilderness,15,2018-01-03 00:00:00,2017-12-27 12:00:03,876890,36083,485,4480,0,18
OmLxYUOgTNs,Jalen shuts down Will saying Kevin Durant will surpass LeBron James this season | First Take | ESPN,,ESPN,17,2018-01-03 00:00:00,2017-12-27 16:32:56,687873,6025,531,3508,0,26
2NpetP71B1o,AMAZING CANADIAN FOOD | INSANELY HUGE Christmas Turkey DINNER FEAST and EGGS BREAKFAST in CANADA,,The Food Ranger,19,2018-01-03 00:00:00,2017-12-27 15:00:00,386697,13606,440,2654,0,13
JRzZl_nq6fk,Falcon 9 rocket launch provides spectacular view in Bakersfield,,KBAK - KBFX - Eyewitness News - BakersfieldNow,25,2018-01-03 00:00:00,2017-12-23 02:27:14,1074082,13987,499,2727,0,18
CMJblEavb7g,Home for the Holidays,,Derek Hough,24,2018-01-03 00:00:00,2017-12-23 17:13:17,83499,1835,175,140,0,13
VAUHZYf_aKY,Carol of the Bells,,Gerry Litwin,22,2018-01-03 00:00:00,2017-12-22 03:17:58,4416751,63703,5533,4094,0,13
BIQK4-9YFW0,Five Finger Death Punch - Gone Away (Official Video),,5FDPVEVO,10,2018-01-03 00:00:00,2017-12-22 05:00:00,3953945,110060,3831,7273,0,4
H00djJq68VE,Panettone (Italian Christmas Bread) - Food Wishes,,Food Wishes,26,2018-01-03 00:00:00,2017-12-23 00:07:02,324324,9080,368,1081,0,13
wqEknnPadMA,Clarabelle Flirted with Me?! - Disneyland Impressions,,Brian Hull,24,2018-01-03 00:00:00,2017-12-22 16:00:04,306922,6688,327,801,0,17
cQtYcpRGGIY,Honey Butter Smashed Potato 🎄Asian at Home Holiday Special Recipe🎄,,Seonkyoung Longest,26,2018-01-03 00:00:00,2017-12-22 22:51:17,134436,6563,137,348,0,13
jTW5_KvkGoE,Top 50 Singles of 2017,,theneedledrop,10,2018-01-03 00:00:00,2017-12-22 20:19:46,520319,16105,2041,4195,0,4
rTMgDNpXPto,Manhattan Express Big Apple Roller Coaster 4K 60FPS NYNY Las Vegas Hotel Casino Front Seat POV,,Theme Park Review,19,2018-01-03 00:00:00,2017-12-22 22:00:04,109525,1162,92,238,0,13
drg74wOy8z8,Freak Show – Official Trailer l HD l IFC Films,,IFC Films,1,2018-01-03 00:00:00,2017-12-22 19:30:00,75433,1192,589,326,0,17
24HFgBQawWA,Keke Palmer - PREGAME Official Music Video,,Keke Palmer,10,2018-01-03 00:00:00,2017-12-22 22:58:04,223245,11899,510,833,0,4
65MWN5yKU0A,Crispy Potato Stack Fries,,ByronTalbott,26,2018-01-03 00:00:00,2017-12-22 23:44:14,106781,3125,187,206,0,13
VllA1V5M38E,Republicans Praise Trump; Trump Claims He Repealed Obamacare: A Closer Look,,Late Night with Seth Meyers,23,2018-01-03 00:00:00,2017-12-22 02:00:01,2206241,22393,2848,5237,0,3
b2EOxGUuBWA,"OVERBOARD Official Trailer (2018) Anna Faris, Eva Longoria Comedy Movie HD",,ONE Media,1,2018-01-03 00:00:00,2017-12-21 17:32:30,2058270,14160,5689,3347,0,17
h8ycmroFQSs,"How to Waterproof Electronics || Nail Polish, Silicone, Potting Compound",,GreatScott!,28,2018-01-03 00:00:00,2017-12-23 15:55:44,241661,8909,255,675,0,13
GEB2f5dpFXs,THRIFTING BRANDS!! GOODWILL WITH GREATLIZA.,,Liza Koshy,23,2018-01-03 00:00:00,2017-12-21 21:01:53,6225124,527481,4861,18323,0,3
MSzytvDsPfo,Cut for Time: Hallmark Channel Christmas Promo (James Franco) - SNL,,Saturday Night Live,24,2018-01-03 00:00:00,2017-12-21 19:05:06,1546967,17745,789,920,0,3
ItL6vcUrpUs,MACKLEMORE FEAT DAVE B & TRAVIS THOMPSON - CORNER STORE (Official Music Video),,Macklemore LLC,10,2018-01-03 00:00:00,2017-12-21 17:00:20,4513621,138227,3451,4666,0,4
ZsN1V9Hjfvg,Margot Robbie: How Hollywood's Horrible Situation Brings Actresses Together | Close Up With THR,,The Hollywood Reporter,24,2018-01-03 00:00:00,2017-12-22 15:00:02,99837,1087,81,147,0,23
aBQDFQwfX2w,Watch Silicon Valley Nerds Face Off A Capella (HBO),,VICE News,25,2018-01-03 00:00:00,2017-12-23 16:00:00,25393,349,217,119,0,18
F3eSaEHSCu0,FULL STREAM | Real Madrid - FC Barcelona warm-up #ElClásico,,FC Barcelona,24,2018-01-03 00:00:00,2017-12-23 11:53:33,351519,5979,231,147,0,18
uFDPLyAWpVg,GoPro: Gorilla Tickling at the GRACE Center,,GoPro,15,2018-01-03 00:00:00,2017-12-21 17:00:08,1652914,19764,341,1197,0,26
SV2sPlDLQtU,Belle Movie CLIP - Rare And Exotic (2014) - Tom Felton Movie HD,,Movieclips Coming Soon,1,2018-01-03 00:00:00,2014-06-21 06:36:55,99066,398,6,83,0,17
pihJVwap7iI,Nick Jonas - Home (Lyric Video),,NickJonasVEVO,10,2018-01-03 00:00:00,2017-12-22 05:00:04,327786,8674,273,349,0,16
XcSMdhfKga4,Mamma Mia! Here We Go Again - Trailer,,Universal Pictures,24,2018-01-03 00:00:00,2017-12-21 08:30:22,4149544,48299,4222,4406,0,11
XwDTzD75fT4,Kesha - This Is Me (from The Greatest Showman Soundtrack) [Official Audio],,Atlantic Records,10,2018-01-03 00:00:00,2017-12-22 05:01:12,717861,16454,395,812,0,4
JBw1nwYJESc,Anderson Cooper Walked Out Of The New 'Star Wars' Movie,,The Late Show with Stephen Colbert,24,2018-01-04 00:00:00,2018-01-03 08:35:00,783794,10038,2827,1566,0,23
bVU-MmJZFFA,Justin Timberlake - INTRODUCING MAN OF THE WOODS,,justintimberlakeVEVO,10,2018-01-04 00:00:00,2018-01-02 15:00:04,1402868,29970,1940,4023,0,16
n11raFYFfm4,'The Four' Cast Plays 'Never Have I Ever',,TheEllenShow,24,2018-01-04 00:00:00,2018-01-03 14:00:49,186023,3442,106,159,0,0
8V08Gu1DOgE,Fifty Shades Freed - Mrs. Grey Will See You Now [HD],,Fifty Shades,24,2018-01-04 00:00:00,2018-01-02 02:30:47,3322130,35099,6902,4030,0,17
iyjqs_1Nhr8,Shaving my mustache!!!,,TheTimTracker,24,2018-01-04 00:00:00,2018-01-01 22:35:21,173210,6356,424,1536,0,13
7FgazlhALyE,"Top 5 Plays of the Night | January 02, 2018",,NBA,17,2018-01-04 00:00:00,2018-01-03 07:56:44,146536,1691,1762,250,0,26
2fZ-qIHlA5M,Essential Phone Teardown - Complicated and Pointless,,JerryRigEverything,26,2018-01-04 00:00:00,2018-01-02 19:00:07,319303,13486,237,1339,0,18
waRVWv_UDCk,Nikki Haley: 'We will never accept a nuclear North Korea',,CNN,25,2018-01-04 00:00:00,2018-01-02 20:34:43,42607,451,374,1178,0,18
lR8ydxAJ_Cg,How New York Bagels Are Made | Food Skills,,First We Feast,26,2018-01-04 00:00:00,2018-01-01 20:00:09,278510,6701,198,916,0,13
A-JtybJbVbA,How the Animal Kingdom Sleeps,,The Atlantic,1,2018-01-04 00:00:00,2017-12-28 17:39:53,92983,1639,106,116,0,18
yMvpbrJ1CWQ,Sad Larry's Sad New Year - Cyanide & Happiness Shorts,,ExplosmEntertainment,23,2018-01-04 00:00:00,2017-12-28 06:00:04,1983087,61712,3784,4241,0,3
U1RASlbIIVc,TERRIBLE $900 Party Trick – Jibo Review,,Linus Tech Tips,28,2018-01-04 00:00:00,2017-12-27 08:31:48,1369181,42983,1473,5356,0,18
B1Kitc6cMXw,Completely Spillproof Travel Bag,,INSIDER,19,2018-01-04 00:00:00,2017-12-27 15:17:40,120441,1080,272,320,0,13
1WREZPc-kqQ,Everything Wrong With The Amityville Horror (1979),,CinemaSins,1,2018-01-04 00:00:00,2017-12-26 17:09:01,855708,20606,644,2001,0,17
u_SA2QkZd24,Camila Cabello - Havana (SING OFF vs. My Little Sister),,Conor Maynard,10,2018-01-04 00:00:00,2017-12-25 19:06:04,10698770,479666,9690,29516,0,4
lxSWRdgD4Ho,Alien Covenant Sequel Cancelled? Mark Hamill's Opinion Of The Last Jedi - The John Campea Show,,John Campea,24,2018-01-04 00:00:00,2017-12-27 19:13:05,47701,1337,332,639,0,17
aO7yzmc3ykw,"How to record Slow Motion Sounds (Exploding Tomato at 60,000fps) - Smarter Every Day 184",,SmarterEveryDay,28,2018-01-04 00:00:00,2017-12-26 15:45:57,747391,35268,970,2112,0,18
yJqsPBWbtjk,SPOILERS! The Twelfth Doctor Regenerates – Peter Capaldi to Jodie Whittaker - Doctor Who - BBC,,Doctor Who,24,2018-01-04 00:00:00,2017-12-25 18:28:32,1547151,30715,5595,13247,0,8
YsufMtUOXtI,NPR Podcast | Portlandia | IFC,,IFC,23,2018-01-04 00:00:00,2017-12-26 15:08:00,179345,2975,86,199,0,3
naOKPDCngMI,巨大なうさぎを癒すねこ。-Maru heals the huge rabbit.-,,mugumogu,15,2018-01-04 00:00:00,2017-12-26 23:06:30,46054,2051,20,213,0,13
TteS6q20VUY,LEGO Liebherr LR 11000,,Dawid Szmandra,28,2018-01-04 00:00:00,2017-12-26 09:14:49,481918,7814,193,524,0,13
oo9JMSiI55M,I THREW MY CRUSH HER OWN PROM,,ElleOfTheMills,24,2018-01-04 00:00:00,2017-12-25 20:00:02,776332,56657,1225,3476,0,3
WIWb8f1WIyQ,"PART 1 | Gwen Stefani with Blake Shelton | Instagram | December 24, 2017 | Christmas Eve with family",,Famous Celebrities Snaps,2,2018-01-04 00:00:00,2017-12-25 03:08:33,485534,0,0,784,0,23
UUreMfN5eNA,Rubik's Cube Table Version 2,,nothorwitzer,2,2018-01-04 00:00:00,2017-10-30 01:30:42,41799,679,88,118,0,26
ryr75N0nki0,Eminem - Walk On Water (Official Video) ft. Beyoncé,,EminemVEVO,10,2018-01-04 00:00:00,2017-12-24 03:30:08,17629966,682328,35479,61132,0,16
aaSEdxiITJk,Things We Need More of in 2018,,ConnorFranta,22,2018-01-04 00:00:00,2017-12-25 20:36:43,204083,29947,133,1606,0,13
dqr-AT5HvyM,HOW TO BUILD A SMART ARDUINO CAT FEEDER,,Mom Will Be Proud,26,2018-01-04 00:00:00,2017-12-25 16:26:52,28484,334,23,21,0,13
t9GNMVfEiG4,Gingerbread Cookies - You Suck at Cooking (episode 70),,You Suck At Cooking,26,2018-01-04 00:00:00,2017-12-23 15:15:22,1535269,59280,2743,6699,0,3
JFydHaV0klA,"COLLEGE KIDS REACT TO K-POP (BTS, MONSTA X, SEVENTEEN, TWICE, Red Velvet)",,FBE,24,2018-01-04 00:00:00,2017-12-23 22:00:00,2403767,110163,3862,27434,0,17
e0hO5fTGwPY,U.S. v. Whistleblower Tom Drake,,CBS News,25,2018-01-04 00:00:00,2011-05-22 23:50:01,45777,449,60,185,0,23
avnapsraeXM,Watch me draw 10 presidents,,J.J. McCullough,22,2018-01-04 00:00:00,2017-12-23 15:21:28,234260,5144,1546,1394,0,3
1qG_NwTT-2k,We did it!!: Fails You Missed #22 (December 2017) | FailArmy,,FailArmy,23,2018-01-04 00:00:00,2017-12-23 14:00:01,2251104,27656,3257,1249,0,3
pMpQABKlC-I,How To Speak Internet 101 (ft. Will Smith),,IISuperwomanII,23,2018-01-04 00:00:00,2017-12-23 21:57:30,4147252,243307,10333,22917,0,13
DcCh33lJLMw,THE YOGA CHALLENGE w/ Liza Koshy | Joey Graceffa,,Joey Graceffa,22,2018-01-04 00:00:00,2017-12-23 22:13:37,1694330,117495,1510,6024,0,3
3ToRIUoXmIw,How Fleetwood Mac Makes A Song,,Nerdwriter1,24,2018-01-04 00:00:00,2017-12-23 15:00:00,667346,35253,558,1796,0,18
JnepCulEQOo,"Watch Tesla's Secret Santa Mode!  Easter Egg with Icy Roads, Reindeer, Jingle Bells and More",,DragTimes,2,2018-01-04 00:00:00,2017-12-23 23:57:32,168863,1181,282,255,0,18
buBEYGmiAJc,60 Seconds Left - New Year Movie Countdown,,DrMachakil,1,2018-01-04 00:00:00,2017-12-25 17:49:33,26735,676,9,56,0,13
V_jU_ssWvc4,Anderson Cooper and Andy Cohen Met on a Failed Blind Date,,The Tonight Show Starring Jimmy Fallon,23,2018-01-04 00:00:00,2017-12-23 12:00:03,1106875,10862,2666,2193,0,8
kVVtBDaY8i4,The Last Jedi: Why Love Never Works in Star Wars #Reylo,,ScreenPrism,1,2018-01-04 00:00:00,2017-12-23 20:38:39,129207,4440,569,1254,0,17
q8fuvWLje8M,Philippines: Scores dead in landslides,,Al Jazeera English,25,2018-01-04 00:00:00,2017-12-23 13:02:21,148054,725,135,469,0,18
sXP6vliZIHI,Cardi B - Bartier Cardi (feat. 21 Savage) [Official Audio],,Cardi B,22,2018-01-04 00:00:00,2017-12-22 05:00:02,17540613,380464,20697,29122,0,4
4RYZEOZqWGk,Jessica Chastain's Italian In-Laws Might Hate Her,,Jimmy Kimmel Live,24,2018-01-05 00:00:00,2018-01-04 10:00:00,82052,1519,68,182,0,3
WoFqmF9GHWg,Bright | Leaked Orc Auditions Confirm Sequel Rumors | Netflix,,Netflix,24,2018-01-05 00:00:00,2018-01-03 15:08:27,300313,7198,615,1104,0,17
hGAA98YZBZw,Jon Gruden on Raiders job: There's a good chance | Golic and Wingo | ESPN,,ESPN,17,2018-01-05 00:00:00,2018-01-03 13:35:17,29769,251,24,75,0,26
Y3TmKEeBUMM,Jodie Foster Says Big Budget Films Ruin Viewing Habits - Movie Talk,,ColliderVideos,24,2018-01-05 00:00:00,2018-01-02 18:25:47,93217,2813,280,1423,0,17
F5F-gq2pyTk,What’s In Zooey In The City’s Bag | Spill It | Refinery29,,Refinery29,22,2018-01-05 00:00:00,2018-01-03 16:00:01,11133,366,25,50,0,13
iES66zqOl64,"CA Twins Born Minutes Apart, in Different Years",,Associated Press,25,2018-01-05 00:00:00,2018-01-02 23:25:23,8486,30,4,0,0,18
XZo5o1Y0h9o,How To Make a Mega Metal Foundry,,The King of Random,27,2018-01-05 00:00:00,2017-12-28 15:00:03,1247284,23967,2108,3840,0,13
Q48VduIflPk,[STATION] SMTOWN 'Dear My Family (Live Concert Ver.)' MV,,SMTOWN,10,2018-01-05 00:00:00,2017-12-29 09:00:02,2997335,381809,963,23925,0,4
PVr1BbsOwmQ,Binging With Babish Cooks Bob's Burgers For Fans,,BuzzFeedVideo,22,2018-01-05 00:00:00,2017-12-27 19:00:17,802092,19983,1058,1071,0,13
SuFMMvrf4ao,Top 10 WORST Movies 2017,,Jeremy Jahns,24,2018-01-05 00:00:00,2017-12-27 14:00:03,1402875,37177,2303,7006,0,17
pEN_htHtt_c,Deer Meets Snowman And Devours Him | The Dodo,,The Dodo,15,2018-01-05 00:00:00,2017-12-27 20:00:04,975327,7745,431,796,0,13
tAn7wxn2Atk,Drop the Mic: Pentatonix vs Bell Biv Devoe - FULL BATTLE | TBS,,TBS,24,2018-01-05 00:00:00,2017-12-27 11:55:39,1048474,16166,1633,2317,0,4
FL9BbzUYXjA,Dating a Sociopath | Hannah Stocking,,Hannah Stocking,23,2018-01-05 00:00:00,2017-12-27 17:00:16,3951217,115174,5488,4153,0,4
iYGq_qc-hWY,The Assassination of Gianni Versace: American Crime Story | Season 2: First Look | FX,,FX Networks,24,2018-01-05 00:00:00,2017-12-27 16:59:46,258521,2940,224,366,0,17
_JY-latu82Q,"Ryan Seacrest dishes on New Year's Eve, 'American Idol'",,Good Morning America,24,2018-01-05 00:00:00,2017-12-29 15:02:02,7662,52,4,3,0,3
